都道府県,市区町村,避難所名,住所,緯度,経度,避難所,一時避難所,広域避難所,地震,風水害,津波,収容人数,備蓄品,備考
奈良県,山辺郡山添村,東山公民館,奈良県山辺郡山添村桐山63番地,34.681878037403,135.97388408459,1,0,0,-,-,-,,,避難所
奈良県,生駒市,生駒台小学校,奈良県生駒市新生駒台1-33,34.709046859899,135.70226340083,1,0,0,-,-,-,,,避難場所・避難所
奈良県,北葛城郡上牧町,片岡台1丁目公民館,奈良県北葛城郡上牧町片岡台1-5,34.581290318232,135.71508392923,1,0,0,-,-,-,,,避難所
奈良県,五條市,野原公民館,奈良県五條市野原西3-4-3,34.345147808792,135.70275061857,1,0,0,-,-,-,,,指定避難所
奈良県,北葛城郡上牧町,ゆりが丘1号公園,奈良県北葛城郡上牧町下牧952-12,34.571775194013,135.71969005385,-,-,-,-,-,-,,,避難場所
奈良県,香芝市,高塚地区公園,奈良県香芝市真美ヶ丘6-11,34.545158263361,135.72235925641,-,-,-,-,-,-,,,一時避難地
奈良県,桜井市,初瀬集会所,奈良県桜井市初瀬1035,34.530766007047,135.90463078546,1,0,0,-,-,-,,,災害時避難所
奈良県,天理市,井戸堂小学校,奈良県天理市西井戸堂町301,34.587208542476,135.81471451063,1,0,0,-,-,-,,,避難所
奈良県,奈良市,南部公民館精華分館,奈良県奈良市高樋町640番地の1,34.633298896211,135.8537849365,1,0,0,-,-,-,,,第一次避難所
奈良県,吉野郡大淀町,第一保育所,奈良県吉野郡大淀町桧垣本2484-1,34.392658526418,135.78364032478,1,0,0,1,1,0,,,避難所
奈良県,奈良市,県立平城高等学校,奈良県奈良市朱雀二丁目11,34.719248827575,135.79321974306,-,-,-,-,-,-,,,第二次避難所
奈良県,北葛城郡河合町,中山台公園,奈良県北葛城郡河合町中山台1丁目12,34.582525803522,135.7221499981,-,-,-,-,-,-,,,その他緊急の避難場所
奈良県,北葛城郡河合町,大塚山児童公園,奈良県北葛城郡河合町川合935-6,34.587503531584,135.74227328391,-,-,-,-,-,-,,,その他緊急の避難場所
奈良県,吉野郡大淀町,高見台コミュニティセンター,奈良県吉野郡大淀町桧垣本2245-144,34.396341260743,135.7794490581,1,0,0,1,1,0,,,避難所
奈良県,天理市,丹波市公民館,奈良県天理市丹波市町285-2,34.596221808706,135.83410951573,1,0,0,-,-,-,,,避難所
奈良県,北葛城郡広陵町,1?7号緑地,奈良県北葛城郡広陵町馬見北5丁目-9丁目地内,34.553329607179,135.72970300684,-,-,-,-,-,-,,,避難地
奈良県,高市郡高取町,西ケ町集会所,奈良県高市郡高取町丹生谷122-1,34.437086233815,135.76312173729,1,0,0,-,-,-,,,避難所
奈良県,奈良市,登美ヶ丘北中学校体育館,奈良県奈良市北登美ヶ丘一丁目1番1号,34.723100918634,135.7529144432,1,0,0,-,-,-,,,第一次避難所
奈良県,生駒郡三郷町,立野自治連合会館,奈良県生駒郡三郷町立野北2-19-7,34.594668556484,135.68816916299,1,0,0,-,-,-,,,指定避難所
奈良県,北葛城郡上牧町,友が丘西公園,奈良県北葛城郡上牧町友が丘1-7,34.571257547017,135.71051526631,-,-,-,-,-,-,,,避難場所
奈良県,生駒郡斑鳩町,生き生きプラザ斑鳩,奈良県生駒郡斑鳩町小吉田1-12-35,34.602354113966,135.72647401553,1,0,0,-,-,-,,,指定避難場所・避難所
奈良県,宇陀市,菟田野小学校,奈良県宇陀市菟田野古市場672番地,34.469333437078,135.97437688113,1,0,0,-,-,-,,,避難場所・避難所
奈良県,吉野郡下北山村,下北山中学校体育館,奈良県吉野郡下北山村下池原666,34.038259560648,135.96328278251,1,0,0,-,-,-,,,避難地・避難所
奈良県,天理市,嘉幡保育所,奈良県天理市嘉幡町425,34.588646922312,135.79705219942,1,0,0,-,-,-,,,避難所
奈良県,五條市,中原開拓集会所,奈良県五條市大塔町中原427,34.191721019167,135.71622702023,1,0,0,-,-,-,,,指定避難所
奈良県,奈良市,三笠中学校,奈良県奈良市三条川西町3番1号,34.680139965729,135.80637761227,1,0,0,-,-,-,,,第一次避難所
奈良県,大和高田市,陵西小学校,奈良県大和高田市池田3,34.519764364845,135.72465401018,1,0,0,-,-,-,,,避難所
奈良県,吉野郡大淀町,公民館車坂分館,奈良県吉野郡大淀町下渕626,34.38989757482,135.77975747316,1,0,0,1,1,0,,,避難所
奈良県,吉野郡下市町,柿の里ホール,奈良県吉野郡下市町栃原1222-29,34.353865020545,135.78582724854,1,0,0,1,0,0,,,避難場所・避難所
奈良県,天理市,櫟本小学校,奈良県天理市櫟本町2426-1,34.619860805419,135.83097291227,1,0,0,-,-,-,,,避難所
奈良県,吉野郡上北山村,小学校グラウンド,奈良県吉野郡上北山村河合107,34.135653722892,136.00032139499,-,-,-,-,-,-,,,避難地
奈良県,生駒市,生駒南第二小学校,奈良県生駒市小平尾町927,34.654982156718,135.70781698208,1,0,0,-,-,-,,,避難場所・避難所
奈良県,北葛城郡王寺町,王寺南中学校,奈良県北葛城郡王寺町畠田9丁目1703番地,34.573484761865,135.69434150258,1,0,0,-,-,-,,,避難場所・避難所
奈良県,生駒郡平群町,白石畑集会所,奈良県生駒郡平群町白石畑231,34.628662261183,135.71797740461,-,-,-,-,-,-,,,一時集合場所
奈良県,天理市,添上高等学校,奈良県天理市櫟本町1532-2,34.620921717281,135.82320163136,1,0,0,-,-,-,,,避難所
奈良県,生駒郡斑鳩町,斑鳩西幼稚園,奈良県生駒郡斑鳩町神南2-4-31,34.598026684235,135.72018851357,1,0,0,-,-,-,,,指定避難場所・避難所
奈良県,吉野郡下市町,草谷会館,奈良県吉野郡下市町よ邑748-4,34.350935978548,135.81662061121,1,0,0,1,0,0,,,避難場所・避難所
奈良県,生駒郡三郷町,立野北2丁目自治会館,奈良県生駒郡三郷町立野北2-31-62,34.595201826809,135.68394736629,-,-,-,-,-,-,,,補助避難所
奈良県,生駒郡三郷町,西和清陵高校グラウンド,奈良県生駒郡三郷町信貴ヶ丘4-7-1,34.604059109312,135.68803844405,-,-,-,-,-,-,,,一時避難地
奈良県,吉野郡吉野町,国栖中央公民館（国栖の里総合センター）,奈良県吉野郡吉野町大字新子281,34.387214148122,135.92643149939,1,0,0,-,-,-,,,避難所
奈良県,高市郡高取町,佐田公民館,奈良県高市郡高取町佐田823,34.455120678494,135.78645798478,1,0,0,-,-,-,,,避難所
奈良県,宇陀市,旧笠間小学校,奈良県宇陀市室生上笠間444番地1,34.611471621903,136.02958273809,1,0,0,-,-,-,,,避難場所・避難所
奈良県,香芝市,特別擁護老人ホーム「すばる」,奈良県香芝市鎌田157-1,34.521836046535,135.71257733869,-,-,-,-,-,-,,,福祉避難所
奈良県,北葛城郡上牧町,上牧第2町民体育館,奈良県北葛城郡上牧町桜ケ丘3-12-3,34.574246293713,135.72013381197,1,0,0,-,-,-,,,避難所
奈良県,吉野郡下市町,阿知賀小学校,奈良県吉野郡下市町阿知賀2010,34.379279463296,135.80229216858,1,0,0,1,0,0,,,避難場所・避難所
奈良県,吉野郡黒滝村,農林トレーニングセンター,奈良県吉野郡黒滝村大字寺戸47-1,34.310659065533,135.85195860762,1,0,0,-,-,-,,,避難所
奈良県,吉野郡黒滝村,黒滝幼稚園,奈良県吉野郡黒滝村大字寺戸421-1,34.308953280121,135.84296494197,1,0,0,-,-,-,,,避難所
奈良県,橿原市,耳成小学校体育館,奈良県橿原市葛本町625,34.522029323356,135.80632148024,1,0,0,-,-,-,,,避難所
奈良県,生駒郡平群町,北信貴ヶ丘自治会館,奈良県生駒郡平群町北信貴ヶ丘2-3-29,34.610702827653,135.7090363279,-,-,-,-,-,-,,,一時集合場所
奈良県,吉野郡下市町,公民館植木分館,奈良県吉野郡下市町下市882-1,34.374478127516,135.79067341209,1,0,0,-,-,-,,,避難場所・避難所
奈良県,吉野郡十津川村,山村振興センター（商工会）,奈良県吉野郡十津川村大字武蔵10-1,33.990813851644,135.79461737684,1,0,0,-,-,-,,,避難所
奈良県,生駒郡平群町,東小学校（体育館）,奈良県生駒郡平群町吉新2-2-13,34.631081364573,135.70070637565,1,0,0,-,-,-,,,避難所・広域避難地
奈良県,奈良市,伏見南小学校体育館,奈良県奈良市宝来五丁目2番1号,34.680264443575,135.77026935185,1,0,0,-,-,-,,,第一次避難所
奈良県,北葛城郡上牧町,桜ケ丘老人憩の家,奈良県北葛城郡上牧町桜ケ丘3-34-3,34.575037806189,135.72068093426,1,0,0,-,-,-,,,避難所
奈良県,宇陀郡御杖村,小屋集会場,奈良県宇陀郡御杖村大字神末6132,34.515483566086,136.21611500661,1,0,0,-,-,-,,,避難所
奈良県,北葛城郡上牧町,貴船台公園,奈良県北葛城郡上牧町上牧4116-13,34.563286330675,135.71043209292,-,-,-,-,-,-,,,避難場所
奈良県,山辺郡山添村,さくら保育園,奈良県山辺郡山添村岩屋2740番地の1,34.641114412065,136.05105588596,1,0,0,-,-,-,,,避難所
奈良県,磯城郡川西町,式下中学校,奈良県磯城郡川西町結崎1866,34.580344184133,135.77116582479,1,0,0,-,-,-,,,一時避難場所・避難所
奈良県,奈良市,春日公民館,奈良県奈良市南京終町一丁目86番地の1,34.67190224261,135.82247653166,1,0,0,-,-,-,,,第一次避難所
奈良県,大和郡山市,筒井小学校,奈良県大和郡山市筒井町120,34.626614424589,135.78186386981,1,0,0,-,-,-,,,避難所
奈良県,橿原市,香久山体育館,奈良県橿原市南山町624,34.491794804544,135.82409549677,1,0,0,-,-,-,,,避難所
奈良県,生駒市,あすか野小学校,奈良県生駒市あすか野南2丁目5-1,34.709999583659,135.71659014986,1,0,0,-,-,-,,,避難場所・避難所
奈良県,北葛城郡上牧町,北上牧第1児童遊園,奈良県北葛城郡上牧町上牧3892,34.561513408476,135.70850869423,-,-,-,-,-,-,,,避難場所
奈良県,奈良市,朱雀小学校体育館,奈良県奈良市朱雀六丁目10番地の1,34.716729805461,135.79873315743,1,0,0,-,-,-,,,第一次避難所
奈良県,吉野郡上北山村,上北山村振興センター,奈良県吉野郡上北山村河合330,34.134315009393,136.00015663109,1,0,0,-,-,-,,,避難所
奈良県,大和郡山市,奈良県立盲学校,奈良県大和郡山市丹後庄町222-1,34.625742491802,135.78769949192,-,-,-,-,-,-,,,二次的避難所
奈良県,宇陀市,榛原幼稚園,奈良県宇陀市榛原萩原2254番地,34.531844387058,135.95637611094,1,0,0,-,-,-,,,避難場所・避難所
奈良県,五條市,阪合部文化会館,奈良県五條市中町35-1,34.335876214414,135.68025808456,1,0,0,-,-,-,,,指定避難所
奈良県,奈良市,京西中学校体育館,奈良県奈良市平松四丁目3番1号,34.674040161804,135.77636061066,1,0,0,-,-,-,,,第一次避難所
奈良県,五條市,デイサービス大塔,奈良県五條市大塔町辻堂113,34.166004374414,135.75762092078,1,0,0,-,-,-,,,指定避難所
奈良県,五條市,田園公民館,奈良県五條市田園4-14-3,34.36859434782,135.68849630856,1,0,0,-,-,-,,,指定避難所
奈良県,桜井市,上之郷公民館,奈良県桜井市小夫3266,34.572445225061,135.91563186825,1,0,0,-,-,-,,,災害時避難所
奈良県,香芝市,介護老人保健施設てんとう虫,奈良県香芝市平野23番地1,34.566168964115,135.69604705341,-,-,-,-,-,-,,,福祉避難所
奈良県,北葛城郡王寺町,中央公民館,奈良県北葛城郡王寺町久度2丁目17番21号,34.599462409012,135.70418143943,1,0,0,-,-,-,,,避難場所・避難所
奈良県,吉野郡大淀町,矢走老人憩の家,奈良県吉野郡大淀町矢走550-1,34.408298169378,135.78848150118,1,0,0,1,1,0,,,避難所
奈良県,五條市,湯塩地区高齢者福祉センター,奈良県五條市西吉野町湯塩501-1,34.303938930663,135.7301346714,1,0,0,-,-,-,,,指定避難所
奈良県,吉野郡黒滝村,中央公民館,奈良県吉野郡黒滝村大字寺戸196,34.311014516904,135.84969213193,1,0,0,-,-,-,,,避難所
奈良県,吉野郡上北山村,白川公民館,奈良県吉野郡上北山村白川214-46,34.105302739628,135.99577530007,1,0,0,-,-,-,,,避難所
奈良県,吉野郡上北山村,健康増進施設,奈良県吉野郡上北山村西原420-1,34.180772286128,136.00421361172,1,0,0,-,-,-,,,避難所
奈良県,吉野郡天川村,天川幼稚園,奈良県吉野郡天川村坪内289,34.225149460675,135.84046758665,1,0,0,-,-,-,,,避難所
奈良県,磯城郡川西町,川西町保健センター,奈良県磯城郡川西町結崎217-1,34.583613381082,135.77500151053,1,0,0,-,-,-,,,避難所
奈良県,北葛城郡広陵町,西谷近隣公園,奈良県北葛城郡広陵町馬見南2丁目地内,34.535798543681,135.73218352925,-,-,-,-,-,-,,,避難地
奈良県,奈良市,月ヶ瀬中学校及び月ヶ瀬体育館,奈良県奈良市月ヶ瀬尾山2551番地,34.710874083497,136.0432121192,1,0,0,-,-,-,,,第一次避難所
奈良県,北葛城郡河合町,上ノ山第1緑地,奈良県北葛城郡河合町穴闇992-10,34.584144872247,135.73714479788,-,-,-,-,-,-,,,その他緊急の避難場所
奈良県,葛城市,疋田フルールコミュニティセンター,奈良県葛城市疋田243-4,34.506296727624,135.72631805349,1,0,0,-,-,-,,,一時避難所
奈良県,生駒郡三郷町,信貴山東町自治会館,奈良県生駒郡三郷町信貴山東3-56,34.606606432081,135.67719783504,-,-,-,-,-,-,,,補助避難所
奈良県,北葛城郡王寺町,泉の広場公民館,奈良県北葛城郡王寺町本町4丁目645番地の1,34.581989409314,135.70139064128,1,0,0,-,-,-,,,避難場所・避難所
奈良県,大和郡山市,郡山北小学校,奈良県大和郡山市北郡山町115,34.654619913982,135.78612156833,1,0,0,-,-,-,,,避難所
奈良県,宇陀市,榛原東幼稚園,奈良県宇陀市榛原天満台西2丁目5番,34.545325144887,135.96751391458,1,0,0,-,-,-,,,避難場所・避難所
奈良県,奈良市,奈良公園,奈良県奈良市登大路町外,34.685206375349,135.84308933753,-,-,-,-,-,-,,,広域避難地
奈良県,生駒郡三郷町,三郷中学校体育館,奈良県生駒郡三郷町立野北1-3-1,34.598093149286,135.69346855897,1,0,0,-,-,-,,,一時避難地・指定避難所
奈良県,宇陀郡御杖村,御杖小学校,奈良県宇陀郡御杖村大字菅野47,34.487939850758,136.15599646782,1,0,0,-,-,-,,,避難場所・避難所
奈良県,吉野郡吉野町,橋屋林業研修会館,奈良県吉野郡吉野町大字橋屋202,34.391359300694,135.84209443633,1,0,0,-,-,-,,,避難所
奈良県,奈良市,富雄南中学校体育館,奈良県奈良市藤ノ木台一丁目5番13号,34.68139457279,135.75328743265,1,0,0,-,-,-,,,第一次避難所
奈良県,北葛城郡河合町,河合町立体育館,奈良県北葛城郡河合町池部2-13-2,34.577557387286,135.73760171343,-,-,-,-,-,-,,,２次避難所
奈良県,生駒郡安堵町,トーク安堵カルチャーセンター,奈良県生駒郡安堵町東安堵879,34.606782356323,135.75402219158,1,0,0,-,-,-,,,避難所
奈良県,宇陀市,中央公民館大宇陀分館,奈良県宇陀市大宇陀中庄202番地,34.478829167654,135.92871011887,1,0,0,-,-,-,,,避難場所・避難所
奈良県,奈良市,吐山小学校体育館,奈良県奈良市都祁吐山町3939番地,34.573620321742,135.96488672692,1,0,0,-,-,-,,,第一次避難所
奈良県,香芝市,大阪樟蔭女子大学体育館,奈良県香芝市関屋958,34.550792739436,135.66886904003,1,0,0,-,-,-,,,一時避難地・避難所
奈良県,生駒市,生駒中学校,奈良県生駒市西松ヶ丘9-19,34.698667320267,135.69373637602,1,0,0,-,-,-,,,避難場所・避難所
奈良県,宇陀市,田口地区公民館,奈良県宇陀市室生田口元上田口2061番地,34.510607729585,136.05123505577,1,0,0,-,-,-,,,避難場所・避難所
奈良県,吉野郡吉野町,河原屋公民館,奈良県吉野郡吉野町大字河原屋139,34.394065153624,135.87284155685,1,0,0,-,-,-,,,避難所
奈良県,桜井市,さくら幼稚園,奈良県桜井市粟殿480-1,34.51999684929,135.84467095692,1,0,0,-,-,-,,,災害時避難所
奈良県,吉野郡黒滝村,寺戸地区老人憩の家,奈良県吉野郡黒滝村大字寺戸306,34.308903562531,135.84853662014,1,0,0,-,-,-,,,避難所
奈良県,吉野郡十津川村,西川中学校,奈良県吉野郡十津川村大字重里465,33.961619627533,135.73774448967,1,0,0,-,-,-,,,避難所
奈良県,奈良市,大柳生小学校体育館,奈良県奈良市大柳生町832番地,34.712804894414,135.93390608258,1,0,0,-,-,-,,,第一次避難所
奈良県,香芝市,真美ヶ丘東小学校体育館,奈良県香芝市真美ヶ丘3-2-70,34.538886859991,135.72308989231,1,0,0,-,-,-,,,一時避難地・避難所
奈良県,北葛城郡河合町,西穴闇緑地,奈良県北葛城郡河合町西穴闇217-1,34.587614396635,135.73533199138,-,-,-,-,-,-,,,その他緊急の避難場所
奈良県,橿原市,婦人青少年会館,奈良県橿原市小房町11-4,34.500601355359,135.79690580144,1,0,0,-,-,-,,,避難所
奈良県,大和郡山市,片桐地区公民館,奈良県大和郡山市小泉町105-1,34.629419113208,135.76338195155,1,0,0,-,-,-,,,避難所
奈良県,香芝市,和里香芝,奈良県香芝市鎌田594番地,34.524657942264,135.71637970129,-,-,-,-,-,-,,,福祉避難所
奈良県,奈良市,中登美ヶ丘近隣公園,奈良県奈良市中登美ヶ丘三丁目,34.720737077125,135.75028972521,-,-,-,-,-,-,,,一次避難地
奈良県,吉野郡天川村,龍泉寺,奈良県吉野郡天川村洞川,34.269116705239,135.87884155234,1,0,0,-,-,-,,,避難所
奈良県,吉野郡大淀町,旧第一小学校体育館,奈良県吉野郡大淀町,34.402816071024,135.84240939053,1,0,0,1,1,0,,,避難所
奈良県,吉野郡東吉野村,東吉野村奉仕活動リハビリセンター,奈良県吉野郡東吉野村大字小670,34.392166944153,135.98146418138,1,0,0,-,-,-,,,避難地・避難所
奈良県,奈良市,青山近隣公園,奈良県奈良市青山三丁目,34.707337431232,135.83403559157,-,-,-,-,-,-,,,一次避難地
奈良県,天理市,二階堂小学校,奈良県天理市二階堂南菅田町640-1,34.594149109337,135.7958549649,1,0,0,-,-,-,,,避難所
奈良県,葛城市,コミュニティセンター,奈良県葛城市新町337,34.48214721088,135.74145050256,1,0,0,-,-,-,,,広域避難所
奈良県,山辺郡山添村,山添中学校,奈良県山辺郡山添村大西1044番地,34.682326346532,136.03707744493,1,0,0,-,-,-,,,避難所
奈良県,生駒市,総合公園体育館,奈良県生駒市小明町1807-1,34.711699333087,135.71077393,1,0,0,-,-,-,,,避難場所・避難所
奈良県,吉野郡川上村,健民グラウンド,奈良県吉野郡川上村西河,34.355590358868,135.91712786684,-,-,-,-,-,-,,,避難地
奈良県,吉野郡十津川村,平谷小学校,奈良県吉野郡十津川村大字平谷256,33.940731367686,135.77203592628,1,0,0,-,-,-,,,避難所
奈良県,吉野郡吉野町,喜佐谷多目的研修会館,奈良県吉野郡吉野町大字喜佐谷152,34.366160505421,135.89066297612,1,0,0,-,-,-,,,避難所
奈良県,奈良市,平城第3号近隣公園,奈良県奈良市右京三丁目18番地,34.719071625464,135.78641065285,-,-,-,-,-,-,,,一次避難地
奈良県,吉野郡吉野町,わかば幼稚園,奈良県吉野郡吉野町大字柳542,34.418671001874,135.91912867977,1,0,0,-,-,-,,,避難所
奈良県,大和高田市,土庫小学校,奈良県大和高田市土庫3-2-61,34.52117307861,135.75643985615,1,0,0,-,-,-,,,避難所
奈良県,北葛城郡上牧町,桜ケ丘公民館,奈良県北葛城郡上牧町桜ケ丘3-15-3,34.574201761222,135.71840894825,1,0,0,-,-,-,,,避難所
奈良県,大和高田市,文化会館,奈良県大和高田市本郷町6-36,34.513790572274,135.7442272354,1,0,0,-,-,-,,,避難所
奈良県,奈良市,興東小学校体育館,奈良県奈良市須川町1424番地,34.716856334593,135.91157819064,1,0,0,-,-,-,,,第一次避難所
奈良県,宇陀市,たかぎふるさと館,奈良県宇陀市榛原高井612番地,34.507446043619,135.99299151829,1,0,0,-,-,-,,,避難場所・避難所
奈良県,葛城市,公民館平岡分館,奈良県葛城市平岡65-1,34.4751553265,135.70867577319,1,0,0,-,-,-,,,一時避難所
奈良県,吉野郡下北山村,浦向生活改善センター,奈良県吉野郡下北山村浦向68,34.001904208277,135.95505805221,1,0,0,-,-,-,,,避難地・避難所
奈良県,高市郡高取町,上土佐公民館,奈良県高市郡高取町上土佐33-2,34.443691768414,135.80159605123,1,0,0,-,-,-,,,避難所
奈良県,葛城市,公民館南新町分館,奈良県葛城市忍海228-1,34.477411403786,135.73412073535,1,0,0,-,-,-,,,一時避難所
奈良県,五條市,牧野体育館,奈良県五條市中之町595,34.362389085224,135.67534171267,1,0,0,-,-,-,,,指定避難所
奈良県,宇陀市,榛原体育センター,奈良県宇陀市榛原長峯615番地1,34.542760180542,135.97295552888,1,0,0,-,-,-,,,避難場所・避難所
奈良県,宇陀郡御杖村,地域交流センター,奈良県宇陀郡御杖村大字神末4708,34.515316693133,136.20317454987,1,0,0,-,-,-,,,避難所
奈良県,葛城市,新庄小学校体育館,奈良県葛城市南道穗176-1,34.490006913228,135.72113840421,1,0,0,-,-,-,,,広域避難所
奈良県,山辺郡山添村,ふれあいホール,奈良県山辺郡山添村大西1367番地,34.685773915572,136.0420326054,1,0,0,-,-,-,,,避難所
奈良県,北葛城郡広陵町,広陵中学校,奈良県北葛城郡広陵町大字笠355,34.551830212546,135.74816297018,1,0,0,-,-,-,,,避難地・避難所
奈良県,橿原市,畝傍東小学校体育館,奈良県橿原市大軽町283,34.478471030686,135.80098658699,1,0,0,-,-,-,,,避難所
奈良県,五條市,永谷地区多目的集会所,奈良県五條市西吉野町永谷230,34.249172538153,135.72756875794,1,0,0,-,-,-,,,指定避難所
奈良県,磯城郡田原本町,（旧）志貴高等学校,奈良県磯城郡田原本町法貴寺1371,34.571704428107,135.80670176106,1,0,0,-,-,-,,,指定避難所
奈良県,奈良市,都跡公民館,奈良県奈良市五条町204番地の1,34.675101355049,135.78915130267,1,0,0,-,-,-,,,第一次避難所
奈良県,生駒郡三郷町,三郷中央公園,奈良県生駒郡三郷町勢野西1-2-3,34.602188461285,135.69752195172,-,-,-,-,-,-,,,一時避難地
奈良県,宇陀市,旧伊那佐小学校,奈良県宇陀市榛原山路491番地,34.495038388883,135.95829955297,1,0,0,-,-,-,,,避難場所・避難所
奈良県,吉野郡黒滝村,笠木・桂原・長瀬地区集会所,奈良県吉野郡黒滝村大字桂原118-1,34.297951254102,135.82632728738,1,0,0,-,-,-,,,避難所
奈良県,吉野郡吉野町,三茶屋生活改善センター,奈良県吉野郡吉野町大字三茶屋333-3,34.421637666654,135.93751642317,1,0,0,-,-,-,,,避難所
奈良県,吉野郡天川村,坪内老人憩の家,奈良県吉野郡天川村大字坪内37,34.223427470385,135.84052588437,1,0,0,-,-,-,,,避難所
奈良県,北葛城郡上牧町,桜ヶ丘1号公園,奈良県北葛城郡上牧町桜ヶ丘1-4,34.576385009744,135.7240055931,-,-,-,-,-,-,,,避難場所
奈良県,吉野郡下市町,桧皮蔵町会館,奈良県吉野郡下市町阿知賀112-9,34.376146868978,135.79110003616,1,0,0,1,0,0,,,避難場所・避難所
奈良県,五條市,大日川地区高齢者福祉センター,奈良県五條市西吉野町大日川452,34.284379818183,135.72284627527,1,0,0,-,-,-,,,指定避難所
奈良県,生駒郡三郷町,馬場自治会館,奈良県生駒郡三郷町立野南1-10-18,34.593127018086,135.68901642331,-,-,-,-,-,-,,,補助避難所
奈良県,吉野郡吉野町,志賀公民館,奈良県吉野郡吉野町大字志賀862-2,34.408363470802,135.87218266156,1,0,0,-,-,-,,,避難所
奈良県,北葛城郡河合町,泉台第4公園,奈良県北葛城郡河合町泉台3丁目1-552,34.591172610701,135.73628156576,-,-,-,-,-,-,,,その他緊急の避難場所
奈良県,北葛城郡河合町,泉台第3公園,奈良県北葛城郡河合町泉台3丁目1-516,34.58946807959,135.73533865498,-,-,-,-,-,-,,,その他緊急の避難場所
奈良県,生駒市,鹿ノ台ふれあいホール,奈良県生駒市鹿ノ台南2丁目3-3,34.733893822529,135.74910021419,-,-,-,-,-,-,,,避難場所
奈良県,吉野郡大淀町,県立大淀養護学校体育館,奈良県吉野郡大淀町下渕414-1,34.385914460383,135.77574404503,1,0,0,1,1,0,,,避難所
奈良県,北葛城郡広陵町,広陵北小学校,奈良県北葛城郡広陵町大字弁財天303,34.564184317473,135.74965404435,1,0,0,-,-,-,,,避難地・避難所
奈良県,吉野郡天川村,天川小学校,奈良県吉野郡天川村中谷111,34.239872925874,135.84985556673,1,0,0,-,-,-,,,避難所
奈良県,宇陀郡曽爾村,曽爾ふれあいセンター,奈良県宇陀郡曽爾村大字山粕1673,34.489393139331,136.09989956593,1,0,0,-,-,-,,,避難所
奈良県,桜井市,川合区集会所,奈良県桜井市川合253-11,34.513925396614,135.84387110369,1,0,0,-,-,-,,,災害時避難所
奈良県,桜井市,普門院,奈良県桜井市初瀬731-1,34.53451612077,135.90824484421,1,0,0,-,-,-,,,災害時避難所
奈良県,奈良市,春日中学校体育館,奈良県奈良市西木辻町67番地,34.67366590974,135.82013497454,1,0,0,-,-,-,,,第一次避難所
奈良県,生駒市,鹿ノ台中学校,奈良県生駒市鹿ノ台南2丁目16,34.733395785957,135.7479581352,1,0,0,-,-,-,,,避難場所・避難所
奈良県,奈良市,三笠公民館,奈良県奈良市大宮町四丁目313番地の3,34.682922980606,135.80868015595,1,0,0,-,-,-,,,第一次避難所
奈良県,奈良市,東之阪児童館,奈良県奈良市川上町461番地の1,34.696780257222,135.83597462388,1,0,0,-,-,-,,,第一次避難所
奈良県,奈良市,登美ヶ丘小学校体育館,奈良県奈良市西登美ヶ丘四丁目21番1号,34.720237476846,135.73887427671,1,0,0,-,-,-,,,第一次避難所
奈良県,香芝市,障がい者支援施設ゆらくの里,奈良県香芝市尼寺616番地,34.574603846194,135.68448395886,-,-,-,-,-,-,,,福祉避難所
奈良県,五條市,南阿太公民館,奈良県五條市滝町504,34.360971749895,135.75032716712,1,0,0,-,-,-,,,指定避難所
