都道府県,市区町村,避難所名,住所,緯度,経度,避難所,一時避難所,広域避難所,地震,風水害,津波,収容人数,備蓄品,備考
奈良県,御所市,こども家庭相談センター,奈良県御所市幸町188-2,34.449905,135.726133,1,0,0,-,-,-,143人,,
奈良県,御所市,西戸毛集会所,奈良県御所市戸毛909-3,34.4340133,135.759788,1,0,0,-,-,-,55人,,
奈良県,御所市,御所小学校,奈良県御所市610,34.4639912,135.741209,1,0,1,-,-,-,315人,,体育館
奈良県,御所市,秋津小学校,奈良県御所市池之内459-3,34.449175,135.738355,1,0,1,-,-,-,324人,,体育館
奈良県,御所市,いきいきライフセンター,奈良県御所市774-1,34.461065,135.739344,1,0,0,-,-,-,192人,,多目的ホール
奈良県,御所市,防災センター,奈良県御所市鴨神791,34.4039422,135.707871,1,0,0,-,-,-,191人,,
奈良県,御所市,大正小学校,奈良県御所市櫛羅2198-1,34.461578,135.724068,1,0,1,-,-,-,490人,,体育館
奈良県,御所市,御所スポーツクラブ（旧幸町児童館）,奈良県御所市幸町189-3,34.449789,135.7258497,1,0,0,-,-,-,127人,,体育室等
奈良県,御所市,御所中学校,奈良県御所市御所６６５?１,34.466089,135.741758,1,0,1,-,-,-,612人,,体育館
奈良県,御所市,アザレアホール,奈良県御所市13,34.464099,135.739923,1,0,0,-,-,-,112人,,文化ホール
奈良県,御所市,大正幼稚園,御所市櫛羅2190,34.4611383,135.721941,1,0,0,-,-,-,65人,,リズム室
奈良県,御所市,老人福祉センター,奈良県御所市櫛羅1281,34.4611,135.70851,1,0,0,-,-,-,151人,,集会室等
奈良県,御所市,大正中学校,奈良県御所市三室206-1,34.462175,135.72763,1,0,1,-,-,-,512人,,体育館
奈良県,御所市,葛城学童保育所,奈良県御所市栗阪215,34.4258955,135.725439,1,0,0,-,-,-,93人,,体育室等
奈良県,御所市,葛小学校・中学校,奈良県御所市樋野270,34.422142,135.753748,1,0,1,-,-,-,457人,,体育館
奈良県,御所市,文化財事務所（旧秋津文化センター）,奈良県御所市室102・104-1,34.442411,135.729499,1,0,0,-,-,-,123人,,
奈良県,御所市,（旧）葛中学校,奈良県御所市古瀬341,34.422178,135.751372,1,0,1,-,-,-,224人,,体育館
奈良県,御所市,掖上小学校,奈良県御所市東寺田55,34.460693,135.756971,1,0,1,-,-,-,324人,,体育館
奈良県,御所市,御所実業高等学校,奈良県御所市玉出300,34.455492,135.746101,1,0,1,-,-,-,561人,,体育館
奈良県,御所市,御所幼児園,奈良県御所市1-9,34.464276,135.739211,1,0,0,-,-,-,96人,,リズム室
奈良県,桜井市,関西中央高校,奈良県桜井市桜井502,34.507601216652,135.85588138838,1,0,0,-,-,-,,,一次避難地・災害時避難所
奈良県,御所市,葛上中学校,奈良県御所市佐田1-1,34.433717,135.715086,1,0,1,-,-,-,459人,,体育館
奈良県,御所市,（旧）小林ふれあいセンター,奈良県御所市小林330,34.4672658,135.715650,1,0,0,-,-,-,318人,,
奈良県,御所市,名柄小学校,奈良県御所市名柄185,34.4408171,135.715148,1,0,1,-,-,-,347人,,体育館
奈良県,御所市,（旧）中央公民館,奈良県御所市三室117,34.4586406,135.729958,1,0,0,-,-,-,280人,,会議室等
奈良県,御所市,秋津学童保育所,奈良県御所市室102-2,34.442564,135.729367,1,0,0,-,-,-,66人,,体育室等
奈良県,五條市,牧野小学校,奈良県五條市中之町921,34.366758167296,135.67798316364,1,0,0,-,-,-,,,指定避難所
奈良県,御所市,秋津幼児園,奈良県御所市室484-1,34.4482413,135.738553,1,0,0,-,-,-,52人,,遊戯室
奈良県,奈良市,県立奈良養護学校,奈良県奈良市七条町135番地,34.661941610737,135.79108213299,-,-,-,-,-,-,,,第二次避難所
奈良県,御所市,葛城小学校,奈良県御所市林329,34.419761,135.718099,1,0,1,-,-,-,300人,,体育館
奈良県,御所市,葛城保育所,奈良県御所市五百家75,34.4171999,135.717151,1,0,0,-,-,-,90人,,遊戯室
奈良県,生駒市,サンヨースポーツセンター体育館,奈良県生駒市高山町166-2,34.770112705078,135.70976986978,1,0,0,-,-,-,,,避難場所・避難所
奈良県,北葛城郡上牧町,松里園公民館,奈良県北葛城郡上牧町松里園1-11-11,34.551346137967,135.71078232786,1,0,0,-,-,-,,,避難所
奈良県,御所市,(旧) 御所東高等学校,奈良県御所市南十三15-1,34.4674593,135.748087,1,0,1,-,-,-,373人,,体育館
奈良県,天理市,北保育所,奈良県天理市石上町511-2,34.614778041474,135.83084528823,1,0,0,-,-,-,,,避難所
奈良県,御所市,介護予防センター,奈良県御所市戸毛1032,34.429886,135.758882,1,0,0,-,-,-,143人,,
奈良県,吉野郡吉野町,尾仁山老人憩の家,奈良県吉野郡吉野町大字上市2067-4,34.395158972672,135.84629674086,1,0,0,-,-,-,,,避難所
奈良県,北葛城郡広陵町,広陵北体育館,奈良県北葛城郡広陵町大字大野546-1,34.567622739507,135.74718748667,1,0,0,-,-,-,,,避難所
奈良県,天理市,朝和公民館,奈良県天理市三昧田町460-3,34.575318635381,135.84077902157,1,0,0,-,-,-,,,避難所
奈良県,五條市,旧西吉野小学校,奈良県五條市西吉野町宗川野77-1,34.263821421016,135.74850552945,1,0,0,-,-,-,,,指定避難所
奈良県,大和郡山市,片桐中学校,奈良県大和郡山市小泉町173-1,34.628474622474,135.7610265385,1,0,0,-,-,-,,,避難所
奈良県,御所市,中央公民館,奈良県御所市元町382-1,34.469437,135.730059,1,0,0,-,-,-,490人,,
奈良県,奈良市,県立奈良西養護学校,奈良県奈良市帝塚山西2丁目1-1,34.679480359196,135.72627347798,-,-,-,-,-,-,,,第二次避難所
奈良県,御所市,人権センター,奈良県御所市柏原235,34.460552,135.76093,1,0,0,-,-,-,473人,,
奈良県,桜井市,初瀬小学校,奈良県桜井市初瀬1556,34.527208024389,135.89945605952,1,0,0,-,-,-,,,一次避難地・災害時避難所
奈良県,北葛城郡河合町,高塚台第2緑地,奈良県北葛城郡河合町高塚台2丁目2-1,34.58546172352,135.72994640477,-,-,-,-,-,-,,,その他緊急の避難場所
奈良県,天理市,櫟本公民館,奈良県天理市櫟本町2064-2,34.622493871359,135.82841213395,1,0,0,-,-,-,,,避難所
奈良県,大和高田市,総合福祉会館,奈良県大和高田市池田418-1,34.519486745195,135.73143383301,1,0,0,-,-,-,,,避難所
奈良県,五條市,大峯桧川迫集会所,奈良県五條市西吉野町大峯226-1,34.278836619804,135.78528030294,1,0,0,-,-,-,,,指定避難所
奈良県,御所市,掖上保育所,奈良県御所市東寺田54,34.4606812,135.758166,1,0,0,-,-,-,48人,,
奈良県,吉野郡吉野町,吉野北小学校,奈良県吉野郡吉野町大字平尾87,34.411388272258,135.88406767684,1,0,0,-,-,-,,,避難所
奈良県,御所市,産業振興センター,奈良県御所市元町1-1,34.471441,135.725032,1,0,0,-,-,-,167人,,多目的ホール等
奈良県,北葛城郡王寺町,王寺小学校,奈良県北葛城郡王寺町本町2丁目6番16号,34.588524793892,135.70444565876,1,0,0,-,-,-,,,避難場所・避難所
奈良県,北葛城郡広陵町,竹取公園,奈良県北葛城郡広陵町大字三吉地内,34.555419300298,135.73672290701,-,-,-,-,-,-,,,避難地
奈良県,宇陀市,田原小学校,奈良県宇陀市大宇田原727番地,34.445025253888,135.95377607592,1,0,0,-,-,-,,,避難場所・避難所
奈良県,香芝市,下田小学校体育館,奈良県香芝市下田西2-9-41,34.545318893968,135.70124711017,1,0,0,-,-,-,,,一時避難地・避難所
奈良県,宇陀市,宇陀市文化会館,奈良県宇陀市大宇陀拾生871番地,34.47522909164,135.93251992848,1,0,0,-,-,-,,,避難場所・避難所
奈良県,御所市,葛公民館,奈良県御所市戸毛979-1,34.4318929,135.759032,1,0,1,-,-,-,178人,,多目的ホール等
奈良県,宇陀市,大宇陀体育館,奈良県宇陀市大宇陀拾生89番地,34.476330254313,135.92822490328,1,0,0,-,-,-,,,避難場所・避難所
奈良県,御所市,葛学童保育所,奈良県御所市戸毛1035-1,34.429687,135.758968,1,0,0,-,-,-,147人,,体育室等
奈良県,北葛城郡河合町,城古集会所,奈良県北葛城郡河合町川合909-1,34.587586894274,135.74453424877,1,0,0,-,-,-,,,１次避難所
奈良県,奈良市,青和小学校体育館,奈良県奈良市百楽園四丁目1番1号,34.700528448669,135.74288552645,1,0,0,-,-,-,,,第一次避難所
奈良県,五條市,二見公民館,奈良県五條市二見2-5-1,34.344186739772,135.68588234931,1,0,0,-,-,-,,,指定避難所
奈良県,生駒郡三郷町,農住3号公園,奈良県生駒郡三郷町立野南2-8-22,34.589798773773,135.68634336596,-,-,-,-,-,-,,,一時避難地
奈良県,宇陀市,農林会館,奈良県宇陀市榛原下井足825番地,34.520882500472,135.94801420489,1,0,0,-,-,-,,,避難場所・避難所
奈良県,御所市,青翔高等学校,奈良県御所市525,34.4588363,135.733160,1,0,1,-,-,-,636人,,体育館
奈良県,宇陀市,室生西小学校,奈良県宇陀市室生大野1912番地,34.56348188373,136.01353549791,1,0,0,-,-,-,,,避難場所・避難所
奈良県,天理市,丹波市小学校,奈良県天理市丹波市町180,34.594541323555,135.83019886044,1,0,0,-,-,-,,,避難所
奈良県,生駒市,図書会館,奈良県生駒市辻町238,34.696362158208,135.7085215822,1,0,0,-,-,-,,,避難場所・避難所
奈良県,五條市,阪本集会所,奈良県五條市大塔町阪本499,34.206110608974,135.73760794601,1,0,0,-,-,-,,,指定避難所
奈良県,生駒郡三郷町,里ヶ丘・緑ヶ丘第1児童公園,奈良県生駒郡三郷町勢野西5-4-1,34.606902672699,135.69006817195,-,-,-,-,-,-,,,一時避難地
奈良県,葛城市,公民館林堂分館,奈良県葛城市林堂284-3,34.480441164604,135.72074968509,1,0,0,-,-,-,,,一時避難所
奈良県,生駒市,中央公民館,奈良県生駒市北新町9-28,34.693947057561,135.69668164093,1,0,0,-,-,-,,,避難場所・避難所
奈良県,御所市,小林保育所,奈良県御所市小林340-1,34.4673637,135.715081,1,0,0,-,-,-,40人,,リズム室
奈良県,宇陀市,室生高齢者等ふれあい館,奈良県宇陀市室生上笠間444番地1,34.611900267718,136.02915575285,1,0,0,-,-,-,,,避難場所・避難所
奈良県,吉野郡東吉野村,光蔵寺,奈良県吉野郡東吉野村大字伊豆尾544,34.411404948975,136.01881230755,1,0,0,-,-,-,,,避難所
奈良県,吉野郡東吉野村,厳泉寺,奈良県吉野郡東吉野村大字狭戸373,34.377197982274,135.99964578546,1,0,0,-,-,-,,,避難所
奈良県,吉野郡東吉野村,東吉野村役場駐車場,奈良県吉野郡東吉野村大字小川,34.402974899687,135.96819956526,-,-,-,-,-,-,,,避難地
奈良県,桜井市,戒重区会所,奈良県桜井市戒重45、46,34.511425645729,135.83731336346,1,0,0,-,-,-,,,災害時避難所
奈良県,吉野郡下市町,公民館惣上分館,奈良県吉野郡下市町下市455-4,34.370680190591,135.7898932697,1,0,0,-,-,-,,,避難場所・避難所
奈良県,大和高田市,浮孔西小学校,奈良県大和高田市曽大根1丁目5-1,34.498650871845,135.73921977393,1,0,0,-,-,-,,,避難所
奈良県,御所市,クリーンセンター,奈良県御所市栗阪293,34.430293,135.727381,1,0,1,-,-,-,74人,,研修室
奈良県,天理市,福祉センター,奈良県天理市福住町4890,34.605674587842,135.90256218877,1,0,0,-,-,-,,,避難所
奈良県,北葛城郡上牧町,友が丘公民館,奈良県北葛城郡上牧町友が丘1-10-15,34.57237687926,135.713559395,1,0,0,-,-,-,,,避難所
奈良県,奈良市,登美ヶ丘公民館,奈良県奈良市中登美ヶ丘三丁目4162番地の81,34.719756881335,135.74862329309,1,0,0,-,-,-,,,第一次避難所
奈良県,高市郡高取町,清水谷公民館,奈良県高市郡高取町清水谷298-1,34.438758874674,135.7999518849,1,0,0,-,-,-,,,避難所
奈良県,橿原市,真菅小学校体育館,奈良県橿原市曽我町710,34.514002108348,135.7779934414,1,0,0,-,-,-,,,避難所
奈良県,北葛城郡河合町,河合第三小学校,奈良県北葛城郡河合町高塚台3-4-2,34.579926236967,135.72697748659,1,0,0,-,-,-,,,一時避難場所・２次避難所
奈良県,天理市,三島体育館,奈良県天理市三島町140-1,34.603536857372,135.83693458619,1,0,0,-,-,-,,,避難所
奈良県,御所市,やまと広域環境衛生事務組合（旧葛城文化センター）,奈良県御所市栗阪177,34.4249014,135.724978,1,0,0,-,-,-,114人,,
奈良県,高市郡高取町,市尾公民館,奈良県高市郡高取町市尾751,34.441646950849,135.77340396274,1,0,0,-,-,-,,,避難所
奈良県,北葛城郡河合町,長楽公民館,奈良県北葛城郡河合町長楽87-3地先,34.58295977778,135.74583979804,1,0,0,-,-,-,,,１次避難所
奈良県,生駒郡平群町,若葉台集会所,奈良県生駒郡平群町若葉台1-3-8,34.636036587707,135.69517913516,-,-,-,-,-,-,,,一時集合場所
奈良県,葛城市,公民館當麻分館,奈良県葛城市當麻大橋方189,34.514900727379,135.70092291865,1,0,0,-,-,-,,,一時避難所
奈良県,吉野郡下市町,丹生小学校,奈良県吉野郡下市町谷18,34.308302941213,135.8013014633,1,0,0,1,0,0,,,避難場所・避難所
奈良県,高市郡高取町,丹生谷総合センター,奈良県高市郡高取町丹生谷1060,34.430517518312,135.76199986218,1,0,0,-,-,-,,,避難所
奈良県,生駒郡平群町,北小学校（体育館）,奈良県生駒郡平群町緑ヶ丘1-4-1,34.644191417024,135.69820385463,1,0,0,-,-,-,,,避難所・広域避難地
奈良県,高市郡明日香村,明日香小学校,奈良県高市郡明日香村橘86,34.468394641484,135.81169733529,1,0,0,-,-,-,,,避難所
奈良県,北葛城郡河合町,広瀬台公園,奈良県北葛城郡河合町広瀬台2丁目9,34.584450616871,135.72434692997,-,-,-,-,-,-,,,その他緊急の避難場所
奈良県,北葛城郡上牧町,朋部老人憩の家,奈良県北葛城郡上牧町朋部台1-3-41,34.568814640068,135.71446554477,1,0,0,-,-,-,,,避難所
奈良県,吉野郡下市町,公民館栄町分館,奈良県吉野郡下市町下市323,34.362994889254,135.79345430132,1,0,0,-,-,-,,,避難場所・避難所
奈良県,吉野郡東吉野村,東吉野村運動公園体育館,奈良県吉野郡東吉野村大字中黒1222,34.380890258338,135.94136659446,1,0,0,-,-,-,,,避難地・避難所
奈良県,奈良市,帯解小学校体育館,奈良県奈良市柴屋町9番地,34.644727606263,135.82907902261,1,0,0,-,-,-,,,第一次避難所
奈良県,五條市,野原東住民センター,奈良県五條市野原東2-7-26,34.349383548942,135.71630791531,1,0,0,-,-,-,,,指定避難所
奈良県,吉野郡下市町,下市温泉秋津荘,奈良県吉野郡下市町よ邑2207,34.352533826266,135.80780976772,1,0,0,1,0,0,,,避難場所・避難所
奈良県,吉野郡下市町,瀬ノ上会館,奈良県吉野郡下市町阿知賀2660-2,34.384128989645,135.80840273073,1,0,0,1,0,0,,,避難場所・避難所
奈良県,北葛城郡河合町,河合町中央公民館,奈良県北葛城郡河合町池部2-13-1,34.577362890964,135.73687676857,-,-,-,-,-,-,,,２次避難所
奈良県,生駒郡平群町,光ヶ丘自治会館,奈良県生駒郡平群町光ヶ丘1-15-12,34.624637516292,135.70059246928,-,-,-,-,-,-,,,一時集合場所
奈良県,吉野郡野迫川村,野迫川村健民グランド,奈良県吉野郡野迫川村中,34.20896273122,135.66751157766,-,-,-,-,-,-,,,避難地
奈良県,生駒市,北コミュニティセンターISTAはばたき,奈良県生駒市上町1543,34.718584994201,135.72247292247,1,0,0,-,-,-,,,避難場所・避難所
奈良県,生駒郡斑鳩町,斑鳩中学校,奈良県生駒郡斑鳩町龍田北1-20-1,34.612675055417,135.72549323643,1,0,0,-,-,-,,,指定避難場所・避難所
奈良県,天理市,二階堂体育館,奈良県天理市嘉幡町520,34.591624386013,135.79625139459,1,0,0,-,-,-,,,避難所
奈良県,生駒郡平群町,健民運動場,奈良県生駒郡平群町,34.633886459,135.69529852123,-,-,-,-,-,-,,,広域避難地
奈良県,宇陀郡御杖村,老人福祉センター,奈良県宇陀郡御杖村大字菅野1581,34.487133936682,136.16738423835,1,0,0,-,-,-,,,避難場所・避難所
奈良県,五條市,白銀北体育館,奈良県五條市西吉野町平沼田1680,34.326890778255,135.74618550104,1,0,0,-,-,-,,,指定避難所
奈良県,吉野郡東吉野村,旧四郷小学校体育館,奈良県吉野郡東吉野村大字三尾51-1,34.376977549363,135.99352464613,1,0,0,-,-,-,,,避難地・避難所
奈良県,高市郡明日香村,国営飛鳥歴史公園石舞台地区,奈良県高市郡明日香村島庄,34.466255670948,135.82623900733,-,-,-,-,-,-,,,一時避難場所
奈良県,五條市,中原集会所,奈良県五條市大塔町中原311-2,34.191717719679,135.71623261975,1,0,0,-,-,-,,,指定避難所
奈良県,吉野郡天川村,ほほえみポート天川,奈良県吉野郡天川村南日裏200番地,34.227776954463,135.84112582048,1,0,0,-,-,-,,,避難所
奈良県,生駒郡三郷町,三室自治会館,奈良県生駒郡三郷町三室1-2-18,34.604439635892,135.70679497264,-,-,-,-,-,-,,,補助避難所
奈良県,高市郡高取町,グリーンタウン集会所,奈良県高市郡高取町,34.438125788878,135.7936937579,1,0,0,-,-,-,,,避難所
奈良県,吉野郡上北山村,郷土文化伝承施設,奈良県吉野郡上北山村小橡721-1,34.150726352541,136.01499989827,1,0,0,-,-,-,,,避難所
奈良県,吉野郡大淀町,福神中央公園,奈良県吉野郡大淀町福神350-5,34.39314786954,135.74688648331,-,-,-,-,-,-,,,避難地
奈良県,生駒郡三郷町,三室児童遊園地,奈良県生駒郡三郷町三室1-2-18,34.604617116051,135.70692495702,-,-,-,-,-,-,,,一時避難地
奈良県,大和高田市,高田中学校,奈良県大和高田市大中東町5-48,34.513287754239,135.73924713837,1,0,0,-,-,-,,,避難所
奈良県,高市郡高取町,藤井公民館,奈良県高市郡高取町藤井393,34.438566900804,135.78178113286,1,0,0,-,-,-,,,避難所
奈良県,生駒市,壱分小学校,奈良県生駒市壱分町356-1,34.671725357515,135.71611888174,1,0,0,-,-,-,,,避難場所・避難所
奈良県,北葛城郡広陵町,新山緑地,奈良県北葛城郡広陵町みささぎ台8番地内,34.533387759827,135.73318902198,-,-,-,-,-,-,,,避難地
奈良県,高市郡高取町,観覚寺公民館,奈良県高市郡高取町観覚寺12-1,34.450807500916,135.79780434817,1,0,0,-,-,-,,,避難所
奈良県,吉野郡天川村,栃尾地区生活改善センター,奈良県吉野郡天川村栃尾,34.202576060704,135.82231340114,1,0,0,-,-,-,,,避難所
奈良県,吉野郡下北山村,大小井交流会館,奈良県吉野郡下北山村下桑原560-1,34.028104991072,135.97164204266,1,0,0,-,-,-,,,避難地・避難所
奈良県,香芝市,旭ケ丘小学校体育館,奈良県香芝市旭ケ丘3-1-3,34.555814641347,135.69502800609,1,0,0,-,-,-,,,一時避難地・避難所
奈良県,吉野郡下市町,山崎会館,奈良県吉野郡下市町下市595-4,34.378421101747,135.78772101783,1,0,0,1,0,0,,,避難場所・避難所
奈良県,生駒市,セラビーいこま,奈良県生駒市東新町1-3,34.692809684869,135.69898062617,1,0,0,-,-,-,,,避難場所・避難所
奈良県,奈良市,鶴舞小学校体育館,奈良県奈良市鶴舞東町2番1号,34.706638916068,135.75160951592,1,0,0,-,-,-,,,第一次避難所
奈良県,五條市,南宇智公民館,奈良県五條市霊安寺町2016-3,34.335368420782,135.70121194649,1,0,0,-,-,-,,,指定避難所
奈良県,宇陀郡曽爾村,曽爾村児童館,奈良県宇陀郡曽爾村大字山粕1286,34.489129174936,136.09620543208,1,0,0,-,-,-,,,避難所
奈良県,吉野郡大淀町,町文化会館,奈良県吉野郡大淀町桧垣本2090,34.389620000388,135.78958727637,1,0,0,1,1,0,,,避難所
奈良県,吉野郡大淀町,吉野路大淀iセンター,奈良県吉野郡大淀町芦原536-1,34.412283956233,135.79691409206,1,0,0,1,1,0,,,避難所
奈良県,葛城市,笛堂コミュニティセンター,奈良県葛城市笛堂240-1,34.487985507822,135.74127540096,1,0,0,-,-,-,,,一時避難所
奈良県,北葛城郡河合町,河合第一中学校,奈良県北葛城郡河合町池部1-13-1,34.580329250234,135.73760161337,1,0,0,-,-,-,,,一時避難場所・２次避難所
奈良県,高市郡高取町,丹生谷解放会館,奈良県高市郡高取町,34.430508018974,135.76195896605,1,0,0,-,-,-,,,避難所
奈良県,北葛城郡広陵町,広陵東体育館,奈良県北葛城郡広陵町大字百済1801-1,34.546711702814,135.75995419108,1,0,0,-,-,-,,,避難所
奈良県,五條市,五條高等学校,奈良県五條市岡町1428,34.370555577643,135.69497338873,1,0,0,-,-,-,,,指定避難所
奈良県,奈良市,富雄北小学校体育館,奈良県奈良市富雄北一丁目13番6号,34.696964885204,135.73302261522,1,0,0,-,-,-,,,第一次避難所
奈良県,葛城市,公民館柿本分館,奈良県葛城市柿本145,34.490893223951,135.72921546174,1,0,0,-,-,-,,,一時避難所
奈良県,宇陀郡御杖村,西町集会所,奈良県宇陀郡御杖村大字神末861-1,34.496566598198,136.19341450219,1,0,0,-,-,-,,,避難場所・避難所
奈良県,吉野郡野迫川村,（旧）野川小学校,奈良県吉野郡野迫川村中369,34.209084409655,135.66710880775,1,0,0,-,-,-,,,避難地・避難所
奈良県,奈良市,県立西の京高等学校,奈良県奈良市六条西三丁目24-1,34.668118301328,135.76735035419,-,-,-,-,-,-,,,第二次避難所
奈良県,五條市,新町公民館,奈良県五條市新町1-7-10,34.349030393889,135.69117368509,1,0,0,-,-,-,,,指定避難所
奈良県,北葛城郡広陵町,図書館,奈良県北葛城郡広陵町大字三吉396-1,34.553179769149,135.73586363965,1,0,0,-,-,-,,,避難所
奈良県,橿原市,畝傍中学校体育館,奈良県橿原市石川町204,34.484253602296,135.80140866106,1,0,0,-,-,-,,,避難所
奈良県,北葛城郡河合町,中山台集会所,奈良県北葛城郡河合町中山台1-16,34.581059357351,135.72074737298,1,0,0,-,-,-,,,１次避難所
奈良県,桜井市,桜井西小学校,奈良県桜井市上之庄594-1,34.518210870459,135.8391048218,1,0,0,-,-,-,,,一次避難地・災害時避難所
奈良県,北葛城郡広陵町,みささぎ公園,奈良県北葛城郡広陵町みささぎ台22番地地内,34.528993768764,135.73173913981,-,-,-,-,-,-,,,避難地
奈良県,吉野郡川上村,ふれあいセンター,奈良県吉野郡川上村北和田312,34.294661021479,136.00375148498,1,0,0,-,-,-,,,避難所
奈良県,桜井市,まほろばセンター,奈良県桜井市桜井1259,34.51263668142,135.8458098666,1,0,0,-,-,-,,,災害時避難所
奈良県,奈良市,ならまちセンター,奈良県奈良市東寺林町38番地,34.679895937262,135.83139495347,-,-,-,-,-,-,,,第二次避難所
奈良県,葛城市,南道穂コミュニティセンター,奈良県葛城市南道穗86-4,34.488076626027,135.72440204266,1,0,0,-,-,-,,,一時避難所
奈良県,吉野郡黒滝村,粟飯谷地区集会所,奈良県吉野郡黒滝村大字粟飯谷224,34.324804438492,135.83787126678,1,0,0,-,-,-,,,避難所
奈良県,北葛城郡上牧町,三軒屋公民館,奈良県北葛城郡上牧町大字上牧3025,34.563603113324,135.72020079404,1,0,0,-,-,-,,,避難所
奈良県,生駒郡斑鳩町,消防コミュニティセンター,奈良県生駒郡斑鳩町龍田南5-7-47,34.605506418066,135.72237421873,1,0,0,-,-,-,,,指定避難場所・避難所
奈良県,香芝市,関屋小学校体育館,奈良県香芝市関屋北5-7-1,34.560758304682,135.66769143107,1,0,0,-,-,-,,,一時避難地・避難所
奈良県,宇陀市,駒帰地区集落集会所,奈良県宇陀市菟田野駒帰185番地5,34.463712820937,135.98044605267,1,0,0,-,-,-,,,避難場所・避難所
奈良県,生駒郡平群町,平群幼稚園,奈良県生駒郡平群町吉新3-1-12,34.630648105773,135.70259793138,1,0,0,-,-,-,,,避難所
奈良県,吉野郡吉野町,吉野中学校,奈良県吉野郡吉野町大字河原屋200,34.396014941258,135.87362470755,1,0,0,-,-,-,,,避難所
奈良県,吉野郡吉野町,中村公民館,奈良県吉野郡吉野町大字柳623,34.421651219941,135.92031479029,1,0,0,-,-,-,,,避難所
奈良県,吉野郡下市町,下市ふれあいセンター,奈良県吉野郡下市町新住253,34.379840242663,135.78171315605,1,0,0,1,0,0,,,避難場所・避難所
奈良県,五條市,老人憩の家,奈良県五條市霊安寺町2205,34.336109998641,135.69874552072,1,0,0,-,-,-,,,指定避難所
奈良県,吉野郡下市町,下市町コミュニティ防災センター,奈良県吉野郡下市町下市48-1,34.375282513151,135.78797108232,1,0,0,-,-,-,,,避難場所・避難所
奈良県,宇陀郡曽爾村,丸瀬集会所,奈良県宇陀郡曽爾村大字伊賀見1525,34.542664243803,136.15181011415,1,0,0,-,-,-,,,避難所
奈良県,吉野郡下市町,西山生活改善センター,奈良県吉野郡下市町西山597-1,34.295168221193,135.78551635404,1,0,0,1,0,0,,,避難場所・避難所
奈良県,磯城郡田原本町,青垣生涯学習センター,奈良県磯城郡田原本町阪手233-1,34.557739194163,135.80228844365,1,0,0,-,-,-,,,指定避難所
奈良県,北葛城郡河合町,南山西公園,奈良県北葛城郡河合町西穴闇456-13,34.585433881136,135.73605341436,-,-,-,-,-,-,,,その他緊急の避難場所
奈良県,吉野郡下市町,惣阪会館,奈良県吉野郡下市町広橋441,34.338244483654,135.81173973643,1,0,0,1,0,0,,,避難場所・避難所
奈良県,奈良市,平城西公民館,奈良県奈良市神功四丁目25番地,34.720605287482,135.77740076614,1,0,0,-,-,-,,,第一次避難所
奈良県,北葛城郡上牧町,桜ヶ丘公園,奈良県北葛城郡上牧町桜ヶ丘3-34-1,34.574499086126,135.72123371494,-,-,-,-,-,-,,,避難場所
奈良県,磯城郡川西町,下永体育館,奈良県磯城郡川西町下永1248-1,34.588599662051,135.79429414829,1,0,0,-,-,-,,,避難所
奈良県,香芝市,二上小学校体育館,奈良県香芝市畑4-573,34.539791532636,135.68810656869,1,0,0,-,-,-,,,一時避難地・避難所
