都道府県,市区町村,避難所名,住所,緯度,経度,避難所,一時避難所,広域避難所,地震,風水害,津波,収容人数,備蓄品,備考
奈良県,奈良市,鼓阪北小学校体育館,奈良県奈良市青山九丁目3番地の1,34.708245708026,135.83712137137,1,0,0,-,-,-,,,第一次避難所
奈良県,生駒郡斑鳩町,中央体育館,奈良県生駒郡斑鳩町龍田南1-1-61,34.606950896095,135.73071521519,1,0,0,-,-,-,,,指定避難場所・避難所
奈良県,吉野郡東吉野村,東吉野村中央公民館,奈良県吉野郡東吉野村大字小川475,34.402012802006,135.97183410003,1,0,0,-,-,-,,,避難所
奈良県,五條市,阪合部小学校,奈良県五條市中町31,34.33511503189,135.67904981873,1,0,0,-,-,-,,,指定避難所
奈良県,宇陀市,守道小学校,奈良県宇陀市大宇陀守道857番地1,34.469263446345,135.95395478415,1,0,0,-,-,-,,,避難場所・避難所
奈良県,北葛城郡上牧町,松ヶ丘公園,奈良県北葛城郡上牧町朋部台2-3553-22,34.568996759836,135.71200072575,-,-,-,-,-,-,,,避難場所
奈良県,生駒郡三郷町,農住記念会館,奈良県生駒郡三郷町立野南2-6-22,34.590527297889,135.68548072852,-,-,-,-,-,-,,,補助避難所
奈良県,橿原市,耳成南小学校体育館,奈良県橿原市常磐町3,34.518770844299,135.80941839923,1,0,0,-,-,-,,,避難所
奈良県,吉野郡吉野町,入野生活改善センター,奈良県吉野郡吉野町大字入野746-2,34.398751307237,135.92438979351,1,0,0,-,-,-,,,避難所
奈良県,宇陀市,大和富士ホール,奈良県宇陀市榛原天満台西2丁目45番4,34.544935534735,135.96872317541,1,0,0,-,-,-,,,避難場所・避難所
奈良県,五條市,中央体育館,奈良県五條市本町3-1-13,34.353204218354,135.69151403744,1,0,0,-,-,-,,,指定避難所
奈良県,生駒郡平群町,若井集会所,奈良県生駒郡平群町若井425-7,34.620696157828,135.69929817702,-,-,-,-,-,-,,,一時集合場所
奈良県,吉野郡十津川村,上野地小学校,奈良県吉野郡十津川村大字上野地221,34.099218133044,135.76007171791,1,0,0,-,-,-,,,避難所
奈良県,吉野郡東吉野村,伊豆尾公民館,奈良県吉野郡東吉野村大字伊豆尾234,34.415273995962,136.01820680353,1,0,0,-,-,-,,,避難所
奈良県,吉野郡十津川村,西川第一小学校体育館,奈良県吉野郡十津川村大字永井239,33.969937997107,135.73568066714,1,0,0,-,-,-,,,避難所
奈良県,吉野郡吉野町,南大野八坂会館,奈良県吉野郡吉野町大字南大野224-2,34.388802701557,135.92032365776,1,0,0,-,-,-,,,避難所
奈良県,香芝市,志都美小学校体育館,奈良県香芝市今泉104-1,34.567349504965,135.6999051132,1,0,0,-,-,-,,,一時避難地・避難所
奈良県,宇陀市,宇賀志体育館,奈良県宇陀市菟田野宇賀志177番地1,34.459470894019,135.98498432196,1,0,0,-,-,-,,,避難場所・避難所
奈良県,北葛城郡河合町,ゲンジ坂公園,奈良県北葛城郡河合町西穴闇365-1他,34.586007086568,135.73527763804,-,-,-,-,-,-,,,その他緊急の避難場所
奈良県,奈良市,平城第1号近隣公園,奈良県奈良市左京二丁目1番地,34.710725678912,135.80396661549,-,-,-,-,-,-,,,一次避難地
奈良県,五條市,西部集落センター,奈良県五條市西吉野町奥谷906,34.323153647591,135.74049195344,1,0,0,-,-,-,,,指定避難所
奈良県,吉野郡大淀町,西部幼稚園,奈良県吉野郡大淀町今木779-4,34.403348281669,135.76399759695,1,0,0,1,1,0,,,避難地・避難所
奈良県,宇陀郡御杖村,神末体育館,奈良県宇陀郡御杖村大字神末2727,34.499274524176,136.19567803191,1,0,0,-,-,-,,,避難場所・避難所
奈良県,北葛城郡上牧町,上牧第2中学校体育館,奈良県北葛城郡上牧町大字下牧35,34.570335394244,135.70743493725,1,0,0,-,-,-,,,避難場所・避難所
奈良県,五條市,大塔ふれあい交流館,奈良県五條市大塔町宇井94,34.151280792097,135.74538047256,1,0,0,-,-,-,,,指定避難所
奈良県,吉野郡上北山村,上北山村民総合会館,奈良県吉野郡上北山村河合195-2,34.134772429818,135.99942918851,1,0,0,-,-,-,,,避難所
奈良県,五條市,北宇智保育所,奈良県五條市近内町731,34.3829188296,135.70725545641,1,0,0,-,-,-,,,指定避難所
奈良県,橿原市,今井小学校体育館,奈良県橿原市今井町3-4-46,34.505050624959,135.7863121435,1,0,0,-,-,-,,,避難所
奈良県,生駒郡斑鳩町,ふれあい交流センターいきいきの里,奈良県生駒郡斑鳩町法隆寺北1-13-15,34.617641665826,135.73797848455,1,0,0,-,-,-,,,指定避難場所・避難所
奈良県,磯城郡川西町,唐院小学校（体育館）,奈良県磯城郡川西町唐院21,34.583385173599,135.75969727433,1,0,0,-,-,-,,,避難所
奈良県,磯城郡川西町,中央体育館,奈良県磯城郡川西町結崎1287-1,34.586996395794,135.77395152232,1,0,0,-,-,-,,,避難所
奈良県,吉野郡大淀町,希望ヶ丘小学校体育館,奈良県吉野郡大淀町北野54-1,34.396927693137,135.81977663441,1,0,0,1,1,0,,,避難地・避難所
奈良県,高市郡高取町,薩摩公民館,奈良県高市郡高取町薩摩594,34.44970731178,135.78315012903,1,0,0,-,-,-,,,避難所
奈良県,宇陀市,室生東小学校,奈良県宇陀市室生三本松2138番地,34.572810479483,136.02735060348,1,0,0,-,-,-,,,避難場所・避難所
奈良県,葛城市,北道穂コミュニティセンター,奈良県葛城市北道穗100,34.492742764796,135.7224799457,1,0,0,-,-,-,,,一時避難所
奈良県,五條市,福祉センター,奈良県五條市新町3-3-2,34.350760683058,135.68989881293,1,0,0,-,-,-,,,指定避難所
奈良県,大和郡山市,郡山東中学校,奈良県大和郡山市若槻町134-2,34.635952720367,135.79755135629,1,0,0,-,-,-,,,避難所
奈良県,奈良市,防災センター,奈良県奈良市八条五丁目404番地の1,34.669702162874,135.80100052767,1,0,0,-,-,-,,,第一次避難所
奈良県,生駒郡平群町,信貴山公民館,奈良県生駒郡平群町信貴山2303-6,34.606687073125,135.67329826399,-,-,-,-,-,-,,,一時集合場所
奈良県,生駒郡三郷町,里ケ丘・緑ケ丘自治会館,奈良県生駒郡三郷町勢野西5-4-2,34.606981062502,135.69024095304,-,-,-,-,-,-,,,補助避難所
奈良県,北葛城郡河合町,河合第一小学校,奈良県北葛城郡河合町池部1-15-10,34.580143094475,135.7348683997,1,0,0,-,-,-,,,一時避難場所・２次避難所
奈良県,北葛城郡上牧町,松里園消防コミュニティセンター,奈良県北葛城郡上牧町松里園3-11-4,34.549038101461,135.70967976893,1,0,0,-,-,-,,,避難所
奈良県,生駒郡三郷町,美松ケ丘自治会館,奈良県生駒郡三郷町美松ケ丘西1-9-1,34.60949733422,135.70062880845,-,-,-,-,-,-,,,補助避難所
奈良県,北葛城郡河合町,星和台集会所,奈良県北葛城郡河合町星和台2-27-2,34.585500272196,135.7130534331,1,0,0,-,-,-,,,１次避難所
奈良県,葛城市,南藤井コミュニティセンター,奈良県葛城市南藤井111,34.483957307946,135.71303636127,1,0,0,-,-,-,,,一時避難所
奈良県,天理市,山田保育所,奈良県天理市山田町1560,34.627603157886,135.93780333709,1,0,0,-,-,-,,,避難所
奈良県,奈良市,平城東公民館,奈良県奈良市朱雀六丁目9番地の1,34.716015953256,135.79726951049,1,0,0,-,-,-,,,第一次避難所
奈良県,生駒郡平群町,北公園,奈良県生駒郡平群町菊美台1丁目11番,34.644938579628,135.70788482906,-,-,-,-,-,-,,,広域避難地
奈良県,宇陀郡御杖村,桃俣多目的研修センター,奈良県宇陀郡御杖村大字桃俣682,34.479752767943,136.11433447563,1,0,0,-,-,-,,,避難場所・避難所
奈良県,天理市,二階堂養護学校,奈良県天理市庵治町358-1,34.578309089669,135.7965497102,1,0,0,-,-,-,,,避難所
奈良県,奈良市,近畿大学農学部,奈良県奈良市中町3327-204,34.671783819332,135.73249527692,-,-,-,-,-,-,,,第二次避難所
奈良県,桜井市,横内集会所,奈良県桜井市大福196-4,34.511392252423,135.8310888694,1,0,0,-,-,-,,,災害時避難所
奈良県,葛城市,葛城市民体育館,奈良県葛城市南藤井17,34.485396102575,135.71425014261,1,0,0,-,-,-,,,広域避難所
奈良県,宇陀郡御杖村,山村開発センター,奈良県宇陀郡御杖村大字菅野368,34.488411516332,136.16589549121,-,-,-,-,-,-,,,避難場所
奈良県,香芝市,五位堂小学校体育館,奈良県香芝市五位堂2-300-1,34.532176431969,135.71501015696,1,0,0,-,-,-,,,一時避難地・避難所
奈良県,宇陀市,菟田野中学校,奈良県宇陀市菟田野古市場1220番地,34.472930654717,135.96853728463,1,0,0,-,-,-,,,避難場所・避難所
奈良県,大和高田市,片塩小学校,奈良県大和高田市旭北町2-1,34.511971371127,135.74740743717,1,0,0,-,-,-,,,避難所
奈良県,宇陀市,若者自立塾室生館,奈良県宇陀市室生西谷258番地1,34.568169965319,136.05041068469,1,0,0,-,-,-,,,避難場所・避難所
奈良県,奈良市,飛鳥小学校体育館,奈良県奈良市紀寺町785番地,34.674996548555,135.83552256478,1,0,0,-,-,-,,,第一次避難所
奈良県,高市郡高取町,たかむち小学校,奈良県高市郡高取町清水谷205,34.442847212659,135.79560475372,1,0,0,-,-,-,,,避難所
奈良県,五條市,宗桧上地域集会所,奈良県五條市西吉野町茄子原718,34.256850033494,135.76446818718,1,0,0,-,-,-,,,指定避難所
奈良県,宇陀郡御杖村,川合常会場,奈良県宇陀郡御杖村大字神末370-3,34.504287616361,136.19210887065,1,0,0,-,-,-,,,避難所
奈良県,宇陀市,榛原中学校,奈良県宇陀市榛原福地761番地,34.533639583423,135.96164629729,1,0,0,-,-,-,,,避難場所・避難所
奈良県,五條市,自然休養村センター,奈良県五條市西吉野町黒渕764-1,34.288267621676,135.735219767,1,0,0,-,-,-,,,指定避難所
奈良県,山辺郡山添村,豊原公民館,奈良県山辺郡山添村三ケ谷970番地,34.654571093748,136.02629609041,1,0,0,-,-,-,,,避難所
奈良県,生駒郡平群町,人権交流センター,奈良県生駒郡平群町若井432,34.620660058952,135.69877882156,1,0,0,-,-,-,,,避難所
奈良県,吉野郡東吉野村,小公民館,奈良県吉野郡東吉野村大字小686,34.391625388229,135.9807226077,1,0,0,-,-,-,,,避難所
奈良県,橿原市,光陽中学校体育館,奈良県橿原市古川町20,34.487583252516,135.771444466,1,0,0,-,-,-,,,避難所
奈良県,宇陀市,榛原ゲートボール場,奈良県宇陀市榛原桧牧956番地,34.522827433855,135.97592303801,1,0,0,-,-,-,,,避難場所・避難所
奈良県,北葛城郡広陵町,交通公園,奈良県北葛城郡広陵町大字古寺地内,34.546777396209,135.75533439848,-,-,-,-,-,-,,,避難地
奈良県,奈良市,平城公民館,奈良県奈良市秋篠町1468番地,34.706197577138,135.77756271687,1,0,0,-,-,-,,,第一次避難所
奈良県,橿原市,真菅地区公民館,奈良県橿原市曽我町1281-18,34.512013481562,135.7787461686,1,0,0,-,-,-,,,避難所
奈良県,吉野郡下市町,栃原地区農村集落センター,奈良県吉野郡下市町栃原1222-2,34.353981710378,135.78580494774,1,0,0,-,-,-,,,避難場所・避難所
奈良県,吉野郡下市町,立石区民センター,奈良県吉野郡下市町立石260-1,34.357107035058,135.82789657434,1,0,0,1,0,0,,,避難場所・避難所
奈良県,吉野郡上北山村,ワースリビングかみきた,奈良県吉野郡上北山村河合381,34.132611884068,136.00209738385,1,0,0,-,-,-,,,避難所
奈良県,天理市,前栽公民館,奈良県天理市杉本町351-3,34.598990581372,135.816858334,1,0,0,-,-,-,,,避難所
奈良県,橿原市,白橿中学校体育館,奈良県橿原市白橿町8-12-1,34.468694301538,135.79262095932,1,0,0,-,-,-,,,避難所
奈良県,宇陀市,室生中学校,奈良県宇陀市室生大野1962番地,34.563466039675,136.01217250194,1,0,0,-,-,-,,,避難場所・避難所
奈良県,北葛城郡広陵町,8号児童公園,奈良県北葛城郡広陵町馬見南1丁目地内,34.541801679592,135.73044645156,-,-,-,-,-,-,,,避難地
奈良県,北葛城郡広陵町,真美ケ丘第二小学校,奈良県北葛城郡広陵町馬見北7-1-32,34.551749167498,135.72373962174,1,0,0,-,-,-,,,避難地・避難所
奈良県,吉野郡東吉野村,大又生活改善センター,奈良県吉野郡東吉野村大字大又909-1,34.375876289126,136.02730093667,1,0,0,-,-,-,,,避難所
奈良県,奈良市,平城西中学校体育館,奈良県奈良市神功二丁目1番地,34.719557134682,135.78110381821,1,0,0,-,-,-,,,第一次避難所
奈良県,北葛城郡上牧町,上牧小学校体育館,奈良県北葛城郡上牧町大字上牧1866,34.561208955205,135.71785652778,1,0,0,-,-,-,,,避難場所・避難所
奈良県,大和高田市,磐園小学校,奈良県大和高田市有井1,34.51879809288,135.73900263434,1,0,0,-,-,-,,,避難所
奈良県,高市郡高取町,与楽公民館,奈良県高市郡高取町与楽177,34.460036707999,135.78011389705,1,0,0,-,-,-,,,避難所
奈良県,大和郡山市,大和中央高等学校,奈良県大和郡山市筒井町1201,34.621934570831,135.78960497952,-,-,-,-,-,-,,,二次的避難所
奈良県,宇陀郡御杖村,中村常会所,奈良県宇陀郡御杖村大字菅野2116-2,34.491944572632,136.16975334677,1,0,0,-,-,-,,,避難所
奈良県,葛城市,磐城地区公民館,奈良県葛城市長尾472-1,34.507748918855,135.70780318365,1,0,0,-,-,-,,,一時避難所
奈良県,天理市,二階堂幼稚園,奈良県天理市南菅田町38-1,34.593496657831,135.79479397645,1,0,0,-,-,-,,,避難所
奈良県,高市郡高取町,田井庄公民館,奈良県高市郡高取町田井庄57,34.447301996974,135.77797836466,1,0,0,-,-,-,,,避難所
奈良県,北葛城郡上牧町,三軒屋公園,奈良県北葛城郡上牧町上牧3207-1,34.563641198386,135.71974883001,-,-,-,-,-,-,,,避難場所
奈良県,宇陀郡曽爾村,塩井集落センター,奈良県宇陀郡曽爾村大字塩井908-1,34.506766630208,136.12779944695,1,0,0,-,-,-,,,避難所
奈良県,葛城市,西室コミュニティセンター,奈良県葛城市西室95-3,34.493906788737,135.72828770237,1,0,0,-,-,-,,,一時避難所
奈良県,五條市,北宇智小学校,奈良県五條市近内町1158-2,34.389393226972,135.70474994302,1,0,0,-,-,-,,,指定避難所
奈良県,吉野郡大淀町,奥越部老人憩の家,奈良県吉野郡大淀町越部548-2,34.40377403152,135.80691352679,1,0,0,1,1,0,,,避難所
奈良県,磯城郡田原本町,北中学校,奈良県磯城郡田原本町鍵71,34.56530483438,135.7961834171,1,0,0,-,-,-,,,指定避難所
奈良県,吉野郡下市町,下市観光文化センター,奈良県吉野郡下市町下市3071,34.367155551891,135.7907210889,1,0,0,1,0,0,,,避難場所・避難所
奈良県,生駒郡平群町,南小学校（体育館）,奈良県生駒郡平群町椿井820,34.614857888385,135.70904737812,1,0,0,-,-,-,,,避難所・広域避難地
奈良県,北葛城郡河合町,星和台公園,奈良県北葛城郡河合町星和台1丁目13,34.58739739615,135.71603361449,-,-,-,-,-,-,,,その他緊急の避難場所
奈良県,橿原市,サイクリングターミナル「千輪荘」,奈良県橿原市川西町855-2,34.479784230212,135.77271397818,1,0,0,-,-,-,,,避難所
奈良県,北葛城郡上牧町,片岡台1号公園,奈良県北葛城郡上牧町片岡台1-5-1,34.581089738804,135.7148950526,-,-,-,-,-,-,,,避難場所
奈良県,宇陀市,榛原総合センター,奈良県宇陀市榛原萩原2610番地1,34.532140771501,135.95741819181,1,0,0,-,-,-,,,避難場所・避難所
奈良県,吉野郡下市町,元才谷小学校跡集会所,奈良県吉野郡下市町才谷480-1,34.349508097724,135.84779540867,1,0,0,1,0,0,,,避難場所・避難所
奈良県,吉野郡東吉野村,高見小学校体育館,奈良県吉野郡東吉野村大字木津319,34.423012365074,136.03184447015,1,0,0,-,-,-,,,避難地・避難所
奈良県,奈良市,富雄中学校体育館,奈良県奈良市三碓二丁目3番12号,34.689312990026,135.73616961594,1,0,0,-,-,-,,,第一次避難所
奈良県,高市郡高取町,高取中学校,奈良県高市郡高取町森30,34.450843416885,135.78955783879,1,0,0,-,-,-,,,避難所
奈良県,奈良市,飛鳥公民館,奈良県奈良市紀寺町984番地,34.675782559778,135.8353392548,1,0,0,-,-,-,,,第一次避難所
奈良県,五條市,岡保育所,奈良県五條市岡町491,34.363617292836,135.69440976279,1,0,0,-,-,-,,,指定避難所
奈良県,天理市,トレイルセンター,奈良県天理市柳本町577-1,34.560303823399,135.84917569904,1,0,0,-,-,-,,,避難所
奈良県,吉野郡吉野町,西谷農事集会所,奈良県吉野郡吉野町大字西谷767,34.413587986997,135.88125115485,1,0,0,-,-,-,,,避難所
奈良県,吉野郡天川村,中谷地区集会所,奈良県吉野郡天川村中谷,34.238953328676,135.84932560916,1,0,0,-,-,-,,,避難所
奈良県,葛城市,公民館八川分館,奈良県葛城市八川280-6,34.504305121009,135.71583035297,1,0,0,-,-,-,,,一時避難所
奈良県,北葛城郡河合町,河合町総合スポーツ公園（ヘリポート）,奈良県北葛城郡河合町山坊85,34.575043806462,135.73810725889,-,-,-,-,-,-,,,一時避難場所
奈良県,奈良市,奈良佐保短期大学,奈良県奈良市鹿野園町806,34.663936800208,135.84436671357,-,-,-,-,-,-,,,第二次避難所
奈良県,吉野郡下市町,堂垣内町会館,奈良県吉野郡下市町下市613-2,34.377057343459,135.78832381044,1,0,0,1,0,0,,,避難場所・避難所
奈良県,桜井市,第5保育所,奈良県桜井市豊前267,34.538655744005,135.83158567811,1,0,0,-,-,-,,,災害時避難所
奈良県,北葛城郡河合町,高塚台第2公園,奈良県北葛城郡河合町高塚台2丁目35-2,34.582340435888,135.72684429991,-,-,-,-,-,-,,,その他緊急の避難場所
奈良県,橿原市,畝傍北小学校体育館,奈良県橿原市大久保町156,34.496618571938,135.79496993586,1,0,0,-,-,-,,,避難所
奈良県,北葛城郡上牧町,上牧町立文化館,奈良県北葛城郡上牧町大字上牧3892,34.561741977717,135.70840729645,1,0,0,-,-,-,,,避難所
奈良県,奈良市,私立奈良大学,奈良県奈良市山陵町1500番地,34.715282641116,135.78317877918,-,-,-,-,-,-,,,第二次避難所
奈良県,桜井市,桜井西人権ふれあいセンター分館,奈良県桜井市西之宮211-1,34.513089130242,135.82621424529,1,0,0,-,-,-,,,災害時避難所
奈良県,葛城市,公民館三才分館,奈良県葛城市北花内771-1,34.486037952585,135.72495752352,1,0,0,-,-,-,,,一時避難所
奈良県,吉野郡吉野町,国栖公民館,奈良県吉野郡吉野町大字国栖281,34.38581446868,135.93321990488,1,0,0,-,-,-,,,避難所
奈良県,宇陀郡曽爾村,国立曽爾少年自然の家はつらつ広場,奈良県宇陀郡曽爾村大字太良路1170,34.522646024514,136.16139558191,-,-,-,-,-,-,,,避難地
奈良県,吉野郡下市町,下市町梨子堂会館,奈良県吉野郡下市町梨子堂317,34.335150151608,135.79309644578,1,0,0,-,-,-,,,避難場所・避難所
奈良県,桜井市,安倍史跡公園,奈良県桜井市安倍木材団地1丁目8-6,34.501021625049,135.83926339332,-,-,-,-,-,-,,,一次避難地
奈良県,奈良市,県立奈良高等学校,奈良県奈良市法蓮町836番地,34.694780102262,135.81887620628,-,-,-,-,-,-,,,第二次避難所
奈良県,北葛城郡上牧町,米山台公民館,奈良県北葛城郡上牧町米山台5-6-1,34.563205846715,135.71511231422,1,0,0,-,-,-,,,避難所
奈良県,五條市,賀名生の里歴史民族資料館（伝承館）,奈良県五條市西吉野町和田27-1,34.298527423062,135.71957192955,1,0,0,-,-,-,,,指定避難所
奈良県,吉野郡東吉野村,明光寺,奈良県吉野郡東吉野村大字萩原43,34.414987011242,135.99972741825,1,0,0,-,-,-,,,避難所
奈良県,生駒郡平群町,椿井公民館,奈良県生駒郡平群町椿井194,34.618943663902,135.70850019057,1,0,0,-,-,-,,,避難所
奈良県,橿原市,鴨公小学校体育館,奈良県橿原市縄手町324,34.500320989697,135.80326637717,1,0,0,-,-,-,,,避難所
奈良県,宇陀郡曽爾村,太良路公民館,奈良県宇陀郡曽爾村大字太良路633,34.524058537743,136.13961117137,1,0,0,-,-,-,,,避難所
奈良県,生駒郡平群町,総合スポーツセンター（メインアリーナ）,奈良県生駒郡平群町福貴72,34.626645707175,135.68978513011,1,0,0,-,-,-,,,避難所
奈良県,磯城郡田原本町,北小学校,奈良県磯城郡田原本町鍵155,34.566332653915,135.80117184599,1,0,0,-,-,-,,,指定避難所
奈良県,奈良市,二名中学校体育館,奈良県奈良市二名一丁目3667番地の2,34.706824954486,135.73803857853,1,0,0,-,-,-,,,第一次避難所
奈良県,吉野郡野迫川村,柞原生活改善センター,奈良県吉野郡野迫川村柞原21,34.207595306019,135.67396636569,1,0,0,-,-,-,,,避難所
奈良県,磯城郡三宅町,つながり総合センター,奈良県磯城郡三宅町但馬360-3,34.566448399956,135.76814708024,1,0,0,-,-,-,,,一時避難場所・避難所
奈良県,吉野郡大淀町,公民館吉野平分館,奈良県吉野郡大淀町桧垣本1010-326,34.395352694993,135.79199807408,1,0,0,1,1,0,,,避難所
奈良県,吉野郡大淀町,鉾立コミュニティセンター,奈良県吉野郡大淀町鉾立207-1,34.417474548067,135.77522414829,1,0,0,1,1,0,,,避難所
奈良県,北葛城郡河合町,広瀬台集会所,奈良県北葛城郡河合町広瀬台1-7,34.586382750591,135.72742408536,1,0,0,-,-,-,,,１次避難所
奈良県,奈良市,奈良県立大学,奈良県奈良市船橋町10,34.688447569032,135.82077061526,-,-,-,-,-,-,,,第二次避難所
奈良県,奈良市,柳生中学校体育館,奈良県奈良市柳生町212番地の2,34.730764002315,135.95196512518,1,0,0,-,-,-,,,第一次避難所
奈良県,北葛城郡河合町,市場集会所,奈良県北葛城郡河合町川合614-1,34.590089460532,135.74621459734,1,0,0,-,-,-,,,１次避難所
奈良県,五條市,野原小学校,奈良県五條市野原中3-8-38,34.339084656238,135.70084532373,1,0,0,-,-,-,,,指定避難所
奈良県,吉野郡天川村,天川中学校,奈良県吉野郡天川村坪内253,34.223907893515,135.83913991024,1,0,0,-,-,-,,,避難所
奈良県,吉野郡吉野町,吉野小学校,奈良県吉野郡吉野町大字上市2298,34.392789835846,135.85088800775,1,0,0,-,-,-,,,避難所
奈良県,奈良市,二名小学校体育館,奈良県奈良市二名一丁目3716番地の1,34.70800823376,135.73782195988,1,0,0,-,-,-,,,第一次避難所
奈良県,香芝市,身体障がい者療護施設どんぐり,奈良県香芝市上中1263番地26,34.556397606418,135.6803151691,-,-,-,-,-,-,,,福祉避難所
奈良県,奈良市,（旧）大安寺人権文化センター,奈良県奈良市八条一丁目790番地の1,34.663794343785,135.80218671253,1,0,0,-,-,-,,,第一次避難所
奈良県,宇陀市,野依小学校,奈良県宇陀市大宇陀野依1240番地,34.500836951301,135.93135696761,1,0,0,-,-,-,,,避難場所・避難所
奈良県,宇陀郡御杖村,菅野東郷高齢者若者センター,奈良県宇陀郡御杖村大字菅野2586,34.496091305944,136.17388884958,1,0,0,-,-,-,,,避難所
奈良県,北葛城郡王寺町,王寺アリーナ,奈良県北葛城郡王寺町王寺1丁目1番1号,34.594182554062,135.70742300904,1,0,0,-,-,-,,,避難場所・避難所
奈良県,北葛城郡上牧町,ふれあい広場,奈良県北葛城郡上牧町上牧2560-3,34.56670704789,135.72560186696,-,-,-,-,-,-,,,避難場所
奈良県,北葛城郡上牧町,上牧第3小学校体育館,奈良県北葛城郡上牧町大字上牧3100,34.570727267027,135.72147276615,1,0,0,-,-,-,,,避難場所・避難所
奈良県,吉野郡天川村,洞川地区集会所,奈良県吉野郡天川村洞川,34.265440729797,135.87698010729,1,0,0,-,-,-,,,避難所
奈良県,葛城市,忍海小学校体育館,奈良県葛城市忍海338-1,34.475697572949,135.73098495829,1,0,0,-,-,-,,,広域避難所
奈良県,桜井市,戒重集会所（幸玉会館）,奈良県桜井市戒重209-34,34.512475516732,135.83842715859,1,0,0,-,-,-,,,災害時避難所
奈良県,橿原市,晩成小学校体育館,奈良県橿原市小房町1-54,34.505861743108,135.79660574954,1,0,0,-,-,-,,,避難所
奈良県,吉野郡川上村,コミュニティセンター,奈良県吉野郡川上村人知312-3,34.322603647605,135.97003780931,1,0,0,-,-,-,,,避難所
奈良県,宇陀郡曽爾村,山粕体育館,奈良県宇陀郡曽爾村大字山粕1287-1,34.488874696958,136.09585327344,1,0,0,-,-,-,,,避難所
奈良県,奈良市,古市児童館,奈良県奈良市古市町1263番地,34.661611909206,135.83485357506,1,0,0,-,-,-,,,第一次避難所
奈良県,吉野郡吉野町,別所ふれあいセンター,奈良県吉野郡吉野町大字柳739,34.426711814293,135.920942448,1,0,0,-,-,-,,,避難所
奈良県,山辺郡山添村,旧豊原公民館,奈良県山辺郡山添村大字三ケ谷1368-4,34.654054450313,136.0267571757,1,0,0,-,-,-,,,避難所
奈良県,吉野郡下市町,公民館大峯町分館,奈良県吉野郡下市町下市441,34.370146952144,135.79057933661,1,0,0,-,-,-,,,避難場所・避難所
奈良県,奈良市,県立奈良朱雀高等学校,奈良県奈良市柏木町248番地,34.669374329288,135.79634260622,-,-,-,-,-,-,,,第二次避難所
奈良県,天理市,井戸堂公民館,奈良県天理市西井戸堂町122-4,34.581992461631,135.81710885433,1,0,0,-,-,-,,,避難所
奈良県,吉野郡十津川村,三村小学校,奈良県吉野郡十津川村大字小原707,33.983820634943,135.79099711109,1,0,0,-,-,-,,,避難所
奈良県,吉野郡大淀町,桜ヶ丘児童センター,奈良県吉野郡大淀町下渕1298-1,34.387884059591,135.78704020248,1,0,0,-,-,-,,,避難所
奈良県,吉野郡吉野町,（旧）国栖幼稚園,奈良県吉野郡吉野町大字窪垣内49-1,34.388525182932,135.92833131601,1,0,0,-,-,-,,,避難所
