都道府県,市区町村,避難所名,住所,緯度,経度,避難所,一時避難所,広域避難所,地震,風水害,津波,収容人数,備蓄品,備考
奈良県,磯城郡三宅町,中央公民館小柳分館,奈良県磯城郡三宅町小柳71-1,34.577416290227,135.75812803359,1,0,0,-,-,-,,,一時避難場所・避難所
奈良県,吉野郡吉野町,吉野運動公園総合体育館,奈良県吉野郡吉野町大字山口910外,34.411857719337,135.8920807921,1,0,0,-,-,-,,,避難所
奈良県,奈良市,椿井小学校体育館,奈良県奈良市椿井町25番地,34.680418012134,135.82790913319,1,0,0,-,-,-,,,第一次避難所
奈良県,吉野郡東吉野村,白馬寺,奈良県吉野郡東吉野村大字滝野503,34.462864843996,136.05902234836,1,0,0,-,-,-,,,避難所
奈良県,吉野郡天川村,五色地区集会所,奈良県吉野郡天川村五色,34.230119779226,135.84581176284,1,0,0,-,-,-,,,避難所
奈良県,宇陀市,室生人権交流センター・室生北児童館,奈良県宇陀市室生無山727番地2,34.587525623422,135.97335682339,1,0,0,-,-,-,,,避難場所・避難所
奈良県,葛城市,公民館新村分館,奈良県葛城市新村345-3,34.477461701538,135.74560298301,1,0,0,-,-,-,,,一時避難所
奈良県,天理市,柳本小学校,奈良県天理市柳本町1213,34.558642707806,135.84419284984,1,0,0,-,-,-,,,避難所
奈良県,奈良市,東市小学校体育館,奈良県奈良市古市町268番地,34.655693344204,135.84141416363,1,0,0,-,-,-,,,第一次避難所
奈良県,奈良市,柏木公園,奈良県奈良市柏木町255番地の1,34.666763461942,135.79605661437,-,-,-,-,-,-,,,一次避難地
奈良県,北葛城郡上牧町,ゆりが丘コミュニティセンター,奈良県北葛城郡上牧町大字下牧952-16、-18,34.57209374959,135.71949505483,1,0,0,-,-,-,,,避難所
奈良県,葛城市,梅室コミュニティセンター,奈良県葛城市梅室234-2,34.467997864155,135.70516796279,1,0,0,-,-,-,,,一時避難所
奈良県,奈良市,二名公民館,奈良県奈良市学園赤松町3684番地,34.705222418359,135.73814142303,1,0,0,-,-,-,,,第一次避難所
奈良県,吉野郡大淀町,桜ヶ丘小学校体育館,奈良県吉野郡大淀町下渕959,34.384551043968,135.79184555063,1,0,0,1,1,0,,,避難地・避難所
奈良県,吉野郡吉野町,樫尾林業研修会館,奈良県吉野郡吉野町大字樫尾126-2,34.37680974532,135.90755831858,1,0,0,-,-,-,,,避難所
奈良県,吉野郡大淀町,桜ヶ丘体育館,奈良県吉野郡大淀町下渕1299,34.38787016483,135.78746797259,1,0,0,-,-,-,,,避難所
奈良県,五條市,城戸保育所,奈良県五條市西吉野町川岸338,34.290185083559,135.75597144527,1,0,0,-,-,-,,,指定避難所
奈良県,宇陀郡御杖村,大野常会場,奈良県宇陀郡御杖村大字土屋原3057-1,34.475961930637,136.13718777615,1,0,0,-,-,-,,,避難所
奈良県,吉野郡上北山村,景徳寺,奈良県吉野郡上北山村河合,34.134908230996,136.00044249613,1,0,0,-,-,-,,,避難所
奈良県,生駒郡平群町,活性化センター「くまがしステーション」道の駅大和路へぐり,奈良県生駒郡平群町平等寺75-1,34.623426543826,135.70624479969,1,0,0,-,-,-,,,避難所
奈良県,宇陀市,ときわ老人憩の家,奈良県宇陀市大宇陀栗野244番地3,34.442729935336,135.9374968352,1,0,0,-,-,-,,,避難場所・避難所
奈良県,生駒郡斑鳩町,斑鳩小学校,奈良県生駒郡斑鳩町法隆寺南1-13-46,34.607950813641,135.73180961978,1,0,0,-,-,-,,,指定避難場所・避難所
奈良県,吉野郡吉野町,立野集会所,奈良県吉野郡吉野町大字立野164-2,34.396031502359,135.86610039399,1,0,0,-,-,-,,,避難所
奈良県,北葛城郡河合町,高塚台2丁目集会所,奈良県北葛城郡河合町高塚台2-35-3,34.582381521282,135.72643573356,1,0,0,-,-,-,,,１次避難所
奈良県,吉野郡下市町,田中町コミュニティセンター,奈良県吉野郡下市町下市2952,34.368269312158,135.78834902667,1,0,0,1,0,0,,,避難場所・避難所
奈良県,吉野郡十津川村,小原中学校,奈良県吉野郡十津川村大字小原460,33.986892170866,135.79655889657,1,0,0,-,-,-,,,避難所
奈良県,生駒郡斑鳩町,斑鳩西小学校,奈良県生駒郡斑鳩町神南2-4-25,34.597660005441,135.71880254074,1,0,0,-,-,-,,,指定避難場所・避難所
奈良県,奈良市,なら100年会館,奈良県奈良市三条宮前町7-1,34.680348411167,135.8165934803,-,-,-,-,-,-,,,第二次避難所
奈良県,磯城郡三宅町,三宅小学校,奈良県磯城郡三宅町伴堂769,34.574022356258,135.77179433992,1,0,0,-,-,-,,,一時避難場所・避難所・広域避難場所
奈良県,五條市,人権総合センター,奈良県五條市五條4-1-3,34.351344150009,135.70165911036,1,0,0,-,-,-,,,指定避難所
奈良県,天理市,北中学校,奈良県天理市石上町777,34.612947844297,135.83610590572,1,0,0,-,-,-,,,避難所
奈良県,吉野郡吉野町,上之町集会所,奈良県吉野郡吉野町大字上市,34.39885274776,135.85950011026,1,0,0,-,-,-,,,避難所
奈良県,葛城市,大屋コミュニティセンター,奈良県葛城市大屋238,34.487184744396,135.71128926647,1,0,0,-,-,-,,,一時避難所
奈良県,大和郡山市,大和郡山市総合公園,奈良県大和郡山市矢田町,34.645549539625,135.74523637365,-,-,-,-,-,-,,,広域避難地
奈良県,北葛城郡河合町,高塚台第1緑地,奈良県北葛城郡河合町高塚台2丁目1,34.584303592191,135.7310519563,-,-,-,-,-,-,,,一時避難場所
奈良県,五條市,堂平集会所,奈良県五條市大塔町堂平324-2,34.166615336686,135.75389899716,1,0,0,-,-,-,,,指定避難所
奈良県,奈良市,西部公民館,奈良県奈良市学園南三丁目1番5号,34.696784527226,135.75019035455,1,0,0,-,-,-,,,第一次避難所
奈良県,香芝市,三和小学校体育館,奈良県香芝市良福寺665-2,34.530487562851,135.70423333427,1,0,0,-,-,-,,,一時避難地・避難所
奈良県,北葛城郡河合町,緑ヶ丘集会所,奈良県北葛城郡河合町池部3-1-8,34.57837945371,135.73639336823,1,0,0,-,-,-,,,１次避難所
奈良県,吉野郡下市町,下市町第2児童館,奈良県吉野郡下市町阿知賀112-9,34.375957486754,135.791034746,1,0,0,1,0,0,,,避難場所・避難所
奈良県,橿原市,市立中央体育館,奈良県橿原市小房町11-1,34.500193617254,135.79737437017,1,0,0,-,-,-,,,避難所
奈良県,北葛城郡広陵町,広陵西小学校,奈良県北葛城郡広陵町大字平尾542,34.54127298589,135.73662769115,1,0,0,-,-,-,,,避難地・避難所
奈良県,吉野郡下市町,下市町ふる里館,奈良県吉野郡下市町広橋1940,34.331223044823,135.82728324138,1,0,0,-,-,-,,,避難場所・避難所
奈良県,大和郡山市,郡山中学校,奈良県大和郡山市柳町404,34.654341951747,135.77154479332,1,0,0,-,-,-,,,避難所
奈良県,宇陀市,大宇陀中学校,奈良県宇陀市大宇陀拾生651番地,34.476644996624,135.93146077006,1,0,0,-,-,-,,,避難場所・避難所
奈良県,宇陀市,大宇陀南部地区公民館,奈良県宇陀市大宇陀下宮奥293番地1,34.457784495939,135.92221756582,1,0,0,-,-,-,,,避難場所・避難所
奈良県,生駒市,コミュニティセンター,奈良県生駒市元町1丁目6-12,34.692120855545,135.6987612684,1,0,0,-,-,-,,,避難場所・避難所
奈良県,高市郡高取町,兵庫公民館,奈良県高市郡高取町兵庫267-5,34.44839069527,135.77340104737,1,0,0,-,-,-,,,避難所
奈良県,吉野郡天川村,山西地区集会所,奈良県吉野郡天川村山西,34.195358847289,135.77623927859,1,0,0,-,-,-,,,避難所
奈良県,北葛城郡上牧町,久渡公園,奈良県北葛城郡上牧町松里園2-2,34.550562921242,135.71011850042,-,-,-,-,-,-,,,避難場所
奈良県,生駒郡三郷町,城山台自治会館,奈良県生駒郡三郷町城山台2-1-1,34.599829077809,135.68887176639,-,-,-,-,-,-,,,補助避難所
奈良県,宇陀市,蕨集会所・室生東児童館,奈良県宇陀市室生西谷152番地,34.572492994306,136.05024113316,1,0,0,-,-,-,,,避難場所・避難所
奈良県,桜井市,桜井西中学校,奈良県桜井市大福747,34.517933069765,135.83102488007,1,0,0,-,-,-,,,一次避難地・災害時避難所
奈良県,大和高田市,高田西中学校,奈良県大和高田市池田330,34.51623992801,135.72848143064,1,0,0,-,-,-,,,避難所
奈良県,香芝市,香芝総合公園,奈良県香芝市穴虫2864-1,34.546537941667,135.66486401243,-,-,-,-,-,-,,,一時避難地
奈良県,北葛城郡広陵町,広陵中央公民館,奈良県北葛城郡広陵町大字笠382-1,34.548594511757,135.74797965639,1,0,0,-,-,-,,,避難所
奈良県,吉野郡吉野町,殿川多目的集会場,奈良県吉野郡吉野町大字小名952,34.41622745175,135.95348789031,1,0,0,-,-,-,,,避難所
奈良県,葛城市,磐城小学校体育館,奈良県葛城市南今市61,34.506687975342,135.70984746164,1,0,0,-,-,-,,,広域避難所
奈良県,生駒郡平群町,椿台会館,奈良県生駒郡平群町椿台1-1-1,34.642263789233,135.69735941432,-,-,-,-,-,-,,,一時集合場所
奈良県,吉野郡大淀町,西町5丁目コミュイティセンター,奈良県吉野郡大淀町,34.383285260826,135.78370698826,1,0,0,0,1,0,,,避難所
奈良県,天理市,前栽幼稚園,奈良県天理市杉本町243-1,34.603240101802,135.81641664862,1,0,0,-,-,-,,,避難所
奈良県,北葛城郡河合町,駅前ふれあい広場,奈良県北葛城郡河合町広瀬台3丁目9-12,34.587061296911,135.71947223948,-,-,-,-,-,-,,,その他緊急の避難場所
奈良県,五條市,西吉野在宅福祉支援センター,奈良県五條市西吉野町茄子原724,34.256916727469,135.76474596619,1,0,0,-,-,-,,,指定避難所
奈良県,吉野郡天川村,ふるさとセンターつどい,奈良県吉野郡天川村籠山100,34.194591052605,135.80237468339,1,0,0,-,-,-,,,避難所
奈良県,奈良市,大宮小学校体育館,奈良県奈良市大宮町四丁目223番地の1,34.683797910839,135.81051608502,1,0,0,-,-,-,,,第一次避難所
奈良県,五條市,西吉野保健福祉センター,奈良県五條市西吉野町宗川野97,34.262457678044,135.7486332164,1,0,0,-,-,-,,,指定避難所
奈良県,北葛城郡河合町,河合第二小学校,奈良県北葛城郡河合町星和台2-7-1,34.584281061213,135.71535328979,1,0,0,-,-,-,,,一時避難場所・２次避難所
奈良県,大和高田市,高田小学校,奈良県大和高田市大中東町5-15,34.512893426438,135.74029984198,1,0,0,-,-,-,,,避難所
奈良県,奈良市,平城東中学校体育館,奈良県奈良市朱雀六丁目11番地,34.715502799144,135.80017362125,1,0,0,-,-,-,,,第一次避難所
奈良県,吉野郡野迫川村,弓手原生活改善センター,奈良県吉野郡野迫川村弓手原150,34.10113474565,135.57022100192,1,0,0,-,-,-,,,避難所
奈良県,吉野郡下市町,緑ヶ丘会館,奈良県吉野郡下市町阿知賀1311-3,34.379404404197,135.79562871977,1,0,0,1,0,0,,,避難場所・避難所
奈良県,生駒郡安堵町,安堵町福祉保健センター,奈良県生駒郡安堵町東安堵853,34.606960054579,135.75449435755,1,0,0,-,-,-,,,避難所
奈良県,北葛城郡上牧町,桜ヶ丘2号公園,奈良県北葛城郡上牧町桜ヶ丘1-17,34.577207043047,135.72114750051,-,-,-,-,-,-,,,避難場所
奈良県,磯城郡田原本町,奈良県立教育研究所,奈良県磯城郡田原本町秦庄22-1,34.539002082741,135.7897842396,1,0,0,-,-,-,,,指定避難所
奈良県,五條市,滝老人憩の家,奈良県五條市西吉野町滝370,34.313262850676,135.71381116836,1,0,0,-,-,-,,,指定避難所
奈良県,吉野郡天川村,塩野地区集会所,奈良県吉野郡天川村塩野,34.204724832353,135.75355507964,1,0,0,-,-,-,,,避難所
奈良県,宇陀市,榛原小学校,奈良県宇陀市榛原萩原2145番地,34.532180203137,135.95483017378,1,0,0,-,-,-,,,避難場所・避難所
奈良県,北葛城郡上牧町,滝川台公民館,奈良県北葛城郡上牧町滝川台1-10-12,34.569346842355,135.71735921718,1,0,0,-,-,-,,,避難所
奈良県,吉野郡東吉野村,宝城院,奈良県吉野郡東吉野村大字谷尻318,34.446629062446,136.0313634126,1,0,0,-,-,-,,,避難所
奈良県,北葛城郡広陵町,はしお元気村,奈良県北葛城郡広陵町大字弁財天295-3,34.563023356242,135.74959578913,1,0,0,-,-,-,,,避難所
奈良県,宇陀市,菟田野北部地区研修指導施設,奈良県宇陀市菟田野見田215番地2,34.483871101179,135.97955981079,1,0,0,-,-,-,,,避難場所・避難所
奈良県,桜井市,多武峰地区集会所,奈良県桜井市八井内240,34.467961939009,135.86853420114,1,0,0,-,-,-,,,災害時避難所
奈良県,奈良市,富雄第三小学校体育館,奈良県奈良市帝塚山南二丁目11番1号,34.676419595784,135.73384784992,1,0,0,-,-,-,,,第一次避難所
奈良県,吉野郡天川村,川合地区集会所,奈良県吉野郡天川村川合,34.245444654645,135.85721295082,1,0,0,-,-,-,,,避難所
奈良県,吉野郡天川村,沖金老人憩の家,奈良県吉野郡天川村大字沖金64-1,34.240933965915,135.85271364043,1,0,0,-,-,-,,,避難所
奈良県,橿原市,福祉センター「やわらぎの郷」,奈良県橿原市十市町63-1,34.531242231666,135.80980445099,1,0,0,-,-,-,,,避難所
奈良県,五條市,唐戸集会所,奈良県五條市西吉野町唐戸873-1,34.315255572399,135.77247896935,1,0,0,-,-,-,,,指定避難所
奈良県,生駒市,生駒市役所,奈良県生駒市東新町8-38,34.691979174372,135.70055005157,1,0,0,-,-,-,,,避難場所・避難所
奈良県,北葛城郡河合町,赤田池公園,奈良県北葛城郡河合町広瀬台3丁目7,34.586047623209,135.71963056454,-,-,-,-,-,-,,,その他緊急の避難場所
奈良県,宇陀郡御杖村,東集会所,奈良県宇陀郡御杖村大字菅野3372,34.504773536786,136.18532057851,1,0,0,-,-,-,,,避難所
奈良県,桜井市,桜井北人権ふれあいセンター,奈良県桜井市豊田311-2,34.537833551635,135.83260779267,1,0,0,-,-,-,,,災害時避難所
奈良県,生駒郡斑鳩町,あわ保育園,奈良県生駒郡斑鳩町阿波3-5-33,34.601468601632,135.74186742917,1,0,0,-,-,-,,,指定避難場所・避難所
奈良県,吉野郡天川村,天川村立資料館,奈良県吉野郡天川村洞川674番地1,34.270325198461,135.880489517,1,0,0,-,-,-,,,避難所
奈良県,北葛城郡上牧町,上牧第6児童遊園,奈良県北葛城郡上牧町上牧3821-1,34.559175078166,135.70721995123,-,-,-,-,-,-,,,避難場所
奈良県,吉野郡下市町,北口町会館,奈良県吉野郡下市町下市563-1,34.376290719395,135.78837382708,1,0,0,1,0,0,,,避難場所・避難所
奈良県,吉野郡野迫川村,池津川生活改善センター,奈良県吉野郡野迫川村池津川246,34.176396875615,135.66864870536,1,0,0,-,-,-,,,避難所
奈良県,北葛城郡上牧町,上牧中学校体育館,奈良県北葛城郡上牧町大字上牧3349,34.561600559851,135.71579009169,1,0,0,-,-,-,,,避難場所・避難所
奈良県,吉野郡天川村,光遍寺,奈良県吉野郡天川村沢原,34.23406213503,135.84589031827,1,0,0,-,-,-,,,避難所
奈良県,生駒郡三郷町,高山自治会館,奈良県生駒郡三郷町立野南3-4-20,34.587541511064,135.68436701221,-,-,-,-,-,-,,,補助避難所
奈良県,奈良市,大渕池公園,奈良県奈良市大渕町外,34.708102622184,135.74535728884,-,-,-,-,-,-,,,一次避難地
奈良県,奈良市,六条小学校体育館,奈良県奈良市六条二丁目14番1号,34.670457048987,135.77140836957,1,0,0,-,-,-,,,第一次避難所
奈良県,五條市,宗川野体育館,奈良県五條市西吉野町宗川野57-1,34.263935309821,135.7477471827,1,0,0,-,-,-,,,指定避難所
奈良県,生駒市,生駒南小学校,奈良県生駒市萩原町335,34.665875853633,135.70595868591,1,0,0,-,-,-,,,避難場所・避難所
奈良県,吉野郡上北山村,上北山中学校体育館,奈良県吉野郡上北山村河合564,34.149918228383,135.99212025058,1,0,0,-,-,-,,,避難所
奈良県,生駒市,鹿ノ台小学校,奈良県生駒市鹿ノ台西1丁目5-2,34.734302377245,135.74674263964,1,0,0,-,-,-,,,避難場所・避難所
奈良県,桜井市,桜井南小学校,奈良県桜井市浅古21,34.502651848051,135.85186794464,1,0,0,-,-,-,,,一次避難地・災害時避難所
奈良県,北葛城郡河合町,古池東緑地,奈良県北葛城郡河合町穴闇161-6、162-5、164-4,34.586959074946,135.73851791633,-,-,-,-,-,-,,,その他緊急の避難場所
奈良県,奈良市,東大寺学園高等学校（付属施設を含む）,奈良県奈良市山陵町1375番地,34.713344013781,135.7889784133,-,-,-,-,-,-,,,第二次避難所
奈良県,大和郡山市,南部公民館,奈良県大和郡山市筒井町600-4,34.620623311626,135.77942258231,1,0,0,-,-,-,,,避難所
奈良県,五條市,大阿太公民館,奈良県五條市西阿田町729,34.376447792935,135.74283885337,1,0,0,-,-,-,,,指定避難所
奈良県,北葛城郡広陵町,総合保健福祉会館,奈良県北葛城郡広陵町大字笠161-2,34.542820163922,135.74484380145,1,0,0,-,-,-,,,避難所
奈良県,橿原市,多地区公民館,奈良県橿原市新口町244-1,34.526370144085,135.78916750885,1,0,0,-,-,-,,,避難所
奈良県,磯城郡田原本町,保健センター,奈良県磯城郡田原本町阪手336-1,34.555941977192,135.79769999393,1,0,0,-,-,-,,,指定避難所
奈良県,宇陀郡御杖村,青少年旅行村・管理棟,奈良県宇陀郡御杖村大字神末1790,34.468883999428,136.19177923608,1,0,0,-,-,-,,,避難所
奈良県,北葛城郡河合町,中山田池公園,奈良県北葛城郡河合町中山台1丁目16,34.581326533198,135.72119542536,-,-,-,-,-,-,,,一時避難場所
奈良県,生駒市,むかいやま公園体育館,奈良県生駒市萩原町673,34.663551131126,135.6970789302,1,0,0,-,-,-,,,避難場所・避難所
奈良県,吉野郡十津川村,十津川村役場住民ホール,奈良県吉野郡十津川村大字小原225-1,33.988497376921,135.79248412332,1,0,0,-,-,-,,,避難所
奈良県,橿原市,白橿地区公民館,奈良県橿原市白橿町2-32-11,34.475060199866,135.79107088704,1,0,0,-,-,-,,,避難所
奈良県,葛城市,公民館加守分館,奈良県葛城市加守585,34.531920505512,135.6921953351,1,0,0,-,-,-,,,一時避難所
奈良県,五條市,二見文化体育センター,奈良県五條市二見7-6-50,34.343819697649,135.67787202168,1,0,0,-,-,-,,,指定避難所
奈良県,奈良市,佐保人権文化センター,奈良県奈良市畑中町4番地の4,34.686967127739,135.82015680541,1,0,0,-,-,-,,,第一次避難所
奈良県,奈良市,三碓小学校体育館,奈良県奈良市西千代ヶ丘一丁目20番9号,34.683760801216,135.7417997472,1,0,0,-,-,-,,,第一次避難所
奈良県,葛城市,公民館染野分館,奈良県葛城市染野321-1,34.521769175277,135.69763409662,1,0,0,-,-,-,,,一時避難所
奈良県,大和高田市,片塩中学校,奈良県大和高田市中三倉堂2丁目9-28,34.501395069663,135.74610233081,1,0,0,-,-,-,,,避難所
奈良県,生駒郡三郷町,城山台第3児童公園,奈良県生駒郡三郷町城山台5-10-7,34.601467518297,135.68503660608,-,-,-,-,-,-,,,一時避難地
奈良県,宇陀市,西榛原公民館,奈良県宇陀市榛原笠間1460番地,34.513173413538,135.91881137274,1,0,0,-,-,-,,,避難場所・避難所
奈良県,吉野郡野迫川村,（旧）今井小学校,奈良県吉野郡野迫川村今井105,34.203779856743,135.69367327305,1,0,0,-,-,-,,,避難所
奈良県,天理市,総合体育館,奈良県天理市西長柄町595,34.575641026505,135.82029217494,1,0,0,-,-,-,,,避難所
奈良県,宇陀郡曽爾村,今井集会所,奈良県宇陀郡曽爾村大字今井1388-2,34.516818036288,136.13036018695,1,0,0,-,-,-,,,避難所
奈良県,天理市,福住公民館,奈良県天理市福住町2025,34.611490672227,135.91563624507,1,0,0,-,-,-,,,避難所
奈良県,奈良市,奈良教育大学付属中学校,奈良県奈良市法蓮町2058-2,34.697074299238,135.81717349883,-,-,-,-,-,-,,,第二次避難所
奈良県,吉野郡大淀町,公民館西町4丁目分館,奈良県吉野郡大淀町下渕816,34.385442594733,135.7861487353,1,0,0,1,0,0,,,避難所
奈良県,橿原市,耳成地区公民館,奈良県橿原市葛本町593,34.523168085019,135.80587152232,1,0,0,-,-,-,,,避難所
奈良県,桜井市,高齢者総合福祉センター,奈良県桜井市倉橋1166,34.491561656092,135.86275338481,1,0,0,-,-,-,,,災害時避難所
奈良県,吉野郡下市町,都町コミュニティ会館,奈良県吉野郡下市町新住1868,34.375618551774,135.78579342861,1,0,0,1,0,0,,,避難場所・避難所
奈良県,吉野郡下市町,下阪町分館,奈良県吉野郡下市町下市218,34.369080371047,135.79158489074,1,0,0,1,0,0,,,避難場所・避難所
奈良県,吉野郡大淀町,佐名伝公民館,奈良県吉野郡大淀町佐名伝303,34.380942574237,135.76947252699,1,0,0,1,1,0,,,避難所
奈良県,宇陀市,菟田野農家高齢者創作館,奈良県宇陀市菟田野佐倉1145番地1,34.452376344981,135.98229970608,1,0,0,-,-,-,,,避難場所・避難所
奈良県,吉野郡吉野町,吉野山ビジターセンター,奈良県吉野郡吉野町大字吉野山2430,34.367301205249,135.85961887733,1,0,0,-,-,-,,,避難所
奈良県,葛城市,當麻集会場,奈良県葛城市當麻83-1,34.515606255542,135.70305882674,1,0,0,-,-,-,,,一時避難所
奈良県,北葛城郡上牧町,片岡台2号公園,奈良県北葛城郡上牧町片岡台2-10-1,34.578753986167,135.71805878561,-,-,-,-,-,-,,,避難場所
奈良県,北葛城郡広陵町,真美ケ丘第一小学校,奈良県北葛城郡広陵町馬見南2-1-30,34.539845231686,135.73112810717,1,0,0,-,-,-,,,避難地・避難所
奈良県,吉野郡東吉野村,龍泉寺,奈良県吉野郡東吉野村大字鷲家256,34.423191595095,135.99371644451,1,0,0,-,-,-,,,避難所
奈良県,葛城市,大屋北コミュニティセンター,奈良県葛城市南道穗234-11,34.489684618873,135.71640271017,1,0,0,-,-,-,,,一時避難所
奈良県,北葛城郡広陵町,広陵高校,奈良県北葛城郡広陵町大字的場401,34.568797905449,135.75917824435,1,0,0,-,-,-,,,避難地・避難所
奈良県,北葛城郡上牧町,新町第1公民館,奈良県北葛城郡上牧町大字上牧2546,34.566958437264,135.72659176923,1,0,0,-,-,-,,,避難所
奈良県,五條市,簾集会所,奈良県五條市大塔町簾715,34.213343267572,135.7435487826,1,0,0,-,-,-,,,指定避難所
奈良県,北葛城郡王寺町,王寺中学校,奈良県北葛城郡王寺町本町1丁目20番45号,34.593599195726,135.70382894344,1,0,0,-,-,-,,,避難場所・避難所
奈良県,宇陀郡御杖村,堂前常会場,奈良県宇陀郡御杖村大字土屋原2658,34.481364248385,136.13914859673,1,0,0,-,-,-,,,避難所
奈良県,吉野郡天川村,洞川小学校・洞川中学校,奈良県吉野郡天川村洞川410,34.269996241436,135.88353736235,1,0,0,-,-,-,,,避難所
奈良県,奈良市,京西公民館,奈良県奈良市六条西一丁目3番43-2号,34.671970792529,135.77097777075,1,0,0,-,-,-,,,第一次避難所
奈良県,北葛城郡広陵町,馬見南緑地,奈良県北葛城郡広陵町馬見南1丁目地内,34.540658764185,135.73238959841,-,-,-,-,-,-,,,避難地
奈良県,生駒郡安堵町,総合センターひびき,奈良県生駒郡安堵町東安堵557-1,34.610743136462,135.75734684914,1,0,0,-,-,-,,,避難所
奈良県,五條市,白銀南体育館,奈良県五條市西吉野町八ツ川493,34.303336498923,135.7646210349,1,0,0,-,-,-,,,指定避難所
奈良県,天理市,朝和幼稚園,奈良県天理市成願寺町386,34.570985842468,135.84257894459,1,0,0,-,-,-,,,避難所
奈良県,吉野郡吉野町,吉野町中央公民館,奈良県吉野郡吉野町大字上市133,34.395950734664,135.85726230979,1,0,0,-,-,-,,,避難所
奈良県,吉野郡天川村,和田地区集会所,奈良県吉野郡天川村和田,34.196884056721,135.81304733337,1,0,0,-,-,-,,,避難所
奈良県,奈良市,若草中学校体育館,奈良県奈良市法蓮町1416番地の1,34.695113749583,135.83151677369,1,0,0,-,-,-,,,第一次避難所
奈良県,宇陀郡曽爾村,曽爾村振興センター,奈良県宇陀郡曽爾村大字今井513-8,34.510860438064,136.12477196621,1,0,0,-,-,-,,,避難所
奈良県,奈良市,六郷小学校体育館,奈良県奈良市針ヶ別所町812、820番地,34.624997091705,135.97196278363,1,0,0,-,-,-,,,第一次避難所
奈良県,吉野郡下市町,高原地区自治会館（ふるさとの家）,奈良県吉野郡下市町よ邑1260,34.33807658758,135.8221552797,1,0,0,1,0,0,,,避難場所・避難所
奈良県,奈良市,古市公園,奈良県奈良市,34.653810216082,135.84286982666,-,-,-,-,-,-,,,一次避難地
奈良県,北葛城郡上牧町,新町老人憩の家,奈良県北葛城郡上牧町大字上牧2622-1,34.567916629409,135.72704171264,1,0,0,-,-,-,,,避難所
奈良県,宇陀郡曽爾村,高尾公民館,奈良県宇陀郡曽爾村大字山粕1287-1,34.488881895659,136.09583327533,1,0,0,-,-,-,,,避難所
奈良県,香芝市,郡ヶ池近隣公園,奈良県香芝市高山台3-14-12,34.547457983767,135.67544660439,-,-,-,-,-,-,,,一時避難地
奈良県,生駒郡三郷町,みさと自治会館,奈良県生駒郡三郷町立野北1-29-116,34.594101897393,135.69422699409,-,-,-,-,-,-,,,補助避難所
奈良県,北葛城郡上牧町,北上牧公民館（第1集会所）,奈良県北葛城郡上牧町大字上牧3764,34.564108319047,135.70532977517,1,0,0,-,-,-,,,避難所
奈良県,五條市,五條小学校,奈良県五條市本町1-1-4,34.351088381575,135.69234313648,1,0,0,-,-,-,,,指定避難所
奈良県,天理市,朝和小学校,奈良県天理市成願寺町420,34.571469080772,135.84209008122,1,0,0,-,-,-,,,避難所
奈良県,宇陀郡御杖村,奈良県御杖健民グランド,奈良県宇陀郡御杖村大字神末,34.498581327792,136.19570254268,-,-,-,-,-,-,,,避難場所
