都道府県,市区町村,避難所名,住所,緯度,経度,避難所,一時避難所,広域避難所,地震,風水害,津波,収容人数,備蓄品,備考
山形県,最上郡舟形町,えんじゅ荘周辺広場,山形県最上郡舟形町長者原1712-1,38.700072536325,140.29924935253,-,-,-,-,-,-,2500人,,避難地
山形県,長井市,長井高等学校,山形県長井市四ツ谷2-5-1,38.097204529119,140.03775868004,-,-,-,-,-,-,,,一時避難場所・広域避難場所
山形県,天童市,糠塚1号公園,山形県天童市大字老野森266番地,38.370410127319,140.38070501509,-,-,-,-,-,-,,,一時避難場所
山形県,最上郡真室川町,新町公民館と周辺,山形県最上郡真室川町新町,38.851998189146,140.25096234009,-,-,-,0,1,0,,,洪水時緊急避難
山形県,東村山郡山辺町,近江公民館,山形県東村山郡山辺町近江3-37,38.28156230173,140.27136015317,1,0,0,-,-,-,,,避難所
山形県,鶴岡市,大針上公民館,山形県鶴岡市大針字仲畑,38.553470259674,139.81097105649,1,0,0,-,-,-,33人,,１次避難場所・避難所
山形県,天童市,干布公民館,山形県天童市大字干布,38.334489322851,140.39337489316,1,0,0,-,-,-,,,収容避難所
山形県,寒河江市,南町公園,山形県寒河江市南町1丁目533番地,38.37255696424,140.277274459,-,-,-,-,-,-,900人,,避難場所
山形県,鶴岡市,高速道路いらがわIC・北側農道,山形県鶴岡市,38.668117740641,139.62507897678,-,-,-,-,-,-,,,津波避難場所
山形県,東村山郡中山町,柳町公民館,山形県東村山郡中山町大字長崎143,38.334565787031,140.28285026812,1,0,0,-,-,-,53人,,収容避難所
山形県,鶴岡市,第五学区コミュニティ防災センター,山形県鶴岡市宝町18-77,38.73540688546,139.84143699017,1,0,0,-,-,-,142人,,避難所
山形県,西置賜郡飯豊町,町民総合センターあ?すこどもみらい館,山形県西置賜郡飯豊町椿3622番地,38.043870958553,139.99464187278,1,0,0,-,-,-,,,指定避難所
山形県,上山市,市民公園,山形県上山市河崎一丁目字石崎70-2,38.148475733665,140.26877271858,-,-,-,-,-,-,,,一時避難場所
山形県,最上郡最上町,旧瀬見小学校体育館,山形県最上郡最上町大字大堀742,38.754222758545,140.4211902334,1,0,0,-,-,-,300人,,避難場所・指定避難所
山形県,尾花沢市,ひまわり保育園,山形県尾花沢市新町4-4-17,38.608484189994,140.41413931048,1,0,0,-,-,-,40人,,指定避難所
山形県,南陽市,旧赤湯小学校グランド,山形県南陽市椚塚1667,38.047297456204,140.1609185959,1,0,0,-,-,-,,,指定避難所・避難地
山形県,鶴岡市,朝日小学校体育館,山形県鶴岡市下名川字落合2,38.611431462399,139.83566742694,1,0,0,-,-,-,7559人,,１次避難場所・避難所
山形県,酒田市,黒森コミュニティセンター,山形県酒田市黒森字草刈谷地57-2,38.851134684489,139.81790211482,1,0,0,1,1,1,,,収容避難所
山形県,鶴岡市,野中公民館,山形県鶴岡市東岩本字野中83,38.626863947523,139.85042704945,1,0,0,-,-,-,33人,,１次避難場所・避難所
山形県,鶴岡市,油沢砂防ダム,山形県鶴岡市,38.74630303826,139.71045754876,-,-,-,-,-,-,,,津波避難場所
山形県,西村山郡朝日町,朝日町立旧送橋小学校,山形県西村山郡朝日町大字送橋461,38.297352099633,140.17959536309,1,0,0,-,-,-,,,避難所
山形県,鶴岡市,谷口公民館,山形県鶴岡市越中山字谷口83,38.618186758976,139.84625260788,1,0,0,-,-,-,42人,,１次避難場所・避難所
山形県,山形市,樋越公園,山形県山形市馬見ヶ崎四丁目11,38.284710202429,140.32669980452,-,-,-,-,-,-,,,一時避難場所
山形県,村山市,山形丸魚（中央）,山形県村山市,38.482358459771,140.37645624853,-,-,-,-,-,-,,,避難場所
山形県,東根市,原宿公民館,山形県東根市関山224,38.41643307255,140.4641936385,1,0,0,1,1,0,,,一時避難所
山形県,山形市,とがみ西公園,山形県山形市富神台2,38.240523340771,140.28177638031,-,-,-,-,-,-,,,一時避難場所
山形県,東田川郡庄内町,庄内町体育センター,山形県東田川郡庄内町狩川字大釜23-1,38.789782063272,139.9656745849,1,0,0,0,1,0,390人,,２次避難場所
山形県,長井市,新町公民館,山形県長井市,38.111584118462,140.03388279743,-,-,-,-,-,-,,,一時避難場所
山形県,山形市,みはらしの丘小学校,山形県山形市大字松原1791-23,38.188688245927,140.28784162431,1,0,0,-,-,-,,,一時避難場所・避難所
山形県,東根市,羽入第二区会館,山形県東根市羽入,38.406192451799,140.35297596724,1,0,0,1,1,0,,,一時避難所
山形県,鶴岡市,東小学校グラウンド,山形県鶴岡市黒川字小在家90-1,38.670371594284,139.86596402214,-,-,-,-,-,-,9000人,,１次避難場所
山形県,上山市,しらさぎ保育園,山形県上山市金生東二丁目6-54,38.14327101089,140.28555301492,-,-,-,-,-,-,,,一時避難場所
山形県,鶴岡市,第一学区コミュニティ防災センター,山形県鶴岡市文園町1-63,38.718900465232,139.82787777208,1,0,0,-,-,-,156人,,洪水避難場所・避難所
山形県,最上郡金山町,農村環境改善センター,山形県最上郡金山町大字金山571,38.8773205575,140.33244853906,1,0,0,1,0,0,,,避難所
山形県,最上郡舟形町,横山公民館,山形県最上郡舟形町堀内2131,38.65460278879,140.27408628299,1,0,0,-,-,-,58人,,収容避難所・避難地
山形県,最上郡真室川町,釜渕小学校,山形県最上郡真室川町釜渕817-37,38.937646539531,140.26844747714,1,0,0,-,-,-,,,土砂災害時避難施設
山形県,尾花沢市,下柳多目的集会施設,山形県尾花沢市大字下柳渡戸770,38.576490830725,140.49138487395,1,0,0,-,-,-,30人,,一般避難所
山形県,山形市,鳥居ヶ丘公園,山形県山形市鳥居ヶ丘1255,38.229696748903,140.33653731671,-,-,-,-,-,-,,,一時避難場所
山形県,鶴岡市,滝ノ上,山形県鶴岡市,38.759989047261,139.72553685744,-,-,-,-,-,-,,,津波避難場所
山形県,寒河江市,八幡原第1号公園,山形県寒河江市元町1丁目11番地の2,38.37197252402,140.27171719089,-,-,-,-,-,-,1500人,,避難場所
山形県,西村山郡河北町,根際公民館,山形県西村山郡河北町,38.428603314318,140.287814152,1,0,0,-,-,-,,,一般避難地・収容施設
山形県,鶴岡市,船渡公園,山形県鶴岡市朝暘町13,38.727721828242,139.84171178755,-,-,-,-,-,-,650人,,１次避難場所
山形県,尾花沢市,荻袋開拓多目的集会施設,山形県尾花沢市大字荻袋1728-36,38.621601114018,140.39538762665,1,0,0,-,-,-,30人,,一般避難所
山形県,上山市,ヴェンテンガルテン,山形県上山市弁天二丁目535-1,38.170939823327,140.29616526595,-,-,-,-,-,-,,,一時避難場所
山形県,寒河江市,船橋公園,山形県寒河江市船橋町5番地,38.373680536245,140.26936451475,-,-,-,-,-,-,1000人,,避難場所
山形県,最上郡舟形町,堀内生活改善センター,山形県最上郡舟形町堀内116-5,38.662147487259,140.27504310639,1,0,0,-,-,-,208人,,収容避難所・避難地
山形県,東置賜郡高畠町,二井宿小学校,山形県東置賜郡高畠町大字二井宿2750,38.018948950456,140.25747653514,1,0,0,-,-,-,,,指定収容避難所
山形県,最上郡鮭川村,鮭川村立曲川小学校芦沢分校体育館,山形県最上郡鮭川村大字曲川513-24,38.84414757245,140.17590171637,1,0,0,-,-,-,,,避難所
山形県,鶴岡市,長者町西公園,山形県鶴岡市長者町20-1,38.718380948366,139.83262019184,-,-,-,-,-,-,750人,,１次避難場所
山形県,東田川郡庄内町,土場?スーパー農道（庄内大橋南端付近）,山形県東田川郡庄内町,38.876645467193,139.9117048763,-,-,-,-,-,-,,,１次避難場所
山形県,鶴岡市,朝日スポーツセンターグラウンド,山形県鶴岡市東岩本字野中143,38.625422421965,139.85236030694,-,-,-,-,-,-,8700人,,１次避難場所
山形県,東根市,三日町公民館,山形県東根市三日町2丁目5-7,38.443552997903,140.39326235441,1,0,0,1,0,0,,,一時避難所
山形県,新庄市,県立新庄北高等学校,山形県新庄市飛田字備前川61,38.763564243201,140.28423714579,1,0,0,-,-,-,,,指定避難場所・指定避難所
山形県,鶴岡市,漁港上,山形県鶴岡市,38.685900617677,139.62825885936,-,-,-,-,-,-,,,津波避難場所
山形県,長井市,慈光園,山形県長井市小出3453,38.109340705496,140.04986696592,-,-,-,-,-,-,,,一時避難場所
山形県,尾花沢市,尾花沢市銀嶺荘,山形県尾花沢市大字銀山新畑162-1,38.575399736474,140.51676873219,1,0,0,-,-,-,61人,,指定避難所
山形県,鶴岡市,小岩川公民館,山形県鶴岡市小岩川字巌168,38.591167209307,139.5655712515,1,0,0,-,-,-,126人,,避難所
山形県,西村山郡河北町,松東公民館,山形県西村山郡河北町,38.425173574136,140.30787153316,1,0,0,-,-,-,,,一般避難地・収容施設
山形県,鶴岡市,羽黒農村センター,山形県鶴岡市羽黒町荒川字谷地堰11-1,38.715896427214,139.90060241542,1,0,0,-,-,-,239人,,避難所
山形県,飽海郡遊佐町,菅里体育館,山形県飽海郡遊佐町菅里字菅野7-1,39.060384837201,139.88532772151,1,0,0,-,-,-,,,緊急避難場所
山形県,西村山郡河北町,元泉農村公園,山形県西村山郡河北町字畑中213-4,38.409785780386,140.3008076264,-,-,-,-,-,-,,,広域避難場所
山形県,新庄市,昭和小学校,山形県新庄市昭和660,38.836776913255,140.3099934619,1,0,0,-,-,-,,,指定避難場所・指定避難所
山形県,西村山郡朝日町,朝日町立旧立木小学校,山形県西村山郡朝日町大字立木300番地,38.301601623624,140.08510983893,1,0,0,-,-,-,,,避難所
山形県,東田川郡庄内町,千河原八幡神社境内,山形県東田川郡庄内町,38.870450796853,139.92844946603,-,-,-,-,-,-,,,１次避難場所
山形県,村山市,洗心広場,山形県村山市,38.531350909065,140.3978738872,-,-,-,-,-,-,,,避難場所
山形県,鶴岡市,田川小学校体育館,山形県鶴岡市田川字高田9,38.685853933846,139.74835920841,1,0,0,-,-,-,288人,,避難所
山形県,村山市,東原公民館,山形県村山市,38.486371255035,140.33701107339,-,-,-,-,-,-,,,避難場所
山形県,米沢市,敬師児童遊園,山形県米沢市大字関根13922-1,37.863709793774,140.14283945784,-,-,-,-,-,-,1650人,,１次避難場所
山形県,南陽市,市民体育館,山形県南陽市三間通1096,38.062862255519,140.15203523081,1,0,0,-,-,-,,,指定避難所
山形県,西村山郡大江町,荒木田グラウンド,山形県西村山郡大江町沢口247,38.366487839053,140.07502456627,-,-,-,-,-,-,4568人,,避難場所
山形県,酒田市,浜中小学校,山形県酒田市浜中字上村370-2,38.825997665977,139.78366395872,1,0,0,1,1,1,,,収容避難所
山形県,鶴岡市,砂田公園,山形県鶴岡市砂田町18-13,38.731957841089,139.80318636682,-,-,-,-,-,-,700人,,１次避難場所
山形県,山形市,つくし公園,山形県山形市あずま町23の2,38.239856575711,140.33655663398,-,-,-,-,-,-,,,一時避難場所
山形県,長井市,向山荘,山形県長井市,38.080264723807,140.07311803692,-,-,-,-,-,-,,,一時避難場所
山形県,東村山郡中山町,南小路公民館,山形県東村山郡中山町大字長崎260-2,38.332335454588,140.27704535647,1,0,0,-,-,-,41人,,収容避難所
山形県,山形市,坂巻公園,山形県山形市桜田西三丁目3,38.221090804852,140.31320234946,-,-,-,-,-,-,,,一時避難場所
山形県,東根市,一日町公民館,山形県東根市東根甲11-2,38.439867476306,140.40051477169,1,0,0,1,0,0,,,一時避難所
山形県,南陽市,漆山小学校,山形県南陽市漆山1731,38.068005267644,140.11711526736,1,0,0,-,-,-,,,指定避難所・避難地
山形県,西村山郡河北町,東町公民館,山形県西村山郡河北町,38.422751400723,140.31777725865,1,0,0,-,-,-,,,一般避難地・収容施設
山形県,西村山郡朝日町,和合公民館,山形県西村山郡朝日町和合2237,38.325635311586,140.16620266288,1,0,0,-,-,-,60人,,避難所
山形県,西村山郡西川町,開発センター,山形県西村山郡西川町大字間沢280,38.432121215184,140.13181207669,1,0,0,-,-,-,,,避難所
山形県,村山市,反田公民館,山形県村山市,38.501759684667,140.33166017635,-,-,-,-,-,-,,,避難場所
山形県,山形市,第六中学校,山形県山形市南原町二丁目3-55,38.235923805836,140.34023814395,1,0,0,-,-,-,,,一時避難場所・避難所
山形県,東田川郡庄内町,茗荷瀬公民館前広場,山形県東田川郡庄内町,38.83382505813,139.89598180004,-,-,-,-,-,-,,,１次避難場所
山形県,酒田市,北平田コミュニティセンター,山形県酒田市漆曽根字千刈13,38.93144667135,139.88921831126,1,0,0,1,1,0,,,収容避難所
山形県,尾花沢市,尾花沢市立高橋小学校体育館,山形県尾花沢市高橋76,38.63181930349,140.48595438811,1,0,0,-,-,-,,,避難施設
山形県,山形市,五日町公園,山形県山形市五日町18の18,38.244514869485,140.32285729786,-,-,-,-,-,-,,,一時避難場所
山形県,飽海郡遊佐町,西遊佐公民館,山形県飽海郡遊佐町藤崎字坂ノ下142-1,39.011287223078,139.87291404446,1,0,0,-,-,-,,,緊急避難場所
山形県,酒田市,日向コミュニティセンター,山形県酒田市上黒川字家の東57-1,38.993275063593,140.00019255589,1,0,0,1,1,0,,,収容避難所
山形県,東田川郡庄内町,防災センター広場,山形県東田川郡庄内町,38.790968978381,139.97295567496,-,-,-,-,-,-,,,１次避難場所
山形県,酒田市,旧平田中学校,山形県酒田市荻島字面桜8,38.918614622182,139.89040738139,1,0,0,1,1,0,,,収容避難所
山形県,山形市,松山公園,山形県山形市松山三丁目8の1,38.236937775958,140.35351251239,-,-,-,-,-,-,,,一時避難場所
山形県,山形市,戸神公園,山形県山形市小立三丁目5の1,38.22936905603,140.34489359657,-,-,-,-,-,-,,,一時避難場所
山形県,酒田市,琢成小学校,山形県酒田市栄町10-8,38.922659741662,139.83799524846,1,0,0,1,1,1,,,収容避難所
山形県,米沢市,六郷町西藤泉児童遊園,山形県米沢市六郷町西藤泉1376-1,37.946199985576,140.09557502054,-,-,-,-,-,-,300人,,１次避難場所
山形県,天童市,中里緑地,山形県天童市中里七丁目1番,38.328043152739,140.36433553924,-,-,-,-,-,-,,,一時避難場所
山形県,最上郡金山町,上中田公民館,山形県最上郡金山町,38.924679754655,140.34133667014,1,0,0,1,0,0,,,避難所
山形県,飽海郡遊佐町,藤崎広場,山形県飽海郡遊佐町,39.020745856381,139.87752993086,1,0,0,-,-,-,,,緊急避難場所
山形県,山形市,高瀬小学校,山形県山形市大字下東山1264,38.295338917878,140.40168145587,1,0,0,-,-,-,,,一時避難場所・避難所
山形県,最上郡金山町,上台公民館,山形県最上郡金山町,38.855110874258,140.33332385004,1,0,0,1,0,0,,,避難所
山形県,最上郡真室川町,真室川町役場と周辺,山形県最上郡真室川町新町,38.857824265301,140.25229334003,-,-,-,0,1,0,,,洪水時緊急避難
山形県,最上郡金山町,稲沢公民館,山形県最上郡金山町,38.891382277571,140.36793608481,1,0,0,1,0,0,,,避難所
山形県,米沢市,西部コミュニティセンター,山形県米沢市直江町5-9,37.915967480547,140.08981740677,1,0,0,-,-,-,163人,,指定避難場所・避難所
山形県,天童市,長岡小学校,山形県天童市東長岡三丁目3-1,38.33065067313,140.36504540807,1,0,0,-,-,-,,,一時避難場所・収容避難所
山形県,最上郡金山町,板橋公民館,山形県最上郡金山町,38.875921607692,140.29288670608,1,0,0,1,0,0,,,避難所
山形県,寒河江市,栄町ふれあい広場,山形県寒河江市栄町1番11号,38.368370044609,140.2781517514,-,-,-,-,-,-,1400人,,避難場所
山形県,山形市,春日公園,山形県山形市春日町47の11,38.252194592463,140.31936991811,-,-,-,-,-,-,,,一時避難場所
山形県,東置賜郡川西町,町立高山小学校,山形県東置賜郡川西町大字高山1913,38.017712547883,140.08964722482,1,0,0,-,-,-,,,避難場所
山形県,西村山郡河北町,谷地西部小学校,山形県西村山郡河北町谷地字布田55,38.438049683128,140.30168388278,1,0,0,-,-,-,260人,,避難場所・収容避難施設
山形県,最上郡舟形町,富田町内会グラウンド,山形県最上郡舟形町富田,38.680726271198,140.28058704271,-,-,-,-,-,-,3250人,,避難地
山形県,尾花沢市,おもだか保育園,山形県尾花沢市大字尾花沢2054-1,38.604692271796,140.40167679822,1,0,0,-,-,-,55人,,指定避難所
山形県,尾花沢市,尾花沢市学習情報センター,山形県尾花沢市若葉町1丁目8-25,38.598344060424,140.40777352387,1,0,0,-,-,-,71人,,指定避難所
山形県,西村山郡河北町,ひなの湯,山形県西村山郡河北町谷地字下野269番地,38.417432517167,140.32196151141,1,0,0,-,-,-,300人,,避難場所・収容避難施設
山形県,山形市,両所宮公園,山形県山形市宮町三丁目8の2,38.270786798378,140.33763086549,-,-,-,-,-,-,,,一時避難場所
山形県,尾花沢市,宮沢地区地域福祉交流センター,山形県尾花沢市高橋115番地の4,38.630269461711,140.48553497966,1,0,0,-,-,-,35人,,指定避難所
山形県,最上郡真室川町,まむろがわ温泉・梅里苑,山形県最上郡真室川町平岡,38.866968115844,140.28165134952,1,0,0,0,1,0,,,洪水時緊急避難・洪水時２次避難・土砂災害時避難施設
山形県,東村山郡山辺町,役場中支所,山形県東村山郡山辺町大字大蕨1173-1,38.288923030361,140.20044696897,1,0,0,-,-,-,,,避難所
山形県,鶴岡市,佐藤登宅前,山形県鶴岡市,38.660063461297,139.60676819051,-,-,-,0,0,1,,,１次避難場所・津波避難場所
山形県,酒田市,富士見学区コミュニティ防災センター,山形県酒田市曙町二丁目68-3,38.919074903802,139.86382918369,1,0,0,1,1,1,,,収容避難所
山形県,最上郡舟形町,松橋地区多目的集会所,山形県最上郡舟形町堀内2620-8,38.612177204211,140.27225525075,1,0,0,-,-,-,220人,,収容避難所・避難地
山形県,鶴岡市,朝日中学校体育館,山形県鶴岡市本郷字笹目50,38.604456934074,139.83212060064,1,0,0,-,-,-,9131人,,１次避難場所・避難所
山形県,尾花沢市,二藤袋地区生涯学習推進センター,山形県尾花沢市大字二藤袋228-1,38.613889220997,140.43209028945,1,0,0,-,-,-,30人,,一般避難所
山形県,最上郡戸沢村,戸沢中学校,山形県最上郡戸沢村大字蔵岡2905-7,38.731321039803,140.17346214994,1,0,0,1,1,0,,,避難施設
山形県,山形市,いわざき公園,山形県山形市桜田南5の1,38.214058204927,140.31319427968,-,-,-,-,-,-,,,一時避難場所
山形県,天童市,西原公園,山形県天童市大字乱川1556-36番地,38.390644785187,140.37516763956,-,-,-,-,-,-,,,一時避難場所
山形県,山形市,第一中学校,山形県山形市松波三丁目1-15,38.241182495792,140.36631058494,1,0,0,-,-,-,,,一時避難場所・避難所
山形県,尾花沢市,丹生公民館,山形県尾花沢市大字丹生1707,38.628029385921,140.44655770815,1,0,0,-,-,-,30人,,一般避難所
山形県,西村山郡朝日町,朝日町立大谷小学校,山形県西村山郡朝日町大字大谷1147,38.343172886762,140.1723706963,1,0,0,-,-,-,,,避難所
山形県,尾花沢市,畑沢地区生涯学習推進センター,山形県尾花沢市大字畑沢252-1,38.547762892607,140.44316564175,1,0,0,-,-,-,50人,,一般避難所
山形県,鶴岡市,青柳町公園,山形県鶴岡市青柳町2-6,38.722172245863,139.81414950613,-,-,-,-,-,-,450人,,１次避難場所
山形県,新庄市,萩野中学校,山形県新庄市泉田字往還東398,38.811077400488,140.33092040504,1,0,0,-,-,-,,,指定避難場所・指定避難所
山形県,鶴岡市,県立鶴岡中央高校温海校体育館,山形県鶴岡市温海字片淵120,38.619966896749,139.58991274833,1,0,0,-,-,-,633人,,避難所
山形県,飽海郡遊佐町,吹浦保育園,山形県飽海郡遊佐町吹浦字苗代34,39.071186172689,139.88006946113,1,0,0,-,-,-,,,緊急避難場所
山形県,東村山郡中山町,磨寺向新田地区農村集落多目的共同利用施設,山形県東村山郡中山町大字達磨寺1396-4,38.32200330882,140.2893164215,1,0,0,-,-,-,157人,,収容避難所
山形県,鶴岡市,大山小学校体育館,山形県鶴岡市大山2丁目20-1,38.74992034183,139.76457687547,1,0,0,-,-,-,3261人,,１次避難場所・避難所
山形県,鶴岡市,春日神社,山形県鶴岡市神明町9,38.723325046446,139.83421876652,-,-,-,-,-,-,1250人,,１次避難場所・津波避難場所
山形県,西置賜郡飯豊町,第一小学校,山形県西置賜郡飯豊町萩生677,38.065568763234,139.99723217206,1,0,0,-,-,-,,,指定避難所
山形県,鶴岡市,黒川上地区広場,山形県鶴岡市黒川字上の山138-4,38.662468835543,139.87522956647,-,-,-,-,-,-,1400人,,１次避難場所
山形県,鶴岡市,中田地区広場,山形県鶴岡市中田字八幡130-1,38.673208721346,139.84118133631,-,-,-,-,-,-,200人,,１次避難場所
山形県,西置賜郡飯豊町,中津川小中学校,山形県西置賜郡飯豊町下屋地331-1,37.920904300392,139.87798700135,1,0,0,-,-,-,,,指定避難所
山形県,最上郡戸沢村,戸沢保育所（児童館）,山形県最上郡戸沢村大字名高1593-393,38.747016690444,140.17854134889,1,0,0,1,1,0,,,避難施設
山形県,最上郡最上町,月楯集落センター,山形県最上郡最上町大字月楯311,38.750697422551,140.49350936642,-,-,-,-,-,-,,,避難場所
山形県,西村山郡河北町,両所農村公園,山形県西村山郡河北町西里1682-1,38.418711183081,140.27416089842,-,-,-,-,-,-,,,広域避難場所
山形県,村山市,楯岡小学校グラウンド,山形県村山市楯岡楯18-1,38.483741023552,140.39414762797,-,-,-,-,-,-,,,避難場所
山形県,尾花沢市,名木沢コミュニティセンター,山形県尾花沢市大字名木沢862-4,38.663723111129,140.3435107727,1,0,0,-,-,-,50人,,一般避難所
山形県,鶴岡市,竹野浦公民館,山形県鶴岡市西目丁107-1,38.732066882603,139.72484443302,-,-,-,-,-,-,300人,,１次避難場所
山形県,鶴岡市,善養庵,山形県鶴岡市,38.770423239522,139.74010870994,-,-,-,-,-,-,,,津波避難場所
山形県,米沢市,芦付公園,山形県米沢市春日4-13-1,37.93144352194,140.11996128007,-,-,-,-,-,-,7000人,,１次避難場所
山形県,鶴岡市,福栄保育園,山形県鶴岡市木野俣字前川原7-1,38.562703924615,139.68777798206,1,0,0,-,-,-,128人,,避難所
山形県,鶴岡市,西沼公民館,山形県鶴岡市西沼字鈴木43,38.797232587663,139.81814536634,-,-,-,-,-,-,360人,,１次避難場所
山形県,鶴岡市,北野公民館,山形県鶴岡市東岩本字北野29-2,38.631927594442,139.85844565314,1,0,0,-,-,-,57人,,１次避難場所・避難所
山形県,西置賜郡飯豊町,東部地区公民館,山形県西置賜郡飯豊町添川2955番地,38.03438078243,140.01359883237,1,0,0,-,-,-,,,指定避難所
山形県,酒田市,中平田コミュニティセンター,山形県酒田市熊手島字中福島66,38.905977103458,139.89437107969,1,0,0,1,1,0,,,避難所
山形県,村山市,湯野沢農村公園,山形県村山市,38.470500763064,140.30254906766,-,-,-,-,-,-,,,避難場所
山形県,東根市,大富公民館,山形県東根市羽入723,38.405326166749,140.35309530848,1,0,0,1,1,0,134人,,収容避難所
山形県,鶴岡市,熊出中公民館,山形県鶴岡市熊出字長表52,38.629613530591,139.84316104868,1,0,0,-,-,-,134人,,１次避難場所・避難所
山形県,鶴岡市,旧広瀬幼稚園,山形県鶴岡市羽黒町後田字下田元9,38.715555259716,139.87384162039,1,0,0,-,-,-,93人,,避難所
山形県,山形市,元木公民館,山形県山形市元木三丁目4-8,38.222632518057,140.31894620997,1,0,0,-,-,-,,,避難所
山形県,山形市,南沼原小学校,山形県山形市富の中一丁目1-4,38.238019633471,140.3054026657,1,0,0,-,-,-,,,一時避難場所・避難所
山形県,山形市,県立山形西高等学校,山形県山形市鉄砲町一丁目15-64,38.237659252771,140.32768095706,1,0,0,-,-,-,,,一時避難場所・避難所
山形県,尾花沢市,細野多目的集会施設,山形県尾花沢市大字細野728-6,38.544993960685,140.46125317445,1,0,0,-,-,-,20人,,一般避難所
山形県,長井市,豊田地区公民館,山形県長井市時庭254,38.074766276666,140.03694491065,-,-,-,-,-,-,,,一時避難場所
山形県,尾花沢市,野黒沢公民館,山形県尾花沢市野黒沢501-4,38.636526900966,140.37714338264,1,0,0,-,-,-,30人,,一般避難所
山形県,東田川郡庄内町,中野神社境内,山形県東田川郡庄内町,38.80701717032,139.93671856149,-,-,-,-,-,-,,,１次避難場所
山形県,酒田市,大沢地区多目的集会施設,山形県酒田市上青沢字向芦沢154-5,38.970246041977,140.03277489354,1,0,0,1,1,0,,,収容避難所
山形県,東村山郡中山町,西部地区公民館,山形県東村山郡中山町大字金沢132-6,38.318244762023,140.25989150821,1,0,0,-,-,-,156人,,収容避難所
山形県,新庄市,旧萩野小学校土内分校,山形県新庄市萩野53-10,38.846253538744,140.39261368134,-,-,-,-,-,-,,,指定避難場所
山形県,西村山郡河北町,吉田上中公民館,山形県西村山郡河北町,38.439684071133,140.31680356981,1,0,0,-,-,-,,,一般避難地・収容施設
山形県,鶴岡市,朝暘第三小学校グラウンド,山形県鶴岡市新形町17-24,38.735678906097,139.82651625569,-,-,-,-,-,-,3000人,,１次避難場所
山形県,東置賜郡高畠町,第一中学校,山形県東置賜郡高畠町大字安久津700,38.000219855947,140.21988805022,1,0,0,-,-,-,,,指定収容避難所
