都道府県,市区町村,避難所名,住所,緯度,経度,避難所,一時避難所,広域避難所,地震,風水害,津波,収容人数,備蓄品,備考
山形県,鶴岡市,手向地区ふるさとセンター,山形県鶴岡市羽黒町手向字黒沢31-1,38.714731915535,139.95920011673,1,0,0,-,-,-,253人,,避難所
山形県,最上郡戸沢村,畑ケ公民館,山形県最上郡戸沢村大字角川728-7,38.688085254021,140.14621159462,1,0,0,1,1,0,,,避難施設
山形県,山形市,蔵王美原公園,山形県山形市蔵王松ヶ丘一丁目1の17,38.197734790571,140.31175621113,-,-,-,-,-,-,,,一時避難場所
山形県,尾花沢市,押切公民館,山形県尾花沢市大字押切254,38.624800293539,140.47753306884,1,0,0,-,-,-,20人,,一般避難所
山形県,東田川郡三川町,町民体育館,山形県東田川郡三川町横山字堤66番地1,38.78515442542,139.84585238014,1,0,0,0,1,0,,,避難場所
山形県,鶴岡市,上村活性化センター,山形県鶴岡市大網字大網149,38.592111185846,139.90158953527,1,0,0,-,-,-,51人,,１次避難場所・避難所
山形県,西村山郡朝日町,上郷地区集落センター,山形県西村山郡朝日町上郷869,38.27204065268,140.12625019802,1,0,0,-,-,-,20人,,避難所
山形県,酒田市,観音寺コミュニティセンター,山形県酒田市観音寺字寺ノ下41,38.97106542375,139.94283369039,1,0,0,1,1,0,,,収容避難所
山形県,上山市,宮川中学校,山形県上山市牧野字中原1945-2,38.112258355939,140.30014248948,-,-,-,-,-,-,,,一時避難場所
山形県,東置賜郡高畠町,糠野目小学校,山形県東置賜郡高畠町大字上平柳2070,37.992535538954,140.14327990534,1,0,0,-,-,-,,,指定収容避難所
山形県,最上郡真室川町,三滝公民館,山形県最上郡真室川町三沢,38.934155443555,140.24902083418,1,0,0,-,-,-,,,土砂災害時避難施設
山形県,東村山郡中山町,なかやま保育園,山形県東村山郡中山町大字柳沢2322-1,38.328566018036,140.25995249195,-,-,-,-,-,-,,,一時避難場所
山形県,新庄市,あたご町公民館,山形県新庄市愛宕ハイタウン内,38.777995039995,140.27069677486,1,0,0,-,-,-,,,指定避難場所・指定避難所
山形県,村山市,行川地区公民館,山形県村山市,38.505791511507,140.40535249855,-,-,-,-,-,-,,,避難場所
山形県,山形市,滝山コミュニティセンター（滝山交流センター）,山形県山形市上桜田一丁目17-26,38.221480639954,140.34048039365,1,0,0,-,-,-,,,避難所
山形県,酒田市,山形県庄内総合支庁産業経済部酒田農業技術普及課,山形県酒田市若浜町1-40,38.913363858039,139.84906407537,-,-,-,0,0,1,,,津波避難ビル
山形県,村山市,共栄公民館,山形県村山市,38.503979468206,140.34323400222,-,-,-,-,-,-,,,避難場所
山形県,寒河江市,本楯公園,山形県寒河江市本楯4丁目20番地の66,38.369103747541,140.29320136178,-,-,-,-,-,-,550人,,避難場所
山形県,山形市,城南公園,山形県山形市城南町三丁目151番,38.251956724698,140.32339028193,-,-,-,-,-,-,,,一時避難場所
山形県,上山市,あさひ保育園,山形県上山市旭町二丁目3-3,38.163726938844,140.28713489493,-,-,-,-,-,-,,,一時避難場所
山形県,酒田市,酒田市立亀城小学校体育館,山形県酒田市亀ケ崎2丁目3番55号,38.90644772175,139.84302169515,1,0,0,-,-,-,,,避難所
山形県,飽海郡遊佐町,杉沢分館,山形県飽海郡遊佐町杉沢字中田1,39.009842654902,139.96698473496,1,0,0,-,-,-,,,緊急避難場所
山形県,最上郡真室川町,平枝小学校,山形県最上郡真室川町差首鍋1763,38.938384876203,140.18248954296,1,0,0,-,-,-,,,土砂災害時避難施設
山形県,村山市,杉島公民館,山形県村山市,38.486153250816,140.35820323552,-,-,-,-,-,-,,,避難場所
山形県,最上郡戸沢村,いきいき百年の里ぽんぽ館,山形県最上郡戸沢村大字松坂155,38.78334906917,140.18377565783,1,0,0,1,1,0,,,避難施設
山形県,最上郡戸沢村,古口保育所,山形県最上郡戸沢村大字古口202-4,38.738253176872,140.14716691897,1,0,0,1,1,0,,,避難施設
山形県,米沢市,市営体育館,山形県米沢市金池3-1-62,37.920703565819,140.1164755364,1,0,0,-,-,-,940人,,指定避難場所・避難所
山形県,鶴岡市,越中山公民館,山形県鶴岡市越中山字村田66-67,38.610073730587,139.85214114958,1,0,0,-,-,-,45人,,１次避難場所・避難所
山形県,村山市,大倉小学校グラウンド,山形県村山市擶山48-7,38.506434715679,140.40360071874,1,0,0,-,-,-,,,収容避難所
山形県,尾花沢市,関谷公民館,山形県尾花沢市大字富山143-2,38.647453845415,140.48989786089,1,0,0,-,-,-,20人,,一般避難所
山形県,東根市,横町公民館,山形県東根市蟹沢324,38.435853231067,140.35952509225,1,0,0,1,0,0,,,一時避難所
山形県,村山市,新山中央広場,山形県村山市,38.502705855677,140.42104974006,-,-,-,-,-,-,,,避難場所
山形県,最上郡戸沢村,真柄公民館,山形県最上郡戸沢村大字古口698,38.732976268592,140.15963548806,1,0,0,0,1,0,,,一時避難施設
山形県,西置賜郡飯豊町,つばき保育園,山形県西置賜郡飯豊町大字椿3628-22,38.044495869237,139.99399470741,1,0,0,-,-,-,,,指定避難所
山形県,鶴岡市,宮田坂の上,山形県鶴岡市,38.684013798486,139.63612596726,-,-,-,-,-,-,,,津波避難場所
山形県,最上郡真室川町,安楽城地区公民館,山形県最上郡真室川町大向,38.887341999026,140.21342980707,1,0,0,-,-,-,,,土砂災害時避難施設
山形県,西村山郡朝日町,朝日町民体育館,山形県西村山郡朝日町宮宿1115,38.299294714498,140.14600007982,1,0,0,-,-,-,250人,,避難所
山形県,鶴岡市,鶴岡第二中学校,山形県鶴岡市宝田2丁目8-1,38.748256897175,139.83868594778,1,0,0,-,-,-,6044人,,１次避難場所・洪水避難場所・避難所
山形県,最上郡舟形町,長沢小学校,山形県最上郡舟形町長沢1072,38.710032546852,140.37337357514,1,0,0,-,-,-,10203人,,収容避難所・避難地
山形県,鶴岡市,京田小学校体育館,山形県鶴岡市高田字下村104,38.752135667455,139.80697554412,1,0,0,-,-,-,283人,,１次避難場所・洪水避難場所・避難所
山形県,村山市,ゲートボール場,山形県村山市,38.502805345291,140.42090954602,-,-,-,-,-,-,,,避難場所
山形県,鶴岡市,朝日庁舎南出張所,山形県鶴岡市上田沢字下中島25,38.518809132465,139.78811756592,1,0,0,-,-,-,81人,,１次避難場所・避難所
山形県,米沢市,山形大学工学部,山形県米沢市城南4-3-16、太田町4,37.899880741351,140.104175361,1,0,0,-,-,-,385人,,指定避難場所・避難所
山形県,東根市,東郷小学校,山形県東根市泉郷乙1922,38.420505066427,140.43538419775,1,0,0,1,1,0,412人,,収容避難所
山形県,山形市,こだま公園,山形県山形市小白川町四丁目28の1,38.244940065023,140.35633884158,-,-,-,-,-,-,,,一時避難場所
山形県,東田川郡三川町,三川町立東郷小学校,山形県東田川郡三川町大字神花字六瀬297,38.803537588212,139.84263469568,1,0,0,-,-,-,,,避難所
山形県,山形市,ひょうたん公園,山形県山形市元木一丁目6の1,38.225693485223,140.32397610808,-,-,-,-,-,-,,,一時避難場所
山形県,最上郡金山町,大柳公園,山形県最上郡金山町大字金山288-1,38.881570257344,140.33806177669,-,-,-,1,0,0,,,一時避難場所
山形県,上山市,鷺ヶ袋公園,山形県上山市旭町二丁目191-22,38.164452936597,140.28651521503,-,-,-,-,-,-,,,一時避難場所
山形県,山形市,福ノ神公園,山形県山形市小立四丁目180の1,38.227125031337,140.34985123835,-,-,-,-,-,-,,,一時避難場所
山形県,天童市,東芳賀公園,山形県天童市東芳賀三丁目6番,38.340696784833,140.36706716911,-,-,-,-,-,-,,,一時避難場所
山形県,山形市,高原中央公園,山形県山形市高原町字滝ノ沢239の241,38.274701200079,140.36955948375,-,-,-,-,-,-,,,一時避難場所
山形県,東根市,神町保育所,山形県東根市若木通り1丁目50,38.407634844102,140.39334107453,1,0,0,1,1,0,,,一時避難所
山形県,寒河江市,しらいわ保育所,山形県寒河江市大字白岩1296-2,38.408202818236,140.22840180234,1,0,0,-,-,-,33人,,避難場所・避難所
山形県,北村山郡大石田町,海谷公民館,山形県北村山郡大石田町大字海谷1105-46,38.618320674322,140.37124505172,1,0,0,-,-,-,,,避難所
山形県,西村山郡河北町,ひなの広場,山形県西村山郡河北町,38.430921355812,140.31818667098,-,-,-,-,-,-,,,避難場所
山形県,山形市,沖西公園,山形県山形市馬見ヶ崎二丁目14,38.282562731787,140.32825827414,-,-,-,-,-,-,,,一時避難場所
山形県,村山市,鶴ヶ町公民館前,山形県村山市,38.490084530165,140.39245750578,-,-,-,-,-,-,,,避難場所
山形県,西村山郡河北町,荒中公民館,山形県西村山郡河北町,38.419545929267,140.31690290382,1,0,0,-,-,-,,,一般避難地・収容施設
山形県,東田川郡庄内町,庄内町武道館,山形県東田川郡庄内町余目字猿田87,38.845828582052,139.90365059626,1,0,0,-,-,-,278人,,２次避難場所
山形県,鶴岡市,加茂浜山,山形県鶴岡市,38.763112550537,139.729162583,-,-,-,0,0,1,,,１次避難場所
山形県,西村山郡河北町,岩枝公民館,山形県西村山郡河北町,38.456814163793,140.31076539119,1,0,0,-,-,-,,,一般避難地・収容施設
山形県,鶴岡市,黒川下地区広場,山形県鶴岡市黒川字大杉285,38.676758769633,139.86885454255,-,-,-,-,-,-,3500人,,１次避難場所
山形県,西村山郡河北町,岩木三公民館,山形県西村山郡河北町,38.449039097685,140.31020640697,1,0,0,-,-,-,,,一般避難地・収容施設
山形県,米沢市,六郷小学校,山形県米沢市六郷町一漆40-1,37.962639959478,140.09253361267,1,0,0,-,-,-,234人,,指定避難場所・避難所
山形県,山形市,高楯中学校,山形県山形市大字中里38,38.302457213923,140.38174996367,1,0,0,-,-,-,,,一時避難場所・避難所
山形県,西村山郡河北町,山王公民館,山形県西村山郡河北町,38.419696300356,140.33447353571,1,0,0,-,-,-,,,一般避難地・収容施設
山形県,最上郡最上町,親清会館,山形県最上郡最上町大字志茂244-1,38.767050638237,140.47791556745,-,-,-,-,-,-,,,避難場所
山形県,山形市,立谷川運動広場,山形県山形市立谷川二丁目959,38.312833619927,140.37710189509,-,-,-,-,-,-,,,一時避難場所
山形県,鶴岡市,東部運動公園,山形県鶴岡市伊勢原町12-13,38.717854253795,139.85417942613,-,-,-,-,-,-,4900人,,１次避難場所
山形県,西村山郡河北町,栄町公民館,山形県西村山郡河北町,38.427750529402,140.30955774236,1,0,0,-,-,-,,,一般避難地・収容施設
山形県,東根市,小楯公民館,山形県東根市本丸南1丁目7-7,38.441550613877,140.40132033316,1,0,0,1,1,0,,,一時避難所
山形県,東村山郡中山町,中山公園,山形県東村山郡中山町大字長崎5081,38.341734453533,140.26734065258,-,-,-,-,-,-,,,一時避難場所
山形県,村山市,袖崎小学校,山形県村山市土生田263,38.543750922403,140.40009414317,1,0,0,-,-,-,,,避難場所・収容避難所
山形県,最上郡真室川町,新町公民館,山形県最上郡真室川町新町,38.85189069839,140.25081035964,1,0,0,-,-,-,,,土砂災害時避難施設
山形県,酒田市,内郷コミュニティセンター,山形県酒田市相沢字鶴牧56,38.875379311564,139.95187801227,1,0,0,1,1,0,,,収容避難所
山形県,尾花沢市,さくら保育園,山形県尾花沢市大字丹生180-5,38.623696647371,140.44648296586,1,0,0,-,-,-,29人,,指定避難所
山形県,村山市,大久保地区市民センター,山形県村山市大字大久保甲875-1,38.470310736042,140.3321091464,-,-,-,-,-,-,,,避難場所
山形県,東田川郡庄内町,生繰沢公民館前,山形県東田川郡庄内町,38.77317725582,140.01950464777,-,-,-,-,-,-,,,１次避難場所
山形県,東根市,岩崎公民館,山形県東根市猪野沢888,38.380234380064,140.4754179022,1,0,0,1,1,0,,,一時避難所
山形県,最上郡舟形町,農協集荷場前,山形県最上郡舟形町舟形281-25,38.691471536934,140.31886484379,-,-,-,-,-,-,2450人,,避難地
山形県,尾花沢市,尾花沢市立尾花沢中学校体育館,山形県尾花沢市横町2-2-80,38.608700647393,140.40908416681,1,0,0,-,-,-,487人,,指定避難所
山形県,東田川郡三川町,三川町高齢者若者センター,山形県東田川郡三川町大字横山字堤206,38.783890384531,139.84630296117,1,0,0,-,-,-,,,避難所
山形県,鶴岡市,八乙女分譲地,山形県鶴岡市由良3丁目14,38.722817775718,139.69187194396,-,-,-,0,0,1,100人,,１次避難場所・津波避難場所
山形県,山形市,西山形小学校,山形県山形市大字柏倉888,38.235641454484,140.26634211467,1,0,0,-,-,-,,,一時避難場所・避難所
山形県,西村山郡大江町,大江中学校,山形県西村山郡大江町本郷己605,38.373814845368,140.19274057875,1,0,0,-,-,-,262人,,避難場所・避難所
山形県,鶴岡市,三瀬駅前広場,山形県鶴岡市,38.69963884967,139.67351919626,-,-,-,0,0,1,,,１次避難場所
山形県,飽海郡遊佐町,升川公民館,山形県飽海郡遊佐町直世字村根130-1,39.062432559091,139.91069179837,1,0,0,-,-,-,,,緊急避難場所
山形県,東根市,東根温泉公民館,山形県東根市温泉町1丁目18-19,38.457168163894,140.39308473376,1,0,0,1,1,0,,,一時避難所
山形県,最上郡金山町,山形県立金山高等学校体育館,山形県最上郡金山町大字金山248番2号,38.876631549399,140.33597717946,1,0,0,-,-,-,,,避難所
山形県,西村山郡河北町,岩木二公民館,山形県西村山郡河北町,38.450540078136,140.3081238526,1,0,0,-,-,-,,,一般避難地・収容施設
山形県,東田川郡三川町,屋内多目的運動施設,山形県東田川郡三川町大字横山字堤215,38.78620652892,139.84806831365,1,0,0,-,-,-,,,避難所
山形県,東村山郡中山町,ひまわり温泉ゆ・ら・ら・合宿研修施設・交流広場,山形県東村山郡中山町いずみ1,38.341330066665,140.27543706761,1,0,0,-,-,-,1523人,,一時避難場所・収容避難所
山形県,尾花沢市,古殿公民館,山形県尾花沢市大字延沢2013,38.583227598276,140.44217466001,1,0,0,-,-,-,30人,,一般避難所
山形県,酒田市,平田農村環境改善センター,山形県酒田市飛鳥字契約場70-1,38.887032895912,139.92591575316,1,0,0,1,1,0,,,収容避難所
山形県,尾花沢市,中の段公民館,山形県尾花沢市新町5丁目5-3,38.609098086202,140.41880013552,1,0,0,-,-,-,20人,,一般避難所
山形県,鶴岡市,大網小学校体育館,山形県鶴岡市大網字興屋38-6,38.593044193269,139.8967455594,1,0,0,-,-,-,3558人,,１次避難場所・避難所
山形県,最上郡戸沢村,上松坂公民館,山形県最上郡戸沢村大字松坂1052,38.768903816295,140.19991085747,1,0,0,1,1,0,,,一時避難施設
山形県,天童市,柏木東公園,山形県天童市柏木町二丁目4番,38.370728185284,140.37125938316,-,-,-,-,-,-,,,一時避難場所
山形県,鶴岡市,新形公園,山形県鶴岡市新形町23-26,38.733136618995,139.82011257819,-,-,-,-,-,-,500人,,１次避難場所
山形県,西村山郡河北町,田中公園,山形県西村山郡河北町谷地中央1丁目2-4,38.421693159805,140.31206202592,-,-,-,-,-,-,,,広域避難場所
山形県,尾花沢市,銀山温泉会館,山形県尾花沢市大字銀山新畑445,38.569428793505,140.53133671507,1,0,0,-,-,-,30人,,一般避難所
山形県,東村山郡中山町,桜町児童遊園,山形県東村山郡中山町大字長崎8035-48,38.338412674434,140.27895903396,-,-,-,-,-,-,,,一時避難場所
山形県,鶴岡市,茅原公園,山形県鶴岡市茅原町12-13,38.753222117274,139.83821441409,-,-,-,-,-,-,600人,,１次避難場所
山形県,西村山郡河北町,ほこえ公園,山形県西村山郡河北町谷地字荒町東8-13,38.418026907098,140.31828674692,-,-,-,-,-,-,,,広域避難場所
山形県,最上郡戸沢村,下松坂公民館,山形県最上郡戸沢村大字松坂632-3,38.765581861476,140.19495023087,1,0,0,1,1,0,,,一時避難施設
山形県,村山市,南河島第一公民館,山形県村山市,38.479379551089,140.3562988873,-,-,-,-,-,-,,,避難場所
山形県,村山市,矢木沢公民館,山形県村山市,38.469108591897,140.30847629562,-,-,-,-,-,-,,,避難場所
山形県,新庄市,滝の倉公民館,山形県新庄市滝の倉5105-9,38.78740859744,140.27920429613,1,0,0,-,-,-,,,指定避難場所・指定避難所
山形県,山形市,西部北公園,山形県山形市下条町三丁目17,38.26772457977,140.32138482804,-,-,-,-,-,-,,,一時避難場所
山形県,天童市,藤ケ丘公園,山形県天童市大字清池,38.322115902398,140.36013911548,-,-,-,-,-,-,,,一時避難場所
山形県,最上郡舟形町,木友公民館,山形県最上郡舟形町舟形2079-6,38.689926767653,140.30539642018,1,0,0,-,-,-,108人,,収容避難所・避難地
山形県,鶴岡市,倉沢公民館,山形県鶴岡市倉沢字上ノ山口100,38.526230424144,139.77855134755,1,0,0,-,-,-,48人,,１次避難場所・避難所
山形県,鶴岡市,神社山かけ道,山形県鶴岡市,38.561858538511,139.55000084968,-,-,-,-,-,-,,,津波避難場所
山形県,鶴岡市,創造の森,山形県鶴岡市羽黒町川代字向山628,38.682012302618,139.92881530948,1,0,0,-,-,-,144人,,避難所
山形県,鶴岡市,小京田公民館前,山形県鶴岡市小京田47,38.760367490229,139.82333499508,-,-,-,-,-,-,100人,,１次避難場所
山形県,東田川郡庄内町,余目保育園,山形県東田川郡庄内町余目字町244,38.853091501063,139.90345533346,1,0,0,-,-,-,387人,,２次避難場所・予備施設
山形県,東根市,営団公民館,山形県東根市営団大通り47,38.410586118377,140.41443730847,1,0,0,1,1,0,,,一時避難所
山形県,天童市,千刈公園,山形県天童市泉町一丁目8番,38.363359195409,140.38269219123,-,-,-,-,-,-,,,一時避難場所
山形県,上山市,市民会館駐車場,山形県上山市元城内6-1,38.159535498935,140.27651930857,-,-,-,-,-,-,,,一時避難場所
山形県,東村山郡中山町,三軒屋公民館,山形県東村山郡中山町大字長崎1821-3,38.34206768618,140.30178452782,1,0,0,-,-,-,45人,,収容避難所
山形県,西村山郡河北町,中島公民館,山形県西村山郡河北町,38.417290632763,140.28411448877,1,0,0,-,-,-,,,一般避難地・収容施設
山形県,東根市,神町小学校,山形県東根市神町東二丁目6-1,38.407676418197,140.38158028696,1,0,0,1,1,0,1069人,,避難場所・収容避難所
山形県,東根市,西原公民館,山形県東根市関山1308,38.415778201246,140.47890042312,1,0,0,1,1,0,,,一時避難所
山形県,東根市,太田新田公民館,山形県東根市野川418,38.411765472248,140.42955503282,1,0,0,1,1,0,,,一時避難所
山形県,山形市,みずかみ第二公園,山形県山形市飯田二丁目4,38.216080712696,140.32906491109,-,-,-,-,-,-,,,一時避難場所
山形県,西村山郡河北町,高南公民館,山形県西村山郡河北町,38.413620207326,140.31998891835,1,0,0,-,-,-,,,一般避難地・収容施設
山形県,鶴岡市,矢引公民館,山形県鶴岡市矢引157,38.702358953227,139.71248199206,-,-,-,-,-,-,370人,,１次避難場所
山形県,寒河江市,西根小学校,山形県寒河江市西根170,38.383779761897,140.29028444469,1,0,0,-,-,-,284人,,避難場所・避難所
山形県,西村山郡西川町,志津駐車場,山形県西村山郡西川町大字志津62-1,38.49001894204,139.99924453182,-,-,-,-,-,-,,,１次避難場所
山形県,最上郡最上町,志茂公民館,山形県最上郡最上町大字志茂172,38.77206107897,140.47548506405,-,-,-,-,-,-,,,避難場所
山形県,鶴岡市,乗慶院境内,山形県鶴岡市湯野浜1丁目2-26,38.77870741706,139.75182593364,-,-,-,0,0,1,150人,,１次避難場所・津波避難場所
山形県,西村山郡朝日町,栄町公民館,山形県西村山郡朝日町宮宿804-1,38.300813894593,140.14367789171,1,0,0,-,-,-,25人,,避難所
山形県,鶴岡市,小松音吉宅,山形県鶴岡市,38.647140957919,139.59740079973,-,-,-,0,0,1,,,１次避難場所
山形県,東田川郡庄内町,本村?榎木公民館前広場,山形県東田川郡庄内町,38.86799972149,139.90483817809,-,-,-,-,-,-,,,１次避難場所
山形県,最上郡大蔵村,大蔵村赤松生涯学習センター体育館,山形県最上郡大蔵村大字赤松689-1,38.679763160352,140.24068208008,1,0,0,-,-,-,,,避難所
山形県,鶴岡市,湯野浜サンクス駐車場,山形県鶴岡市湯野浜1丁目2-26,38.785609533801,139.75873120874,-,-,-,0,0,1,200人,,１次避難場所・津波避難場所
山形県,鶴岡市,道形公園,山形県鶴岡市道形町22-2,38.742454672407,139.8460532353,-,-,-,-,-,-,1000人,,１次避難場所
山形県,寒河江市,南部地区公民館,山形県寒河江市島225,38.355083123314,140.27905880057,1,0,0,-,-,-,140人,,避難場所・避難所
山形県,東置賜郡高畠町,県立高畠高等学校,山形県東置賜郡高畠町大字一本柳2788,37.994319190791,140.15728435864,1,0,0,-,-,-,,,指定収容避難所
山形県,酒田市,滝の里ふれあい館,山形県酒田市升田字大西11-1,38.998559755535,140.04026722073,1,0,0,1,1,0,,,収容避難所
山形県,鶴岡市,鶴岡宝田体育館,山形県鶴岡市,38.747983915277,139.83728659451,1,0,0,0,1,0,,,洪水避難場所
山形県,山形市,天狗橋公園,山形県山形市北町二丁目13,38.269088179833,140.32828294566,-,-,-,-,-,-,,,一時避難場所
山形県,山形市,楯山小学校,山形県山形市大字青柳字一本木64,38.302253888684,140.36574855206,1,0,0,-,-,-,,,一時避難場所・避難所
山形県,鶴岡市,一霞公民館,山形県鶴岡市一霞字宮之前68,38.599981375634,139.64691829233,1,0,0,-,-,-,96人,,避難所
山形県,酒田市,勤労者体育センター,山形県酒田市緑町19-15,38.910183766504,139.85156664379,1,0,0,1,1,0,,,収容避難所
山形県,村山市,岩野ゲートボール場,山形県村山市,38.489956179664,140.30196280338,-,-,-,-,-,-,,,避難場所
山形県,村山市,冨本小学校グラウンド,山形県村山市大字湯野沢1129,38.475264298463,140.30254353053,-,-,-,-,-,-,,,避難場所
山形県,東置賜郡川西町,県立置賜農業高等学校,山形県東置賜郡川西町大字上小松3723,38.008061725919,140.03619540932,1,0,0,-,-,-,,,避難場所
山形県,村山市,大久保小学校グラウンド,山形県村山市大久保甲1-1,38.467318489022,140.32914939744,-,-,-,-,-,-,,,避難場所
山形県,村山市,中原公民館,山形県村山市,38.506330421427,140.37385245194,-,-,-,-,-,-,,,避難場所
山形県,酒田市,新堀コミュニティ防災センター,山形県酒田市木川字アラコウヤ34,38.868441518367,139.87698742237,1,0,0,1,1,1,,,収容避難所
山形県,東田川郡庄内町,桑田公民館前遊園地,山形県東田川郡庄内町,38.787676262387,139.94720266221,-,-,-,-,-,-,,,１次避難場所
山形県,酒田市,集合型ケビン,山形県酒田市草津字湯ノ台149,39.037197580721,140.0343521512,1,0,0,-,-,-,,,収容避難所
山形県,鶴岡市,日の出公園,山形県鶴岡市日出1丁目23-1,38.725134237936,139.84517677513,-,-,-,-,-,-,750人,,１次避難場所
山形県,村山市,東笛田遊園地,山形県村山市,38.476715732538,140.40212481773,-,-,-,-,-,-,,,避難場所
山形県,新庄市,二枚橋公民館,山形県新庄市萩野二枚橋158,38.841139143554,140.35360118447,1,0,0,-,-,-,,,指定避難場所・指定避難所
山形県,鶴岡市,宮沢公民館上,山形県鶴岡市,38.774881690468,139.74854511473,-,-,-,-,-,-,,,津波避難場所
山形県,鶴岡市,由良小学校,山形県鶴岡市由良1丁目21-70,38.717234966048,139.68636413538,1,0,0,-,-,-,161人,,１次避難場所・避難所
山形県,酒田市,北部農民センター,山形県酒田市本楯字新田目87-1,38.967864572814,139.88793058667,1,0,0,1,1,0,,,収容避難所
山形県,天童市,一ツ橋公園,山形県天童市東本町一丁目12番,38.361464500461,140.37547925566,-,-,-,-,-,-,,,一時避難場所
山形県,西村山郡河北町,山口公民館,山形県西村山郡河北町,38.455656195363,140.30209048152,1,0,0,-,-,-,,,一般避難地・収容施設
山形県,山形市,安堵橋公園,山形県山形市北町二丁目8,38.268334350142,140.32793546998,-,-,-,-,-,-,,,一時避難場所
山形県,北村山郡大石田町,庚申町公民館,山形県北村山郡大石田町大字大石田甲623-161,38.598826464461,140.37580114821,1,0,0,-,-,-,,,避難所
山形県,米沢市,第五中学校,山形県米沢市東大通1-1-82,37.886810847955,140.1380894866,1,0,0,-,-,-,350人,,指定避難場所・避難所
山形県,鶴岡市,とりのす公園,山形県鶴岡市城北町1-32,38.739267310189,139.82334973567,-,-,-,-,-,-,950人,,１次避難場所
山形県,山形市,長町熊野公園,山形県山形市長町三丁目13の3,38.294586995502,140.34094274577,-,-,-,-,-,-,,,一時避難場所
山形県,東田川郡庄内町,前田野目グラウンドゴルフ場,山形県東田川郡庄内町前田野目字前割45-1,38.800331536799,139.93526836952,-,-,-,-,-,-,,,１次避難場所
山形県,西置賜郡飯豊町,添川児童センター,山形県西置賜郡飯豊町大字添川2926-16,38.035608472499,140.0144321012,1,0,0,-,-,-,,,指定避難所
山形県,鶴岡市,民田集落広場,山形県鶴岡市民田字天王原16,38.702269014038,139.82486440247,-,-,-,-,-,-,495人,,１次避難場所
山形県,最上郡舟形町,海洋センター体育館前,山形県最上郡舟形町舟形448,38.689052072894,140.31180707933,-,-,-,-,-,-,1400人,,避難地
