都道府県,市区町村,避難所名,住所,緯度,経度,避難所,一時避難所,広域避難所,地震,風水害,津波,収容人数,備蓄品,備考
山形県,村山市,名取公民館,山形県村山市,38.501952530095,140.37369989519,-,-,-,-,-,-,,,避難場所
山形県,山形市,第九小学校,山形県山形市馬見ヶ崎二丁目5-1,38.279613548203,140.33011901126,1,0,0,-,-,-,,,一時避難場所・避難所
山形県,尾花沢市,尾花沢市立宮沢中学校体育館,山形県尾花沢市丹生1933,38.62462231309,140.4690782969,1,0,0,-,-,-,278人,,指定避難所
山形県,南陽市,南陽市武道館,山形県南陽市宮内3436-1,38.076307561052,140.13734932727,1,0,0,-,-,-,,,指定避難所
山形県,最上郡舟形町,堀内小学校,山形県最上郡舟形町堀内117,38.663007384545,140.27541353359,1,0,0,-,-,-,3169人,,収容避難所・避難地
山形県,鶴岡市,斉藤俊治宅前,山形県鶴岡市,38.743827855743,139.71299294553,-,-,-,-,-,-,,,津波避難場所
山形県,最上郡最上町,大堀保育所,山形県最上郡最上町大字志茂238,38.767761649062,140.47774894951,-,-,-,-,-,-,,,避難場所
山形県,西村山郡朝日町,送橋公民館,山形県西村山郡朝日町送橋188-乙,38.300532195826,140.17616216356,1,0,0,-,-,-,25人,,避難所
山形県,天童市,岡屋敷公園,山形県天童市長岡北一丁目8番6号,38.335246983823,140.36343292855,-,-,-,-,-,-,,,一時避難場所
山形県,上山市,宮生小学校,山形県上山市下生居字森752,38.129533977987,140.29584473852,-,-,-,-,-,-,,,一時避難場所
山形県,山形市,双葉公園,山形県山形市双葉町二丁目32の8,38.248484669507,140.32121922392,-,-,-,-,-,-,,,一時避難場所
山形県,鶴岡市,朝日青少年センター,山形県鶴岡市東岩本字野中146,38.625827971566,139.85177425058,1,0,0,-,-,-,290人,,避難所
山形県,鶴岡市,朝日東部公民館,山形県鶴岡市大網字土倉28-1,38.590383266005,139.89300699801,1,0,0,-,-,-,126人,,１次避難場所・避難所
山形県,最上郡大蔵村,肘折生涯学習センター体育館,山形県最上郡大蔵村大字南山2126-213,38.607276059139,140.16294315437,1,0,0,-,-,-,,,避難所
山形県,鶴岡市,鶴岡南高等学校（校舎・体育館）,山形県鶴岡市若葉町26-31,38.7301767599,139.82387500099,1,0,0,-,-,-,6300人,,１次避難場所・洪水避難場所・避難所
山形県,村山市,稲下会館,山形県村山市,38.487276233942,140.32937648689,-,-,-,-,-,-,,,避難場所
山形県,最上郡金山町,中田小学校体育館,山形県最上郡金山町中田637-2,38.921818527245,140.33629610315,1,0,0,1,0,0,,,一時避難場所・避難所
山形県,西村山郡朝日町,大谷六公民館,山形県西村山郡朝日町大谷1447-2,38.346222285888,140.16710980402,1,0,0,-,-,-,15人,,避難所
山形県,鶴岡市,八幡神社（合祀の宮）,山形県鶴岡市由良2丁目4-26,38.720160250074,139.68675514589,-,-,-,0,0,1,67人,,１次避難場所・津波避難場所
山形県,東田川郡三川町,ふれあい館,山形県東田川郡三川町大字横山字堤189-3,38.781732091806,139.84865716535,1,0,0,-,-,-,,,避難所
山形県,北村山郡大石田町,町道横内線羽黒山付近の広場,山形県北村山郡大石田町,38.579032447624,140.38822478192,-,-,-,0,1,0,,,緊急避難場所
山形県,東根市,原方公民館,山形県東根市中央東1丁目7-32,38.43442916362,140.4001204025,1,0,0,1,1,0,,,一時避難所
山形県,西村山郡河北町,あさひ公園,山形県西村山郡河北町谷地字荒町東22-4,38.419141513917,140.32074467499,-,-,-,-,-,-,,,広域避難場所
山形県,最上郡金山町,安沢地区農村公園,山形県最上郡金山町,38.868606457877,140.35602867504,-,-,-,1,0,0,,,一時避難場所
山形県,鶴岡市,大宝地公園,山形県鶴岡市大宝寺町19-1,38.738136862968,139.84476824809,-,-,-,-,-,-,450人,,１次避難場所
山形県,西村山郡河北町,3区公民館,山形県西村山郡河北町,38.393451043393,140.31077990196,1,0,0,-,-,-,,,一般避難地・収容施設
山形県,西村山郡河北町,旭町公民館,山形県西村山郡河北町,38.418990107395,140.31863750752,1,0,0,-,-,-,,,一般避難地・収容施設
山形県,鶴岡市,南部保育園庭,山形県鶴岡市美原町13-33,38.718488884164,139.81842748901,-,-,-,-,-,-,1050人,,１次避難場所
山形県,酒田市,黒森小学校,山形県酒田市黒森字一の木450,38.851145869472,139.82284060317,1,0,0,1,1,1,,,収容避難所
山形県,寒河江市,陵東中学校,山形県寒河江市西根430,38.392362879765,140.27795260029,1,0,0,-,-,-,340人,,避難場所・避難所
山形県,西村山郡朝日町,川通農村公園,山形県西村山郡朝日町玉ノ井丁270-1,38.326921461751,140.15573830679,-,-,-,-,-,-,,,一時避難地
山形県,北村山郡大石田町,白鷺公民館,山形県北村山郡大石田町字白鷺原1599番地の1,38.643271596754,140.33798004536,1,0,0,0,1,0,,,緊急避難場所・避難所
山形県,鶴岡市,宮名公民館,山形県鶴岡市大岩川字白岩410-3,38.610334169426,139.57639753872,1,0,0,-,-,-,41人,,避難所
山形県,鶴岡市,黄金小学校（校舎・体育館）,山形県鶴岡市青龍寺字北内48,38.689400192803,139.81428357378,1,0,0,-,-,-,282人,,１次避難場所・洪水避難場所・避難所
山形県,東田川郡三川町,三川町立横山小学校,山形県東田川郡三川町大字横山字大正140,38.777099447753,139.85287634126,1,0,0,-,-,-,,,避難所
山形県,東田川郡三川町,落合公民館前駐車場,山形県東田川郡三川町押切新田,38.826493428017,139.86712095365,-,-,-,-,-,-,,,１次避難場所
山形県,最上郡戸沢村,神田保育所,山形県最上郡戸沢村大字神田947-1,38.766402791012,140.17757966129,1,0,0,1,1,0,,,避難施設
山形県,東村山郡山辺町,相模公民館,山形県東村山郡山辺町大字根際2279-1,38.281073025736,140.25362818199,1,0,0,-,-,-,,,避難所
山形県,米沢市,置賜総合文化センター,山形県米沢市金池3-1-14,37.920023156625,140.11680055132,1,0,0,-,-,-,326人,,指定避難場所・避難所
山形県,鶴岡市,栄小学校（校舎）,山形県鶴岡市播磨字若松51-1,38.770398366178,139.82441520138,1,0,0,-,-,-,239人,,１次避難場所・洪水避難場所・避難所
山形県,村山市,新田公民館,山形県村山市,38.507313544956,140.3207476276,-,-,-,-,-,-,,,避難場所
山形県,鶴岡市,水無多目的集会施設,山形県鶴岡市三瀬字横町39-1,38.695102031283,139.67526635847,-,-,-,-,-,-,100人,,１次避難場所・津波避難場所
山形県,鶴岡市,錦町公園,山形県鶴岡市錦町9-3,38.737235991904,139.83188625589,-,-,-,-,-,-,1250人,,１次避難場所
山形県,米沢市,第一中学校,山形県米沢市駅前4-3-51,37.912257480189,140.12060070857,1,0,0,-,-,-,354人,,指定避難場所・避難所
山形県,上山市,長清水公園,山形県上山市矢来四丁目272-3,38.147653256814,140.27633207817,-,-,-,-,-,-,,,一時避難場所
山形県,鶴岡市,東北地区広場,山形県鶴岡市東荒屋字小島330-1,38.666036090475,139.85341802636,-,-,-,-,-,-,1350人,,１次避難場所
山形県,西村山郡河北町,吉野農村公園,山形県西村山郡河北町谷地2127,38.447670204569,140.33583205742,-,-,-,-,-,-,,,広域避難場所
山形県,米沢市,窪田小学校,山形県米沢市窪田町窪田655-3,37.958526534565,140.12106871884,1,0,0,-,-,-,228人,,指定避難場所・避難所
山形県,東田川郡庄内町,高田麦公民館地内公園,山形県東田川郡庄内町,38.837448918139,139.88484453872,-,-,-,-,-,-,,,１次避難場所
山形県,東田川郡庄内町,スーパーヤマザワ駐車場,山形県東田川郡庄内町余目字滑石38-1,38.845642270908,139.89815070386,-,-,-,-,-,-,,,１次避難場所
山形県,最上郡最上町,横川集会所,山形県最上郡最上町大字志茂804-9,38.781276626068,140.47103504621,-,-,-,-,-,-,,,避難場所
山形県,西村山郡大江町,左沢小学校,山形県西村山郡大江町左沢816-2,38.382136261547,140.20513449274,1,0,0,-,-,-,227人,,避難場所・避難所
山形県,米沢市,南部公園,山形県米沢市本町2-681-7,37.902868343874,140.10994602135,-,-,-,-,-,-,1200人,,１次避難場所
山形県,東置賜郡高畠町,高畠町営体育館,山形県東置賜郡高畠町大字高畠435,38.002879338861,140.19085012846,1,0,0,-,-,-,,,指定収容避難所
山形県,鶴岡市,西郷小学校（校舎・体育館）,山形県鶴岡市下川字樋渡100,38.780913298602,139.78598729785,1,0,0,-,-,-,383人,,洪水避難場所・避難所
山形県,山形市,鋳物町運動広場,山形県山形市鋳物町24,38.232391203902,140.28865386564,-,-,-,-,-,-,,,一時避難場所
山形県,山形市,第六小学校,山形県山形市鉄砲町二丁目9-55,38.238201017119,140.33343868058,1,0,0,-,-,-,,,一時避難場所・避難所
山形県,酒田市,松陵学区コミュニティ防災センター,山形県酒田市光ケ丘三丁目1-1,38.931794924724,139.83247321856,1,0,0,1,1,1,,,収容避難所
山形県,山形市,姫公園,山形県山形市あこや町三丁目39の7,38.242586189503,140.35595036829,-,-,-,-,-,-,,,一時避難場所
山形県,東村山郡山辺町,畑谷農村婦人の家,山形県東村山郡山辺町大字畑谷420-1,38.253895059855,140.18331882288,1,0,0,-,-,-,,,避難所
山形県,最上郡舟形町,沖の原公民館,山形県最上郡舟形町舟形2677-356,38.700842372144,140.31166783521,1,0,0,-,-,-,150人,,収容避難所
山形県,鶴岡市,藤島駅前広場,山形県鶴岡市上藤島字鎧田畑4-6,38.768831727445,139.89466155005,-,-,-,-,-,-,1750人,,１次避難場所
山形県,村山市,特養ふもと駐車場,山形県村山市,38.461747420621,140.30776405139,-,-,-,-,-,-,,,避難場所
山形県,山形市,あこや公園,山形県山形市小白川町一丁目7の1,38.246056823817,140.35290772127,-,-,-,-,-,-,,,一時避難場所
山形県,米沢市,日の出町児童遊園,山形県米沢市東大通2-9102-1,37.893521710201,140.13586820143,-,-,-,-,-,-,650人,,１次避難場所
山形県,東田川郡庄内町,余目第一公民館,山形県東田川郡庄内町余目字南田94番地1,38.841083990556,139.88578206937,1,0,0,-,-,-,229人,,１次避難場所・福祉避難所
山形県,東田川郡三川町,横川公民館,山形県東田川郡三川町,38.787423490147,139.88208505556,1,0,0,0,1,0,,,避難場所
山形県,鶴岡市,駅前公園,山形県鶴岡市末広町17-4,38.738974159679,139.83826305311,-,-,-,-,-,-,700人,,１次避難場所
山形県,東田川郡庄内町,清川福祉運動広場,山形県東田川郡庄内町清川字花崎57-8,38.787582497372,140.02531670626,-,-,-,-,-,-,,,１次避難場所
山形県,上山市,蔵王坊平駐車場,山形県上山市菖蒲外二字末沢山外42,38.122153552063,140.39567078027,-,-,-,-,-,-,,,一時避難場所
山形県,鶴岡市,渡前小学校体育館,山形県鶴岡市渡前字中屋敷1,38.752019701665,139.88646574996,1,0,0,-,-,-,4472人,,１次避難場所・避難所
山形県,新庄市,南部保育所,山形県新庄市下金沢町2-34,38.75652475066,140.3025194537,1,0,0,-,-,-,,,指定避難場所・指定避難所
山形県,北村山郡大石田町,川前公民館,山形県北村山郡大石田町川前55番地の5,38.613651128533,140.34995486321,1,0,0,0,1,0,,,緊急避難場所・避難所
山形県,東置賜郡高畠町,第二中学校,山形県東置賜郡高畠町大字深沼28-1,38.012648367829,140.17529373418,1,0,0,-,-,-,,,指定収容避難所
山形県,飽海郡遊佐町,町民体育館,山形県飽海郡遊佐町遊佐字鶴田29-2,39.012576827405,139.90919624542,1,0,0,-,-,-,,,緊急避難場所
山形県,山形市,篭田北公園,山形県山形市上町一丁目12の1,38.242460747864,140.31957411338,-,-,-,-,-,-,,,一時避難場所
山形県,米沢市,山上コミュニティセンター,山形県米沢市大字関根480,37.868182834414,140.14363443294,1,0,0,-,-,-,90人,,指定避難場所・避難所
山形県,東根市,本郷児童センター,山形県東根市温泉町1丁目12-1,38.456904208141,140.39053492145,1,0,0,1,1,0,,,一時避難所
山形県,東置賜郡高畠町,第三中学校,山形県東置賜郡高畠町大字元和田650,37.964006082302,140.18458601045,1,0,0,-,-,-,,,指定収容避難所
山形県,酒田市,第三中学校,山形県酒田市松原南13-1,38.900893040687,139.8521168501,1,0,0,1,1,1,,,収容避難所
山形県,東置賜郡川西町,県立総合コロニー希望が丘,山形県東置賜郡川西町大字下小松2045-20,38.041844569762,140.0406430489,1,0,0,-,-,-,,,避難場所
山形県,山形市,南小学校,山形県山形市青田二丁目1-1,38.225591044393,140.33231424969,1,0,0,-,-,-,,,一時避難場所・避難所
山形県,村山市,五日町児童遊園地,山形県村山市,38.479179973439,140.38668756271,-,-,-,-,-,-,,,避難場所
山形県,新庄市,山屋小学校,山形県新庄市金沢3036-2,38.767849284297,140.33323898593,-,-,-,-,-,-,,,指定避難場所
山形県,米沢市,米沢工業高校,山形県米沢市大字川井300,37.917437997619,140.14472287327,1,0,0,-,-,-,672人,,指定避難場所・避難所
山形県,西村山郡朝日町,高田公民館,山形県西村山郡朝日町三中丁63,38.309225857889,140.11601822923,1,0,0,-,-,-,10人,,避難所
山形県,鶴岡市,鈴公民館,山形県鶴岡市五十川字黒滝34,38.659110709843,139.60610266329,1,0,0,-,-,-,76人,,避難所
山形県,鶴岡市,沖田公民館,山形県鶴岡市東岩本字沖田71,38.631258027303,139.85354332504,1,0,0,-,-,-,41人,,１次避難場所・避難所
山形県,西村山郡大江町,西地区体育館,山形県西村山郡大江町貫見468-2,38.370666212368,140.09731970143,1,0,0,-,-,-,157人,,避難場所・避難所
山形県,最上郡最上町,最上町中央公民館,山形県最上郡最上町大字向町674,38.758988894692,140.51942581306,1,0,0,-,-,-,480人,,避難場所・指定避難所
山形県,鶴岡市,鳥居町北公園,山形県鶴岡市鳥居町4-1,38.732666721814,139.83959038357,-,-,-,-,-,-,650人,,１次避難場所
山形県,長井市,生涯学習プラザ,山形県長井市九野本1235-1,38.090242055343,140.02027054159,-,-,-,-,-,-,,,一時避難場所
山形県,西村山郡河北町,8区公民館,山形県西村山郡河北町,38.395201875057,140.31483651784,1,0,0,-,-,-,,,一般避難地・収容施設
山形県,南陽市,勤労青少年ホーム,山形県南陽市,38.05388153491,140.1494429318,1,0,0,-,-,-,,,指定避難所
山形県,鶴岡市,鶴岡第五中学校体育館,山形県鶴岡市大山字若柳271,38.755503647459,139.76927316014,1,0,0,-,-,-,7129人,,１次避難場所・避難所
山形県,鶴岡市,湯野浜コミュニティセンター,山形県鶴岡市湯野浜1丁目1-7,38.779810986951,139.7516465019,1,0,0,-,-,-,223人,,避難所
山形県,最上郡戸沢村,角川小学校,山形県最上郡戸沢村大字角川582,38.693554088081,140.15103892763,1,0,0,1,1,0,,,避難施設
山形県,東村山郡山辺町,町武道館,山形県東村山郡山辺町緑ケ丘1,38.287944828878,140.26159409106,1,0,0,-,-,-,,,避難所
山形県,鶴岡市,上田沢公民館,山形県鶴岡市上田沢字東ノ内11-2,38.521289472181,139.7897313192,1,0,0,-,-,-,82人,,１次避難場所・避難所
山形県,西村山郡朝日町,水本小学校グラウンド,山形県西村山郡朝日町水本620,38.252953307225,140.15479200334,-,-,-,-,-,-,,,一時避難地
山形県,村山市,駅西イベント広場（中町）,山形県村山市,38.477346280134,140.38564971302,-,-,-,-,-,-,,,避難場所
山形県,飽海郡遊佐町,鳥海山大物忌神社境内,山形県飽海郡遊佐町,39.074887661713,139.87884506336,-,-,-,0,0,1,,,津波避難場所
山形県,東田川郡庄内町,常万児童公園,山形県東田川郡庄内町,38.833614176257,139.91986247647,-,-,-,-,-,-,,,１次避難場所
山形県,村山市,大倉小学校体育館,山形県村山市大字たも山48-7,38.506130847965,140.40358433556,1,0,0,-,-,-,,,避難所
山形県,東根市,板垣新田公民館,山形県東根市板垣大通り44,38.409790188546,140.39297982016,1,0,0,1,1,0,,,一時避難所
山形県,西村山郡河北町,河北町民体育館,山形県西村山郡河北町谷地字所岡77,38.429850622433,140.3110506666,1,0,0,-,-,-,750人,,避難場所・収容避難施設
山形県,山形市,青田沼公園,山形県山形市上桜田一丁目4番1,38.225024983011,140.34379656715,-,-,-,-,-,-,,,一時避難場所
山形県,鶴岡市,櫛引西部児童館,山形県鶴岡市上山添字文栄1,38.679843070234,139.84501129727,1,0,0,-,-,-,266人,,避難所
山形県,最上郡舟形町,舟形小学校,山形県最上郡舟形町舟形4560,38.694418774834,140.32963606074,1,0,0,-,-,-,7834人,,収容避難所・避難地
山形県,鶴岡市,伊藤勝晴宅避難路,山形県鶴岡市由良1丁目2-21,38.716990548532,139.67678697407,-,-,-,-,-,-,30人,,１次避難場所
山形県,北村山郡大石田町,新山寺公民館,山形県北村山郡大石田町大字田沢1908-122,38.547619389282,140.37746268031,1,0,0,-,-,-,,,避難所
山形県,鶴岡市,平畑,山形県鶴岡市,38.687367162113,139.64190827341,-,-,-,0,0,1,,,１次避難場所・津波避難場所
山形県,米沢市,小野川町児童遊園,山形県米沢市小野川町2566-2,37.880688841712,140.05351470708,-,-,-,-,-,-,300人,,１次避難場所
山形県,西村山郡朝日町,朝日町立宮宿小学校体育館,山形県西村山郡朝日町大字宮宿1021,38.300894119652,140.15248495136,1,0,0,-,-,-,,,避難所
山形県,東田川郡庄内町,多目的集会所脇広場,山形県東田川郡庄内町,38.717581531408,140.0055245141,-,-,-,-,-,-,,,１次避難場所
山形県,鶴岡市,藤島小学校体育館,山形県鶴岡市藤の花2丁目1-1,38.770109598542,139.90578834438,1,0,0,-,-,-,8813人,,１次避難場所・避難所
山形県,西村山郡朝日町,上郷小学校グラウンド,山形県西村山郡朝日町上郷314,38.273383831932,140.13277746803,-,-,-,-,-,-,,,一時避難地
山形県,酒田市,上田コミュニティ防災センター,山形県酒田市上野曽根字上中割49,38.944109073008,139.88981214001,1,0,0,1,1,0,,,収容避難所
山形県,北村山郡大石田町,次年子公民館,山形県北村山郡大石田町大字次年子169-2,38.598973971656,140.29026030401,1,0,0,-,-,-,,,避難所
山形県,村山市,湯沢公民館前,山形県村山市,38.491988661372,140.40152133603,-,-,-,-,-,-,,,避難場所
山形県,西村山郡朝日町,朝日町立西五百川小学校,山形県西村山郡朝日町大字常盤い181-1,38.293709489904,140.12316299303,1,0,0,-,-,-,,,避難所
山形県,東田川郡庄内町,東本町集会所前,山形県東田川郡庄内町,38.789504780758,139.98139320209,-,-,-,-,-,-,,,１次避難場所
山形県,最上郡戸沢村,片倉公民館,山形県最上郡戸沢村大字角川1092,38.647574508252,140.17979023094,1,0,0,0,1,0,,,避難施設
山形県,新庄市,萩野児童センター,山形県新庄市大字萩野2652,38.813622522281,140.3612622429,1,0,0,-,-,-,,,指定避難場所・指定避難所
山形県,酒田市,酒田南高等学校,山形県酒田市南千日町4-50,38.925967870991,139.83885067042,1,0,0,1,1,1,,,収容避難所
山形県,天童市,本町公園,山形県天童市本町一丁目6番1号,38.361686030871,140.37006303069,-,-,-,-,-,-,,,一時避難場所
山形県,最上郡金山町,楢台公民館,山形県最上郡金山町,38.864941951597,140.3477831417,1,0,0,1,0,0,,,避難所
山形県,鶴岡市,湯野浜温泉神社,山形県鶴岡市,38.776196081045,139.75077614685,-,-,-,0,0,1,,,１次避難場所
山形県,最上郡舟形町,長沢駅前広場,山形県最上郡舟形町長沢2689-1,38.709593411471,140.36601425432,-,-,-,-,-,-,265人,,避難地
山形県,最上郡鮭川村,鮭川村立鮭川中学校体育館,山形県最上郡鮭川村大字庭月2510-1,38.831214081572,140.22920364748,1,0,0,-,-,-,,,避難所
山形県,東田川郡庄内町,吉岡農村公園,山形県東田川郡庄内町,38.825032256432,139.90613018769,-,-,-,-,-,-,,,１次避難場所
山形県,鶴岡市,大天魄神社,山形県鶴岡市,38.618762192149,139.58424810701,-,-,-,-,-,-,,,津波避難場所
山形県,村山市,ふれあい広場,山形県村山市,38.505826590301,140.397724862,-,-,-,-,-,-,,,避難場所
山形県,鶴岡市,前沢口,山形県鶴岡市,38.573981105335,139.56003451442,-,-,-,-,-,-,,,津波避難場所
山形県,山形市,花楯公園,山形県山形市花楯一丁目219,38.269520265373,140.34928306853,-,-,-,-,-,-,,,一時避難場所
山形県,東田川郡庄内町,杉浦公民館脇公園,山形県東田川郡庄内町,38.843186867441,139.87522003225,-,-,-,-,-,-,,,１次避難場所
山形県,山形市,南江俣公園,山形県山形市江南三丁目18の4,38.272524785234,140.31579936694,-,-,-,-,-,-,,,一時避難場所
山形県,尾花沢市,九日町公民館,山形県尾花沢市大字延沢926,38.570301919266,140.4595906071,1,0,0,-,-,-,20人,,一般避難所
山形県,新庄市,市民プラザ,山形県新庄市大手町1番60号,38.766079114259,140.29957499201,1,0,0,-,-,-,,,指定避難場所・指定避難所
山形県,酒田市,山形県立産業技術短期大学校庄内校体育館,山形県酒田市京田3丁目57番4号,38.876126131769,139.83463314407,1,0,0,-,-,-,,,避難所
山形県,鶴岡市,長谷川重宅上,山形県鶴岡市,38.686317226296,139.63943945903,-,-,-,0,0,1,,,１次避難場所
山形県,鶴岡市,やすらぎ公園,山形県鶴岡市茅原町24,38.753004677491,139.84084277274,-,-,-,-,-,-,750人,,１次避難場所
山形県,西村山郡河北町,要害公民館,山形県西村山郡河北町,38.414555099803,140.30593294522,1,0,0,-,-,-,,,一般避難地・収容施設
山形県,天童市,城山公園,山形県天童市五日町二丁目26番,38.352634832961,140.37231195382,-,-,-,-,-,-,,,一時避難場所
山形県,東田川郡庄内町,JA庄内たがわ立川基幹支所,山形県東田川郡庄内町狩川字小野里54,38.791713699496,139.97299923029,1,0,0,0,1,0,,,２次避難場所・予備施設
山形県,鶴岡市,小堅小学校,山形県鶴岡市堅苔沢字淵の上334,38.683061449781,139.63986366069,1,0,0,-,-,-,234人,,１次避難場所・避難所
山形県,山形市,飯田西の前第2公園,山形県山形市飯田西五丁目1730,38.210800649869,140.32045585921,-,-,-,-,-,-,,,一時避難場所
山形県,上山市,市民総合運動広場,山形県上山市長清水字鞍掛909,38.144789226843,140.2713688369,-,-,-,-,-,-,,,一時避難場所
山形県,西村山郡河北町,西里農村環境改善センター,山形県西村山郡河北町西里750-7,38.417762567535,140.28761948494,1,0,0,-,-,-,500人,,避難場所・収容避難施設
山形県,新庄市,本合海児童センター,山形県新庄市大字本合海182,38.727928868525,140.23251452765,1,0,0,-,-,-,,,指定避難場所・指定避難所
山形県,東村山郡中山町,元町公民館,山形県東村山郡中山町大字長崎225-5,38.33188273903,140.28119494586,1,0,0,-,-,-,37人,,収容避難所
山形県,西村山郡河北町,10区公民館,山形県西村山郡河北町,38.392744711387,140.31120208003,1,0,0,-,-,-,,,一般避難地・収容施設
山形県,最上郡真室川町,真室川北部小学校,山形県最上郡真室川町大字釜渕817-37,38.937645639904,140.26845437652,1,0,0,-,-,-,,,避難所
山形県,新庄市,塩野公民館,山形県新庄市萩野塩野319,38.828626077915,140.34380771115,1,0,0,-,-,-,,,指定避難場所・指定避難所
山形県,西村山郡朝日町,今平農村公園,山形県西村山郡朝日町今平2-1,38.244740025816,140.09087413317,-,-,-,-,-,-,,,一時避難地
山形県,東村山郡山辺町,役場作谷沢支所,山形県東村山郡山辺町大字簗沢3102-1,38.262202841903,140.19025130809,1,0,0,-,-,-,,,避難所
山形県,南陽市,中川公民館,山形県南陽市川樋6番地の2,38.093793375237,140.19986345939,1,0,0,-,-,-,,,指定避難所
山形県,米沢市,金池第2号公園,山形県米沢市金池2-9-1,37.919854815164,140.11379198136,-,-,-,-,-,-,1250人,,１次避難場所
山形県,最上郡舟形町,野ゲートボール場,山形県最上郡舟形町長沢,38.706038150262,140.36366613872,-,-,-,-,-,-,160人,,避難地
山形県,最上郡金山町,飛森公民館,山形県最上郡金山町,38.889345695398,140.32573446134,1,0,0,1,0,0,,,避難所
山形県,最上郡舟形町,福寿野ゲートボール場,山形県最上郡舟形町長者原845-3,38.69385041977,140.26423748738,-,-,-,-,-,-,650人,,避難地
山形県,北村山郡大石田町,上ノ原公民館,山形県北村山郡大石田町大字横山366-2,38.583403570563,140.37258800992,1,0,0,-,-,-,,,避難所
山形県,東根市,大林公民館,山形県東根市中央2丁目3-19,38.430912546741,140.38506519125,1,0,0,1,1,0,,,一時避難所
山形県,寒河江市,寒河江小学校,山形県寒河江市丸内1-3-8,38.376483191243,140.27956908862,1,0,0,-,-,-,312人,,避難場所・避難所
山形県,飽海郡遊佐町,吹浦小学校,山形県飽海郡遊佐町吹浦字西楯23-6,39.076640861802,139.8746393056,1,0,0,-,-,-,,,緊急避難場所・津波避難場所
山形県,東田川郡庄内町,清川八郎記念館前広場,山形県東田川郡庄内町,38.785018405257,140.02509409767,-,-,-,-,-,-,,,１次避難場所
山形県,西村山郡河北町,河北中学校,山形県西村山郡河北町谷地中央4-12-1,38.41869065314,140.31092888957,1,0,0,-,-,-,970人,,避難場所・収容避難施設
山形県,西村山郡西川町,川土居小学校グラウンド,山形県西村山郡西川町吉川671-1,38.412050710896,140.16638006043,-,-,-,-,-,-,,,１次避難場所
